C1: Critère | D1: ICM | E1: TM | F1: UM | G1: CM | H1: ICM | I1: TM | J1: UM | K1: CM
C2: Bound | D2: lower | E2: lower | F2: lower | G2: lower | H2: upper | I2: upper | J2: upper | K2: upper
A3: Vs | B3: Vs | C3: Mode de scrutin | D3: MCI | E3: MT | F3: MU | G3: MC | H3: MCI | I3: MT | J3: MU | K3: MC | L3: MCI | M3: MT | N3: MU | O3: MC | P3: toto | Q3: Show
A4: ICRV | B4: ICRV | C4: VTCI | D4: =GETPIVOTDATA("Somme de Rate ("&D$2&" bound)",Feuil1!$A$5,"Voting system",$A4,"Criterion",D$1) -> 0.24560000000000001 | E4: =GETPIVOTDATA("Somme de Rate ("&E$2&" bound)",Feuil1!$A$5,"Voting system",$A4,"Criterion",E$1) -> 0.27239999999999998 | F4: =GETPIVOTDATA("Somme de Rate ("&F$2&" bound)",Feuil1!$A$5,"Voting system",$A4,"Criterion",F$1) -> 0.27289999999999998 | G4: =GETPIVOTDATA("Somme de Rate ("&G$2&" bound)",Feuil1!$A$5,"Voting system",$A4,"Criterion",G$1) -> 0.27289999999999998 | H4: =GETPIVOTDATA("Somme de Rate ("&H$2&" bound)",Feuil1!$A$5,"Voting system",$A4,"Criterion",H$1) -> 0.24560000000000001 | I4: =GETPIVOTDATA("Somme de Rate ("&I$2&" bound)",Feuil1!$A$5,"Voting system",$A4,"Criterion",I$1) -> 0.27239999999999998 | J4: =GETPIVOTDATA("Somme de Rate ("&J$2&" bound)",Feuil1!$A$5,"Voting system",$A4,"Criterion",J$1) -> 0.27289999999999998 | K4: =GETPIVOTDATA("Somme de Rate ("&K$2&" bound)",Feuil1!$A$5,"Voting system",$A4,"Criterion",K$1) -> 0.99629999999999996 | L4: =H4-D4 -> 0 | M4: =I4-E4 -> 0 | N4: =J4-F4 -> 0 | O4: =K4-G4 -> 0.72340000000000004
A5: Absolute-Condorcet IRV | B5: C-IRV | C5: CVTI | D5: =GETPIVOTDATA("Somme de Rate ("&D$2&" bound)",Feuil1!$A$5,"Voting system",$A5,"Criterion",D$1) -> 0.24560000000000001 | E5: =GETPIVOTDATA("Somme de Rate ("&E$2&" bound)",Feuil1!$A$5,"Voting system",$A5,"Criterion",E$1) -> 0.27239999999999998 | F5: =GETPIVOTDATA("Somme de Rate ("&F$2&" bound)",Feuil1!$A$5,"Voting system",$A5,"Criterion",F$1) -> 0.27289999999999998 | G5: =GETPIVOTDATA("Somme de Rate ("&G$2&" bound)",Feuil1!$A$5,"Voting system",$A5,"Criterion",G$1) -> 0.43940000000000001 | H5: =GETPIVOTDATA("Somme de Rate ("&H$2&" bound)",Feuil1!$A$5,"Voting system",$A5,"Criterion",H$1) -> 0.24560000000000001 | I5: =GETPIVOTDATA("Somme de Rate ("&I$2&" bound)",Feuil1!$A$5,"Voting system",$A5,"Criterion",I$1) -> 0.27239999999999998 | J5: =F5 -> 0.27289999999999998 | K5: =GETPIVOTDATA("Somme de Rate ("&K$2&" bound)",Feuil1!$A$5,"Voting system",$A5,"Criterion",K$1) -> 0.43940000000000001 | L5: =H5-D5 -> 0 | M5: =I5-E5 -> 0 | N5: =J5-F5 -> 0 | O5: =K5-G5 -> 0 | P5: 1 | Q5: X
A6: IRV | B6: IRV | C6: VTI | D6: =GETPIVOTDATA("Somme de Rate ("&D$2&" bound)",Feuil1!$A$5,"Voting system",$A6,"Criterion",D$1) -> 0.32379999999999998 | E6: =GETPIVOTDATA("Somme de Rate ("&E$2&" bound)",Feuil1!$A$5,"Voting system",$A6,"Criterion",E$1) -> 0.33050000000000002 | F6: =GETPIVOTDATA("Somme de Rate ("&F$2&" bound)",Feuil1!$A$5,"Voting system",$A6,"Criterion",F$1) -> 0.33050000000000002 | G6: =GETPIVOTDATA("Somme de Rate ("&G$2&" bound)",Feuil1!$A$5,"Voting system",$A6,"Criterion",G$1) -> 0.43940000000000001 | H6: =GETPIVOTDATA("Somme de Rate ("&H$2&" bound)",Feuil1!$A$5,"Voting system",$A6,"Criterion",H$1) -> 0.32379999999999998 | I6: =GETPIVOTDATA("Somme de Rate ("&I$2&" bound)",Feuil1!$A$5,"Voting system",$A6,"Criterion",I$1) -> 0.33050000000000002 | J6: =GETPIVOTDATA("Somme de Rate ("&J$2&" bound)",Feuil1!$A$5,"Voting system",$A6,"Criterion",J$1) -> 0.33050000000000002 | K6: =GETPIVOTDATA("Somme de Rate ("&K$2&" bound)",Feuil1!$A$5,"Voting system",$A6,"Criterion",K$1) -> 0.43940000000000001 | L6: =H6-D6 -> 0 | M6: =I6-E6 -> 0 | N6: 0 | O6: =K6-G6 -> 0 | P6: 3 | Q6: X
A7: Exhaustive Ballot | B7: EB | C7: SE | D7: =GETPIVOTDATA("Somme de Rate ("&D$2&" bound)",Feuil1!$A$5,"Voting system",$A7,"Criterion",D$1) -> 0.32379999999999998 | E7: =GETPIVOTDATA("Somme de Rate ("&E$2&" bound)",Feuil1!$A$5,"Voting system",$A7,"Criterion",E$1) -> 0.33050000000000002 | F7: =GETPIVOTDATA("Somme de Rate ("&F$2&" bound)",Feuil1!$A$5,"Voting system",$A7,"Criterion",F$1) -> 0.33050000000000002 | G7: =GETPIVOTDATA("Somme de Rate ("&G$2&" bound)",Feuil1!$A$5,"Voting system",$A7,"Criterion",G$1) -> 0.44030000000000002 | H7: =GETPIVOTDATA("Somme de Rate ("&H$2&" bound)",Feuil1!$A$5,"Voting system",$A7,"Criterion",H$1) -> 0.32379999999999998 | I7: =GETPIVOTDATA("Somme de Rate ("&I$2&" bound)",Feuil1!$A$5,"Voting system",$A7,"Criterion",I$1) -> 0.33050000000000002 | J7: =GETPIVOTDATA("Somme de Rate ("&J$2&" bound)",Feuil1!$A$5,"Voting system",$A7,"Criterion",J$1) -> 0.33050000000000002 | K7: =GETPIVOTDATA("Somme de Rate ("&K$2&" bound)",Feuil1!$A$5,"Voting system",$A7,"Criterion",K$1) -> 0.44030000000000002 | L7: =H7-D7 -> 0 | M7: =I7-E7 -> 0 | N7: 0 | O7: =K7-G7 -> 0 | P7: 4 | Q7: X
A8: Two Round | B8: TRS | C8: U2T | D8: =GETPIVOTDATA("Somme de Rate ("&D$2&" bound)",Feuil1!$A$5,"Voting system",$A8,"Criterion",D$1) -> 0.3715 | E8: =GETPIVOTDATA("Somme de Rate ("&E$2&" bound)",Feuil1!$A$5,"Voting system",$A8,"Criterion",E$1) -> 0.3871 | F8: =GETPIVOTDATA("Somme de Rate ("&F$2&" bound)",Feuil1!$A$5,"Voting system",$A8,"Criterion",F$1) -> 0.3871 | G8: =GETPIVOTDATA("Somme de Rate ("&G$2&" bound)",Feuil1!$A$5,"Voting system",$A8,"Criterion",G$1) -> 0.69189999999999996 | H8: =GETPIVOTDATA("Somme de Rate ("&H$2&" bound)",Feuil1!$A$5,"Voting system",$A8,"Criterion",H$1) -> 0.3715 | I8: =GETPIVOTDATA("Somme de Rate ("&I$2&" bound)",Feuil1!$A$5,"Voting system",$A8,"Criterion",I$1) -> 0.3871 | J8: =GETPIVOTDATA("Somme de Rate ("&J$2&" bound)",Feuil1!$A$5,"Voting system",$A8,"Criterion",J$1) -> 0.3871 | K8: =GETPIVOTDATA("Somme de Rate ("&K$2&" bound)",Feuil1!$A$5,"Voting system",$A8,"Criterion",K$1) -> 0.69189999999999996 | L8: =H8-D8 -> 0 | M8: =I8-E8 -> 0 | N8: =J8-F8 -> 0 | O8: =K8-G8 -> 0 | P8: 5 | Q8: X
A9: Baldwin | B9: Baldwin | C9: Bald. | D9: =GETPIVOTDATA("Somme de Rate ("&D$2&" bound)",Feuil1!$A$5,"Voting system",$A9,"Criterion",D$1) -> 0.24560000000000001 | E9: =GETPIVOTDATA("Somme de Rate ("&E$2&" bound)",Feuil1!$A$5,"Voting system",$A9,"Criterion",E$1) -> 0.87050000000000005 | F9: =GETPIVOTDATA("Somme de Rate ("&F$2&" bound)",Feuil1!$A$5,"Voting system",$A9,"Criterion",F$1) -> 0.86580000000000001 | G9: =GETPIVOTDATA("Somme de Rate ("&G$2&" bound)",Feuil1!$A$5,"Voting system",$A9,"Criterion",G$1) -> 0.88280000000000003 | H9: =GETPIVOTDATA("Somme de Rate ("&H$2&" bound)",Feuil1!$A$5,"Voting system",$A9,"Criterion",H$1) -> 0.24560000000000001 | I9: =GETPIVOTDATA("Somme de Rate ("&I$2&" bound)",Feuil1!$A$5,"Voting system",$A9,"Criterion",I$1) -> 0.87050000000000005 | J9: =GETPIVOTDATA("Somme de Rate ("&J$2&" bound)",Feuil1!$A$5,"Voting system",$A9,"Criterion",J$1) -> 0.86580000000000001 | K9: =GETPIVOTDATA("Somme de Rate ("&K$2&" bound)",Feuil1!$A$5,"Voting system",$A9,"Criterion",K$1) -> 0.99629999999999996 | L9: =H9-D9 -> 0 | M9: =I9-E9 -> 0 | N9: =J9-F9 -> 0 | O9: =K9-G9 -> 0.11349999999999993 | Q9: X
A10: Veto | B10: Veto | C10: Veto | D10: =GETPIVOTDATA("Somme de Rate ("&D$2&" bound)",Feuil1!$A$5,"Voting system",$A10,"Criterion",D$1) -> 0 | E10: =GETPIVOTDATA("Somme de Rate ("&E$2&" bound)",Feuil1!$A$5,"Voting system",$A10,"Criterion",E$1) -> 3.44E-2 | F10: =GETPIVOTDATA("Somme de Rate ("&F$2&" bound)",Feuil1!$A$5,"Voting system",$A10,"Criterion",F$1) -> 3.44E-2 | G10: =GETPIVOTDATA("Somme de Rate ("&G$2&" bound)",Feuil1!$A$5,"Voting system",$A10,"Criterion",G$1) -> 0.90790000000000004 | H10: =GETPIVOTDATA("Somme de Rate ("&H$2&" bound)",Feuil1!$A$5,"Voting system",$A10,"Criterion",H$1) -> 0 | I10: =GETPIVOTDATA("Somme de Rate ("&I$2&" bound)",Feuil1!$A$5,"Voting system",$A10,"Criterion",I$1) -> 3.44E-2 | J10: =GETPIVOTDATA("Somme de Rate ("&J$2&" bound)",Feuil1!$A$5,"Voting system",$A10,"Criterion",J$1) -> 3.44E-2 | K10: =GETPIVOTDATA("Somme de Rate ("&K$2&" bound)",Feuil1!$A$5,"Voting system",$A10,"Criterion",K$1) -> 0.90790000000000004 | L10: =H10-D10 -> 0 | M10: =I10-E10 -> 0 | N10: =J10-F10 -> 0 | O10: =K10-G10 -> 0 | Q10: X
A11: Schulze | B11: Schulze | C11: Sch. | D11: =GETPIVOTDATA("Somme de Rate ("&D$2&" bound)",Feuil1!$A$5,"Voting system",$A11,"Criterion",D$1) -> 0.24560000000000001 | E11: =GETPIVOTDATA("Somme de Rate ("&E$2&" bound)",Feuil1!$A$5,"Voting system",$A11,"Criterion",E$1) -> 0.91469999999999996 | F11: =GETPIVOTDATA("Somme de Rate ("&F$2&" bound)",Feuil1!$A$5,"Voting system",$A11,"Criterion",F$1) -> 0.93059999999999998 | G11: =GETPIVOTDATA("Somme de Rate ("&G$2&" bound)",Feuil1!$A$5,"Voting system",$A11,"Criterion",G$1) -> 0.93059999999999998 | H11: =GETPIVOTDATA("Somme de Rate ("&H$2&" bound)",Feuil1!$A$5,"Voting system",$A11,"Criterion",H$1) -> 0.24560000000000001 | I11: =GETPIVOTDATA("Somme de Rate ("&I$2&" bound)",Feuil1!$A$5,"Voting system",$A11,"Criterion",I$1) -> 0.91469999999999996 | J11: =F11 -> 0.93059999999999998 | K11: =GETPIVOTDATA("Somme de Rate ("&K$2&" bound)",Feuil1!$A$5,"Voting system",$A11,"Criterion",K$1) -> 0.94869999999999999 | L11: =H11-D11 -> 0 | M11: =I11-E11 -> 0 | N11: =J11-F11 -> 0 | O11: =K11-G11 -> 1.8100000000000005E-2 | Q11: X
A12: Maximin | B12: Maximin | C12: Max. | D12: =GETPIVOTDATA("Somme de Rate ("&D$2&" bound)",Feuil1!$A$5,"Voting system",$A12,"Criterion",D$1) -> 0.24560000000000001 | E12: =GETPIVOTDATA("Somme de Rate ("&E$2&" bound)",Feuil1!$A$5,"Voting system",$A12,"Criterion",E$1) -> 0.91269999999999996 | F12: =GETPIVOTDATA("Somme de Rate ("&F$2&" bound)",Feuil1!$A$5,"Voting system",$A12,"Criterion",F$1) -> 0.92589999999999995 | G12: =GETPIVOTDATA("Somme de Rate ("&G$2&" bound)",Feuil1!$A$5,"Voting system",$A12,"Criterion",G$1) -> 0.93079999999999996 | H12: =GETPIVOTDATA("Somme de Rate ("&H$2&" bound)",Feuil1!$A$5,"Voting system",$A12,"Criterion",H$1) -> 0.24560000000000001 | I12: =GETPIVOTDATA("Somme de Rate ("&I$2&" bound)",Feuil1!$A$5,"Voting system",$A12,"Criterion",I$1) -> 0.91269999999999996 | J12: =GETPIVOTDATA("Somme de Rate ("&J$2&" bound)",Feuil1!$A$5,"Voting system",$A12,"Criterion",J$1) -> 0.92589999999999995 | K12: =GETPIVOTDATA("Somme de Rate ("&K$2&" bound)",Feuil1!$A$5,"Voting system",$A12,"Criterion",K$1) -> 0.93169999999999997 | L12: =H12-D12 -> 0 | M12: =I12-E12 -> 0 | N12: =J12-F12 -> 0 | O12: =K12-G12 -> 9.000000000000119E-4 | Q12: X
A13: IRV Duels | B13: IRVD | C13: VTID | D13: =GETPIVOTDATA("Somme de Rate ("&D$2&" bound)",Feuil1!$A$5,"Voting system",$A13,"Criterion",D$1) -> 0.24560000000000001 | E13: =GETPIVOTDATA("Somme de Rate ("&E$2&" bound)",Feuil1!$A$5,"Voting system",$A13,"Criterion",E$1) -> 0.89700000000000002 | F13: =GETPIVOTDATA("Somme de Rate ("&F$2&" bound)",Feuil1!$A$5,"Voting system",$A13,"Criterion",F$1) -> 0.93159999999999998 | G13: =GETPIVOTDATA("Somme de Rate ("&G$2&" bound)",Feuil1!$A$5,"Voting system",$A13,"Criterion",G$1) -> 0.93159999999999998 | H13: =GETPIVOTDATA("Somme de Rate ("&H$2&" bound)",Feuil1!$A$5,"Voting system",$A13,"Criterion",H$1) -> 0.24560000000000001 | I13: =GETPIVOTDATA("Somme de Rate ("&I$2&" bound)",Feuil1!$A$5,"Voting system",$A13,"Criterion",I$1) -> 0.89700000000000002 | J13: =GETPIVOTDATA("Somme de Rate ("&J$2&" bound)",Feuil1!$A$5,"Voting system",$A13,"Criterion",J$1) -> 0.93159999999999998 | K13: =GETPIVOTDATA("Somme de Rate ("&K$2&" bound)",Feuil1!$A$5,"Voting system",$A13,"Criterion",K$1) -> 0.99629999999999996 | L13: =H13-D13 -> 0 | M13: =I13-E13 -> 0 | N13: =J13-F13 -> 0 | O13: =K13-G13 -> 6.469999999999998E-2 | Q13: X
A14: Ranked Pairs | B14: RP | C14: PO | D14: =GETPIVOTDATA("Somme de Rate ("&D$2&" bound)",Feuil1!$A$5,"Voting system",$A14,"Criterion",D$1) -> 0.24560000000000001 | E14: =GETPIVOTDATA("Somme de Rate ("&E$2&" bound)",Feuil1!$A$5,"Voting system",$A14,"Criterion",E$1) -> 0.9274 | F14: =GETPIVOTDATA("Somme de Rate ("&F$2&" bound)",Feuil1!$A$5,"Voting system",$A14,"Criterion",F$1) -> 0.93379999999999996 | G14: =GETPIVOTDATA("Somme de Rate ("&G$2&" bound)",Feuil1!$A$5,"Voting system",$A14,"Criterion",G$1) -> 0.93379999999999996 | H14: =GETPIVOTDATA("Somme de Rate ("&H$2&" bound)",Feuil1!$A$5,"Voting system",$A14,"Criterion",H$1) -> 0.24560000000000001 | I14: =GETPIVOTDATA("Somme de Rate ("&I$2&" bound)",Feuil1!$A$5,"Voting system",$A14,"Criterion",I$1) -> 0.9274 | J14: =GETPIVOTDATA("Somme de Rate ("&J$2&" bound)",Feuil1!$A$5,"Voting system",$A14,"Criterion",J$1) -> 0.93379999999999996 | K14: =GETPIVOTDATA("Somme de Rate ("&K$2&" bound)",Feuil1!$A$5,"Voting system",$A14,"Criterion",K$1) -> 0.99629999999999996 | L14: =H14-D14 -> 0 | M14: =I14-E14 -> 0 | N14: =J14-F14 -> 0 | O14: =K14-G14 -> 6.25E-2 | Q14: X
A15: Nanson | B15: Nanson | C15: Nan. | D15: =GETPIVOTDATA("Somme de Rate ("&D$2&" bound)",Feuil1!$A$5,"Voting system",$A15,"Criterion",D$1) -> 0.24560000000000001 | E15: =GETPIVOTDATA("Somme de Rate ("&E$2&" bound)",Feuil1!$A$5,"Voting system",$A15,"Criterion",E$1) -> 0.95550000000000002 | F15: =GETPIVOTDATA("Somme de Rate ("&F$2&" bound)",Feuil1!$A$5,"Voting system",$A15,"Criterion",F$1) -> 0.96060000000000001 | G15: =GETPIVOTDATA("Somme de Rate ("&G$2&" bound)",Feuil1!$A$5,"Voting system",$A15,"Criterion",G$1) -> 0.96060000000000001 | H15: =GETPIVOTDATA("Somme de Rate ("&H$2&" bound)",Feuil1!$A$5,"Voting system",$A15,"Criterion",H$1) -> 0.24560000000000001 | I15: =GETPIVOTDATA("Somme de Rate ("&I$2&" bound)",Feuil1!$A$5,"Voting system",$A15,"Criterion",I$1) -> 0.95550000000000002 | J15: =GETPIVOTDATA("Somme de Rate ("&J$2&" bound)",Feuil1!$A$5,"Voting system",$A15,"Criterion",J$1) -> 0.96060000000000001 | K15: =GETPIVOTDATA("Somme de Rate ("&K$2&" bound)",Feuil1!$A$5,"Voting system",$A15,"Criterion",K$1) -> 0.99629999999999996 | L15: =H15-D15 -> 0 | M15: =I15-E15 -> 0 | N15: =J15-F15 -> 0 | O15: =K15-G15 -> 3.5699999999999954E-2 | Q15: X
A16: Kemeny | B16: Kemeny | C16: Kem. | D16: =GETPIVOTDATA("Somme de Rate ("&D$2&" bound)",Feuil1!$A$5,"Voting system",$A16,"Criterion",D$1) -> 0.24560000000000001 | E16: =GETPIVOTDATA("Somme de Rate ("&E$2&" bound)",Feuil1!$A$5,"Voting system",$A16,"Criterion",E$1) -> 0.96230000000000004 | F16: =GETPIVOTDATA("Somme de Rate ("&F$2&" bound)",Feuil1!$A$5,"Voting system",$A16,"Criterion",F$1) -> 0.96609999999999996 | G16: =GETPIVOTDATA("Somme de Rate ("&G$2&" bound)",Feuil1!$A$5,"Voting system",$A16,"Criterion",G$1) -> 0.96609999999999996 | H16: =GETPIVOTDATA("Somme de Rate ("&H$2&" bound)",Feuil1!$A$5,"Voting system",$A16,"Criterion",H$1) -> 0.24560000000000001 | I16: =GETPIVOTDATA("Somme de Rate ("&I$2&" bound)",Feuil1!$A$5,"Voting system",$A16,"Criterion",I$1) -> 0.96230000000000004 | J16: =GETPIVOTDATA("Somme de Rate ("&J$2&" bound)",Feuil1!$A$5,"Voting system",$A16,"Criterion",J$1) -> 0.96609999999999996 | K16: =GETPIVOTDATA("Somme de Rate ("&K$2&" bound)",Feuil1!$A$5,"Voting system",$A16,"Criterion",K$1) -> 0.99629999999999996 | L16: =H16-D16 -> 0 | M16: =I16-E16 -> 0 | N16: =J16-F16 -> 0 | O16: =K16-G16 -> 3.0200000000000005E-2 | Q16: X
A17: Condorcet Sum Defeats | B17: CSD | C17: CSD | D17: =GETPIVOTDATA("Somme de Rate ("&D$2&" bound)",Feuil1!$A$5,"Voting system",$A17,"Criterion",D$1) -> 0.24560000000000001 | E17: =GETPIVOTDATA("Somme de Rate ("&E$2&" bound)",Feuil1!$A$5,"Voting system",$A17,"Criterion",E$1) -> 0.95820000000000005 | F17: =GETPIVOTDATA("Somme de Rate ("&F$2&" bound)",Feuil1!$A$5,"Voting system",$A17,"Criterion",F$1) -> 0.97099999999999997 | G17: =GETPIVOTDATA("Somme de Rate ("&G$2&" bound)",Feuil1!$A$5,"Voting system",$A17,"Criterion",G$1) -> 0.97099999999999997 | H17: =GETPIVOTDATA("Somme de Rate ("&H$2&" bound)",Feuil1!$A$5,"Voting system",$A17,"Criterion",H$1) -> 0.24560000000000001 | I17: =GETPIVOTDATA("Somme de Rate ("&I$2&" bound)",Feuil1!$A$5,"Voting system",$A17,"Criterion",I$1) -> 0.95820000000000005 | J17: =GETPIVOTDATA("Somme de Rate ("&J$2&" bound)",Feuil1!$A$5,"Voting system",$A17,"Criterion",J$1) -> 0.97099999999999997 | K17: =GETPIVOTDATA("Somme de Rate ("&K$2&" bound)",Feuil1!$A$5,"Voting system",$A17,"Criterion",K$1) -> 0.99629999999999996 | L17: =H17-D17 -> 0 | M17: =I17-E17 -> 0 | N17: =J17-F17 -> 0 | O17: =K17-G17 -> 2.5299999999999989E-2 | Q17: X
A18: Bucklin | B18: Bucklin | C18: Buck. | D18: =GETPIVOTDATA("Somme de Rate ("&D$2&" bound)",Feuil1!$A$5,"Voting system",$A18,"Criterion",D$1) -> 0.45050000000000001 | E18: =GETPIVOTDATA("Somme de Rate ("&E$2&" bound)",Feuil1!$A$5,"Voting system",$A18,"Criterion",E$1) -> 0.93569999999999998 | F18: =GETPIVOTDATA("Somme de Rate ("&F$2&" bound)",Feuil1!$A$5,"Voting system",$A18,"Criterion",F$1) -> 0.93100000000000005 | G18: =GETPIVOTDATA("Somme de Rate ("&G$2&" bound)",Feuil1!$A$5,"Voting system",$A18,"Criterion",G$1) -> 0.97160000000000002 | H18: =GETPIVOTDATA("Somme de Rate ("&H$2&" bound)",Feuil1!$A$5,"Voting system",$A18,"Criterion",H$1) -> 0.45050000000000001 | I18: =GETPIVOTDATA("Somme de Rate ("&I$2&" bound)",Feuil1!$A$5,"Voting system",$A18,"Criterion",I$1) -> 0.93569999999999998 | J18: =GETPIVOTDATA("Somme de Rate ("&J$2&" bound)",Feuil1!$A$5,"Voting system",$A18,"Criterion",J$1) -> 0.93100000000000005 | K18: =GETPIVOTDATA("Somme de Rate ("&K$2&" bound)",Feuil1!$A$5,"Voting system",$A18,"Criterion",K$1) -> 0.97160000000000002 | L18: =H18-D18 -> 0 | M18: =I18-E18 -> 0 | N18: =J18-F18 -> 0 | O18: =K18-G18 -> 0 | Q18: X
A19: Majority Judgment | B19: MJ | C19: JM | D19: =GETPIVOTDATA("Somme de Rate ("&D$2&" bound)",Feuil1!$A$5,"Voting system",$A19,"Criterion",D$1) -> 0.49969999999999998 | E19: =GETPIVOTDATA("Somme de Rate ("&E$2&" bound)",Feuil1!$A$5,"Voting system",$A19,"Criterion",E$1) -> 0.98450000000000004 | F19: =GETPIVOTDATA("Somme de Rate ("&F$2&" bound)",Feuil1!$A$5,"Voting system",$A19,"Criterion",F$1) -> 0.98450000000000004 | G19: =GETPIVOTDATA("Somme de Rate ("&G$2&" bound)",Feuil1!$A$5,"Voting system",$A19,"Criterion",G$1) -> 0.98450000000000004 | H19: =GETPIVOTDATA("Somme de Rate ("&H$2&" bound)",Feuil1!$A$5,"Voting system",$A19,"Criterion",H$1) -> 0.49969999999999998 | I19: =GETPIVOTDATA("Somme de Rate ("&I$2&" bound)",Feuil1!$A$5,"Voting system",$A19,"Criterion",I$1) -> 0.98450000000000004 | J19: =GETPIVOTDATA("Somme de Rate ("&J$2&" bound)",Feuil1!$A$5,"Voting system",$A19,"Criterion",J$1) -> 0.98450000000000004 | K19: =GETPIVOTDATA("Somme de Rate ("&K$2&" bound)",Feuil1!$A$5,"Voting system",$A19,"Criterion",K$1) -> 0.98450000000000004 | L19: =H19-D19 -> 0 | M19: =I19-E19 -> 0 | N19: =J19-F19 -> 0 | O19: =K19-G19 -> 0 | Q19: X
A20: Plurality | B20: Plurality | C20: Uni. | D20: =GETPIVOTDATA("Somme de Rate ("&D$2&" bound)",Feuil1!$A$5,"Voting system",$A20,"Criterion",D$1) -> 0.54569999999999996 | E20: =GETPIVOTDATA("Somme de Rate ("&E$2&" bound)",Feuil1!$A$5,"Voting system",$A20,"Criterion",E$1) -> 0.98560000000000003 | F20: =GETPIVOTDATA("Somme de Rate ("&F$2&" bound)",Feuil1!$A$5,"Voting system",$A20,"Criterion",F$1) -> 0.98560000000000003 | G20: =GETPIVOTDATA("Somme de Rate ("&G$2&" bound)",Feuil1!$A$5,"Voting system",$A20,"Criterion",G$1) -> 0.98560000000000003 | H20: =GETPIVOTDATA("Somme de Rate ("&H$2&" bound)",Feuil1!$A$5,"Voting system",$A20,"Criterion",H$1) -> 0.54569999999999996 | I20: =GETPIVOTDATA("Somme de Rate ("&I$2&" bound)",Feuil1!$A$5,"Voting system",$A20,"Criterion",I$1) -> 0.98560000000000003 | J20: =GETPIVOTDATA("Somme de Rate ("&J$2&" bound)",Feuil1!$A$5,"Voting system",$A20,"Criterion",J$1) -> 0.98560000000000003 | K20: =GETPIVOTDATA("Somme de Rate ("&K$2&" bound)",Feuil1!$A$5,"Voting system",$A20,"Criterion",K$1) -> 0.98560000000000003 | L20: =H20-D20 -> 0 | M20: =I20-E20 -> 0 | N20: =J20-F20 -> 0 | O20: =K20-G20 -> 0 | Q20: X
A21: Iterated Bucklin | B21: IB | C21: BI | D21: =GETPIVOTDATA("Somme de Rate ("&D$2&" bound)",Feuil1!$A$5,"Voting system",$A21,"Criterion",D$1) -> 0.29399999999999998 | E21: =GETPIVOTDATA("Somme de Rate ("&E$2&" bound)",Feuil1!$A$5,"Voting system",$A21,"Criterion",E$1) -> 0.9657 | F21: =GETPIVOTDATA("Somme de Rate ("&F$2&" bound)",Feuil1!$A$5,"Voting system",$A21,"Criterion",F$1) -> 0.99070000000000003 | G21: =GETPIVOTDATA("Somme de Rate ("&G$2&" bound)",Feuil1!$A$5,"Voting system",$A21,"Criterion",G$1) -> 0.99080000000000001 | H21: =GETPIVOTDATA("Somme de Rate ("&H$2&" bound)",Feuil1!$A$5,"Voting system",$A21,"Criterion",H$1) -> 0.29399999999999998 | I21: =GETPIVOTDATA("Somme de Rate ("&I$2&" bound)",Feuil1!$A$5,"Voting system",$A21,"Criterion",I$1) -> 0.9657 | J21: =GETPIVOTDATA("Somme de Rate ("&J$2&" bound)",Feuil1!$A$5,"Voting system",$A21,"Criterion",J$1) -> 0.99070000000000003 | K21: =GETPIVOTDATA("Somme de Rate ("&K$2&" bound)",Feuil1!$A$5,"Voting system",$A21,"Criterion",K$1) -> 0.99960000000000004 | L21: =H21-D21 -> 0 | M21: =I21-E21 -> 0 | N21: =J21-F21 -> 0 | O21: =K21-G21 -> 8.80000000000003E-3 | Q21: X
A22: Approval | B22: Approval | C22: VA | D22: =GETPIVOTDATA("Somme de Rate ("&D$2&" bound)",Feuil1!$A$5,"Voting system",$A22,"Criterion",D$1) -> 0.53549999999999998 | E22: =GETPIVOTDATA("Somme de Rate ("&E$2&" bound)",Feuil1!$A$5,"Voting system",$A22,"Criterion",E$1) -> 0.99560000000000004 | F22: =GETPIVOTDATA("Somme de Rate ("&F$2&" bound)",Feuil1!$A$5,"Voting system",$A22,"Criterion",F$1) -> 0.99560000000000004 | G22: =GETPIVOTDATA("Somme de Rate ("&G$2&" bound)",Feuil1!$A$5,"Voting system",$A22,"Criterion",G$1) -> 0.99560000000000004 | H22: =GETPIVOTDATA("Somme de Rate ("&H$2&" bound)",Feuil1!$A$5,"Voting system",$A22,"Criterion",H$1) -> 0.53549999999999998 | I22: =GETPIVOTDATA("Somme de Rate ("&I$2&" bound)",Feuil1!$A$5,"Voting system",$A22,"Criterion",I$1) -> 0.99560000000000004 | J22: =GETPIVOTDATA("Somme de Rate ("&J$2&" bound)",Feuil1!$A$5,"Voting system",$A22,"Criterion",J$1) -> 0.99560000000000004 | K22: =GETPIVOTDATA("Somme de Rate ("&K$2&" bound)",Feuil1!$A$5,"Voting system",$A22,"Criterion",K$1) -> 0.99560000000000004 | L22: =H22-D22 -> 0 | M22: =I22-E22 -> 0 | N22: =J22-F22 -> 0 | O22: =K22-G22 -> 0 | Q22: X
A23: Range voting with average | B23: RV | C23: VN | D23: =GETPIVOTDATA("Somme de Rate ("&D$2&" bound)",Feuil1!$A$5,"Voting system",$A23,"Criterion",D$1) -> 0.41389999999999999 | E23: =GETPIVOTDATA("Somme de Rate ("&E$2&" bound)",Feuil1!$A$5,"Voting system",$A23,"Criterion",E$1) -> 0.99680000000000002 | F23: =GETPIVOTDATA("Somme de Rate ("&F$2&" bound)",Feuil1!$A$5,"Voting system",$A23,"Criterion",F$1) -> 0.99680000000000002 | G23: =GETPIVOTDATA("Somme de Rate ("&G$2&" bound)",Feuil1!$A$5,"Voting system",$A23,"Criterion",G$1) -> 0.99680000000000002 | H23: =GETPIVOTDATA("Somme de Rate ("&H$2&" bound)",Feuil1!$A$5,"Voting system",$A23,"Criterion",H$1) -> 0.41389999999999999 | I23: =GETPIVOTDATA("Somme de Rate ("&I$2&" bound)",Feuil1!$A$5,"Voting system",$A23,"Criterion",I$1) -> 0.99680000000000002 | J23: =GETPIVOTDATA("Somme de Rate ("&J$2&" bound)",Feuil1!$A$5,"Voting system",$A23,"Criterion",J$1) -> 0.99680000000000002 | K23: =GETPIVOTDATA("Somme de Rate ("&K$2&" bound)",Feuil1!$A$5,"Voting system",$A23,"Criterion",K$1) -> 0.99680000000000002 | L23: =H23-D23 -> 0 | M23: =I23-E23 -> 0 | N23: =J23-F23 -> 0 | O23: =K23-G23 -> 0 | Q23: X
A24: Borda | B24: Borda | C24: Bor. | D24: =GETPIVOTDATA("Somme de Rate ("&D$2&" bound)",Feuil1!$A$5,"Voting system",$A24,"Criterion",D$1) -> 2.9999999999999997E-4 | E24: =GETPIVOTDATA("Somme de Rate ("&E$2&" bound)",Feuil1!$A$5,"Voting system",$A24,"Criterion",E$1) -> 0.997 | F24: =GETPIVOTDATA("Somme de Rate ("&F$2&" bound)",Feuil1!$A$5,"Voting system",$A24,"Criterion",F$1) -> 0.99080000000000001 | G24: =GETPIVOTDATA("Somme de Rate ("&G$2&" bound)",Feuil1!$A$5,"Voting system",$A24,"Criterion",G$1) -> 0.997 | H24: =GETPIVOTDATA("Somme de Rate ("&H$2&" bound)",Feuil1!$A$5,"Voting system",$A24,"Criterion",H$1) -> 2.9999999999999997E-4 | I24: =GETPIVOTDATA("Somme de Rate ("&I$2&" bound)",Feuil1!$A$5,"Voting system",$A24,"Criterion",I$1) -> 0.997 | J24: =GETPIVOTDATA("Somme de Rate ("&J$2&" bound)",Feuil1!$A$5,"Voting system",$A24,"Criterion",J$1) -> 0.99080000000000001 | K24: =GETPIVOTDATA("Somme de Rate ("&K$2&" bound)",Feuil1!$A$5,"Voting system",$A24,"Criterion",K$1) -> 0.997 | L24: =H24-D24 -> 0 | M24: =I24-E24 -> 0 | N24: =J24-F24 -> 0 | O24: =K24-G24 -> 0 | Q24: X
A25: Coombs | B25: Coombs | C25: Coo. | D25: =GETPIVOTDATA("Somme de Rate ("&D$2&" bound)",Feuil1!$A$5,"Voting system",$A25,"Criterion",D$1) -> 0.3216 | E25: =GETPIVOTDATA("Somme de Rate ("&E$2&" bound)",Feuil1!$A$5,"Voting system",$A25,"Criterion",E$1) -> 0.99990000000000001 | F25: =GETPIVOTDATA("Somme de Rate ("&F$2&" bound)",Feuil1!$A$5,"Voting system",$A25,"Criterion",F$1) -> 1 | G25: =GETPIVOTDATA("Somme de Rate ("&G$2&" bound)",Feuil1!$A$5,"Voting system",$A25,"Criterion",G$1) -> 1 | H25: =GETPIVOTDATA("Somme de Rate ("&H$2&" bound)",Feuil1!$A$5,"Voting system",$A25,"Criterion",H$1) -> 0.3216 | I25: =GETPIVOTDATA("Somme de Rate ("&I$2&" bound)",Feuil1!$A$5,"Voting system",$A25,"Criterion",I$1) -> 0.99990000000000001 | J25: =GETPIVOTDATA("Somme de Rate ("&J$2&" bound)",Feuil1!$A$5,"Voting system",$A25,"Criterion",J$1) -> 1 | K25: =GETPIVOTDATA("Somme de Rate ("&K$2&" bound)",Feuil1!$A$5,"Voting system",$A25,"Criterion",K$1) -> 1 | L25: =H25-D25 -> 0 | M25: =I25-E25 -> 0 | N25: =J25-F25 -> 0 | O25: =K25-G25 -> 0 | Q25: X