A1: Voting system | B1: Criterion | C1: Algorithm parameters | D1: Computation time | E1: Rate (lower bound) | F1: Rate (upper bound) | G1: Number of populations | H1: V | I1: C | J1: Culture type | K1: Culture parameter 1 | L1: Culture parameter 1 value | M1: Culture parameter 2 | N1: Culture parameter 2 value | O1: Culture parameter 3 | P1: Culture parameter 3 value | Q1: Culture parameter 4 | R1: Culture parameter 4 value | S1: Incertitude
A2: Population | B2: exists_condorcet_admissible | E2: 0.75439999999999996 | F2: 0.75439999999999996 | G2: 10000 | H2: 33 | I2: 5 | J2: Spheroid | K2: Stretching | L2: 1 | S2: =F2-E2 -> 0
A3: Population | B3: exists_weak_condorcet_winner | E3: 0.75439999999999996 | F3: 0.75439999999999996 | G3: 10000 | H3: 33 | I3: 5 | J3: Spheroid | K3: Stretching | L3: 1 | S3: =F3-E3 -> 0
A4: Population | B4: exists_condorcet_winner_rk_ctb | E4: 0.75439999999999996 | F4: 0.75439999999999996 | G4: 10000 | H4: 33 | I4: 5 | J4: Spheroid | K4: Stretching | L4: 1 | S4: =F4-E4 -> 0
A5: Population | B5: exists_condorcet_winner_rk | E5: 0.75439999999999996 | F5: 0.75439999999999996 | G5: 10000 | H5: 33 | I5: 5 | J5: Spheroid | K5: Stretching | L5: 1 | S5: =F5-E5 -> 0
A6: Population | B6: exists_condorcet_winner_ut_rel_ctb | E6: 0.75439999999999996 | F6: 0.75439999999999996 | G6: 10000 | H6: 33 | I6: 5 | J6: Spheroid | K6: Stretching | L6: 1 | S6: =F6-E6 -> 0
A7: Population | B7: exists_condorcet_winner_ut_rel | E7: 0.75439999999999996 | F7: 0.75439999999999996 | G7: 10000 | H7: 33 | I7: 5 | J7: Spheroid | K7: Stretching | L7: 1 | S7: =F7-E7 -> 0
A8: Population | B8: exists_condorcet_winner_ut_abs_ctb | E8: 0.75439999999999996 | F8: 0.75439999999999996 | G8: 10000 | H8: 33 | I8: 5 | J8: Spheroid | K8: Stretching | L8: 1 | S8: =F8-E8 -> 0
A9: Population | B9: exists_condorcet_winner_ut_abs | E9: 0.75439999999999996 | F9: 0.75439999999999996 | G9: 10000 | H9: 33 | I9: 5 | J9: Spheroid | K9: Stretching | L9: 1 | S9: =F9-E9 -> 0
A10: Population | B10: exists_resistant_condorcet_winner | E10: 3.7000000000000002E-3 | F10: 3.7000000000000002E-3 | G10: 10000 | H10: 33 | I10: 5 | J10: Spheroid | K10: Stretching | L10: 1 | S10: =F10-E10 -> 0
A11: Population | B11: exists_condorcet_order_rk_ctb | E11: 0.53410000000000002 | F11: 0.53410000000000002 | G11: 10000 | H11: 33 | I11: 5 | J11: Spheroid | K11: Stretching | L11: 1 | S11: =F11-E11 -> 0
A12: Population | B12: exists_condorcet_order_rk | E12: 0.53410000000000002 | F12: 0.53410000000000002 | G12: 10000 | H12: 33 | I12: 5 | J12: Spheroid | K12: Stretching | L12: 1 | S12: =F12-E12 -> 0
A13: Population | B13: exists_condorcet_order_ut_rel_ctb | E13: 0.53410000000000002 | F13: 0.53410000000000002 | G13: 10000 | H13: 33 | I13: 5 | J13: Spheroid | K13: Stretching | L13: 1 | S13: =F13-E13 -> 0
A14: Population | B14: exists_condorcet_order_ut_rel | E14: 0.53410000000000002 | F14: 0.53410000000000002 | G14: 10000 | H14: 33 | I14: 5 | J14: Spheroid | K14: Stretching | L14: 1 | S14: =F14-E14 -> 0
A15: Population | B15: exists_condorcet_order_ut_abs_ctb | E15: 0.53410000000000002 | F15: 0.53410000000000002 | G15: 10000 | H15: 33 | I15: 5 | J15: Spheroid | K15: Stretching | L15: 1 | S15: =F15-E15 -> 0
A16: Population | B16: exists_condorcet_order_ut_abs | E16: 0.53410000000000002 | F16: 0.53410000000000002 | G16: 10000 | H16: 33 | I16: 5 | J16: Spheroid | K16: Stretching | L16: 1 | S16: =F16-E16 -> 0
A17: Population | B17: exists_majority_favorite_rk_ctb | E17: 4.0000000000000002E-4 | F17: 4.0000000000000002E-4 | G17: 10000 | H17: 33 | I17: 5 | J17: Spheroid | K17: Stretching | L17: 1 | S17: =F17-E17 -> 0
A18: Population | B18: exists_majority_favorite_rk | E18: 4.0000000000000002E-4 | F18: 4.0000000000000002E-4 | G18: 10000 | H18: 33 | I18: 5 | J18: Spheroid | K18: Stretching | L18: 1 | S18: =F18-E18 -> 0
A19: Population | B19: exists_majority_favorite_ut_ctb | E19: 4.0000000000000002E-4 | F19: 4.0000000000000002E-4 | G19: 10000 | H19: 33 | I19: 5 | J19: Spheroid | K19: Stretching | L19: 1 | S19: =F19-E19 -> 0
A20: Population | B20: exists_majority_favorite_ut | E20: 4.0000000000000002E-4 | F20: 4.0000000000000002E-4 | G20: 10000 | H20: 33 | I20: 5 | J20: Spheroid | K20: Stretching | L20: 1 | S20: =F20-E20 -> 0
A21: Population | B21: not_exists_condorcet_admissible | E21: 0.24560000000000001 | F21: 0.24560000000000001 | G21: 10000 | H21: 33 | I21: 5 | J21: Spheroid | K21: Stretching | L21: 1 | S21: =F21-E21 -> 0
A22: Population | B22: not_exists_weak_condorcet_winner | E22: 0.24560000000000001 | F22: 0.24560000000000001 | G22: 10000 | H22: 33 | I22: 5 | J22: Spheroid | K22: Stretching | L22: 1 | S22: =F22-E22 -> 0
A23: Population | B23: not_exists_condorcet_winner_rk_ctb | E23: 0.24560000000000001 | F23: 0.24560000000000001 | G23: 10000 | H23: 33 | I23: 5 | J23: Spheroid | K23: Stretching | L23: 1 | S23: =F23-E23 -> 0
A24: Population | B24: not_exists_condorcet_winner_rk | E24: 0.24560000000000001 | F24: 0.24560000000000001 | G24: 10000 | H24: 33 | I24: 5 | J24: Spheroid | K24: Stretching | L24: 1 | S24: =F24-E24 -> 0
A25: Population | B25: not_exists_condorcet_winner_ut_rel_ctb | E25: 0.24560000000000001 | F25: 0.24560000000000001 | G25: 10000 | H25: 33 | I25: 5 | J25: Spheroid | K25: Stretching | L25: 1 | S25: =F25-E25 -> 0
A26: Population | B26: not_exists_condorcet_winner_ut_rel | E26: 0.24560000000000001 | F26: 0.24560000000000001 | G26: 10000 | H26: 33 | I26: 5 | J26: Spheroid | K26: Stretching | L26: 1 | S26: =F26-E26 -> 0
A27: Population | B27: not_exists_condorcet_winner_ut_abs_ctb | E27: 0.24560000000000001 | F27: 0.24560000000000001 | G27: 10000 | H27: 33 | I27: 5 | J27: Spheroid | K27: Stretching | L27: 1 | S27: =F27-E27 -> 0
A28: Population | B28: not_exists_condorcet_winner_ut_abs | E28: 0.24560000000000001 | F28: 0.24560000000000001 | G28: 10000 | H28: 33 | I28: 5 | J28: Spheroid | K28: Stretching | L28: 1 | S28: =F28-E28 -> 0
A29: Population | B29: not_exists_resistant_condorcet_winner | E29: 0.99629999999999996 | F29: 0.99629999999999996 | G29: 10000 | H29: 33 | I29: 5 | J29: Spheroid | K29: Stretching | L29: 1 | S29: =F29-E29 -> 0
A30: Population | B30: not_exists_condorcet_order_rk_ctb | E30: 0.46589999999999998 | F30: 0.46589999999999998 | G30: 10000 | H30: 33 | I30: 5 | J30: Spheroid | K30: Stretching | L30: 1 | S30: =F30-E30 -> 0
A31: Population | B31: not_exists_condorcet_order_rk | E31: 0.46589999999999998 | F31: 0.46589999999999998 | G31: 10000 | H31: 33 | I31: 5 | J31: Spheroid | K31: Stretching | L31: 1 | S31: =F31-E31 -> 0
A32: Population | B32: not_exists_condorcet_order_ut_rel_ctb | E32: 0.46589999999999998 | F32: 0.46589999999999998 | G32: 10000 | H32: 33 | I32: 5 | J32: Spheroid | K32: Stretching | L32: 1 | S32: =F32-E32 -> 0
A33: Population | B33: not_exists_condorcet_order_ut_rel | E33: 0.46589999999999998 | F33: 0.46589999999999998 | G33: 10000 | H33: 33 | I33: 5 | J33: Spheroid | K33: Stretching | L33: 1 | S33: =F33-E33 -> 0
A34: Population | B34: not_exists_condorcet_order_ut_abs_ctb | E34: 0.46589999999999998 | F34: 0.46589999999999998 | G34: 10000 | H34: 33 | I34: 5 | J34: Spheroid | K34: Stretching | L34: 1 | S34: =F34-E34 -> 0
A35: Population | B35: not_exists_condorcet_order_ut_abs | E35: 0.46589999999999998 | F35: 0.46589999999999998 | G35: 10000 | H35: 33 | I35: 5 | J35: Spheroid | K35: Stretching | L35: 1 | S35: =F35-E35 -> 0
A36: Population | B36: not_exists_majority_favorite_rk_ctb | E36: 0.99960000000000004 | F36: 0.99960000000000004 | G36: 10000 | H36: 33 | I36: 5 | J36: Spheroid | K36: Stretching | L36: 1 | S36: =F36-E36 -> 0
A37: Population | B37: not_exists_majority_favorite_rk | E37: 0.99960000000000004 | F37: 0.99960000000000004 | G37: 10000 | H37: 33 | I37: 5 | J37: Spheroid | K37: Stretching | L37: 1 | S37: =F37-E37 -> 0
A38: Population | B38: not_exists_majority_favorite_ut_ctb | E38: 0.99960000000000004 | F38: 0.99960000000000004 | G38: 10000 | H38: 33 | I38: 5 | J38: Spheroid | K38: Stretching | L38: 1 | S38: =F38-E38 -> 0
A39: Population | B39: not_exists_majority_favorite_ut | E39: 0.99960000000000004 | F39: 0.99960000000000004 | G39: 10000 | H39: 33 | I39: 5 | J39: Spheroid | K39: Stretching | L39: 1 | S39: =F39-E39 -> 0
A40: Approval | B40: w_is_condorcet_admissible | E40: 0.46450000000000002 | F40: 0.46450000000000002 | G40: 10000 | H40: 33 | I40: 5 | J40: Spheroid | K40: Stretching | L40: 1 | S40: =F40-E40 -> 0
A41: Approval | B41: w_is_not_condorcet_admissible | E41: 0.53549999999999998 | F41: 0.53549999999999998 | G41: 10000 | H41: 33 | I41: 5 | J41: Spheroid | K41: Stretching | L41: 1 | S41: =F41-E41 -> 0
A42: Approval | B42: w_missed_condorcet_admissible | E42: 0.28989999999999999 | F42: 0.28989999999999999 | G42: 10000 | H42: 33 | I42: 5 | J42: Spheroid | K42: Stretching | L42: 1 | S42: =F42-E42 -> 0
A43: Approval | B43: w_is_weak_condorcet_winner | E43: 0.46450000000000002 | F43: 0.46450000000000002 | G43: 10000 | H43: 33 | I43: 5 | J43: Spheroid | K43: Stretching | L43: 1 | S43: =F43-E43 -> 0
A44: Approval | B44: w_is_not_weak_condorcet_winner | E44: 0.53549999999999998 | F44: 0.53549999999999998 | G44: 10000 | H44: 33 | I44: 5 | J44: Spheroid | K44: Stretching | L44: 1 | S44: =F44-E44 -> 0
A45: Approval | B45: w_missed_weak_condorcet_winner | E45: 0.28989999999999999 | F45: 0.28989999999999999 | G45: 10000 | H45: 33 | I45: 5 | J45: Spheroid | K45: Stretching | L45: 1 | S45: =F45-E45 -> 0
A46: Approval | B46: w_is_condorcet_winner_rk_ctb | E46: 0.46450000000000002 | F46: 0.46450000000000002 | G46: 10000 | H46: 33 | I46: 5 | J46: Spheroid | K46: Stretching | L46: 1 | S46: =F46-E46 -> 0
A47: Approval | B47: w_is_not_condorcet_winner_rk_ctb | E47: 0.53549999999999998 | F47: 0.53549999999999998 | G47: 10000 | H47: 33 | I47: 5 | J47: Spheroid | K47: Stretching | L47: 1 | S47: =F47-E47 -> 0
A48: Approval | B48: w_missed_condorcet_winner_rk_ctb | E48: 0.28989999999999999 | F48: 0.28989999999999999 | G48: 10000 | H48: 33 | I48: 5 | J48: Spheroid | K48: Stretching | L48: 1 | S48: =F48-E48 -> 0
A49: Approval | B49: w_is_condorcet_winner_rk | E49: 0.46450000000000002 | F49: 0.46450000000000002 | G49: 10000 | H49: 33 | I49: 5 | J49: Spheroid | K49: Stretching | L49: 1 | S49: =F49-E49 -> 0
A50: Approval | B50: w_is_not_condorcet_winner_rk | E50: 0.53549999999999998 | F50: 0.53549999999999998 | G50: 10000 | H50: 33 | I50: 5 | J50: Spheroid | K50: Stretching | L50: 1 | S50: =F50-E50 -> 0
A51: Approval | B51: w_missed_condorcet_winner_rk | E51: 0.28989999999999999 | F51: 0.28989999999999999 | G51: 10000 | H51: 33 | I51: 5 | J51: Spheroid | K51: Stretching | L51: 1 | S51: =F51-E51 -> 0
A52: Approval | B52: w_is_condorcet_winner_ut_rel_ctb | E52: 0.46450000000000002 | F52: 0.46450000000000002 | G52: 10000 | H52: 33 | I52: 5 | J52: Spheroid | K52: Stretching | L52: 1 | S52: =F52-E52 -> 0
A53: Approval | B53: w_is_not_condorcet_winner_ut_rel_ctb | E53: 0.53549999999999998 | F53: 0.53549999999999998 | G53: 10000 | H53: 33 | I53: 5 | J53: Spheroid | K53: Stretching | L53: 1 | S53: =F53-E53 -> 0
A54: Approval | B54: w_missed_condorcet_winner_ut_rel_ctb | E54: 0.28989999999999999 | F54: 0.28989999999999999 | G54: 10000 | H54: 33 | I54: 5 | J54: Spheroid | K54: Stretching | L54: 1 | S54: =F54-E54 -> 0
A55: Approval | B55: w_is_condorcet_winner_ut_rel | E55: 0.46450000000000002 | F55: 0.46450000000000002 | G55: 10000 | H55: 33 | I55: 5 | J55: Spheroid | K55: Stretching | L55: 1 | S55: =F55-E55 -> 0
A56: Approval | B56: w_is_not_condorcet_winner_ut_rel | E56: 0.53549999999999998 | F56: 0.53549999999999998 | G56: 10000 | H56: 33 | I56: 5 | J56: Spheroid | K56: Stretching | L56: 1 | S56: =F56-E56 -> 0
A57: Approval | B57: w_missed_condorcet_winner_ut_rel | E57: 0.28989999999999999 | F57: 0.28989999999999999 | G57: 10000 | H57: 33 | I57: 5 | J57: Spheroid | K57: Stretching | L57: 1 | S57: =F57-E57 -> 0
A58: Approval | B58: w_is_condorcet_winner_ut_abs_ctb | E58: 0.46450000000000002 | F58: 0.46450000000000002 | G58: 10000 | H58: 33 | I58: 5 | J58: Spheroid | K58: Stretching | L58: 1 | S58: =F58-E58 -> 0
A59: Approval | B59: w_is_not_condorcet_winner_ut_abs_ctb | E59: 0.53549999999999998 | F59: 0.53549999999999998 | G59: 10000 | H59: 33 | I59: 5 | J59: Spheroid | K59: Stretching | L59: 1 | S59: =F59-E59 -> 0
A60: Approval | B60: w_missed_condorcet_winner_ut_abs_ctb | E60: 0.28989999999999999 | F60: 0.28989999999999999 | G60: 10000 | H60: 33 | I60: 5 | J60: Spheroid | K60: Stretching | L60: 1 | S60: =F60-E60 -> 0
A61: Approval | B61: w_is_condorcet_winner_ut_abs | E61: 0.46450000000000002 | F61: 0.46450000000000002 | G61: 10000 | H61: 33 | I61: 5 | J61: Spheroid | K61: Stretching | L61: 1 | S61: =F61-E61 -> 0
A62: Approval | B62: w_is_not_condorcet_winner_ut_abs | E62: 0.53549999999999998 | F62: 0.53549999999999998 | G62: 10000 | H62: 33 | I62: 5 | J62: Spheroid | K62: Stretching | L62: 1 | S62: =F62-E62 -> 0
A63: Approval | B63: w_missed_condorcet_winner_ut_abs | E63: 0.28989999999999999 | F63: 0.28989999999999999 | G63: 10000 | H63: 33 | I63: 5 | J63: Spheroid | K63: Stretching | L63: 1 | S63: =F63-E63 -> 0
A64: Approval | B64: w_is_resistant_condorcet_winner | E64: 3.5999999999999999E-3 | F64: 3.5999999999999999E-3 | G64: 10000 | H64: 33 | I64: 5 | J64: Spheroid | K64: Stretching | L64: 1 | S64: =F64-E64 -> 0
A65: Approval | B65: w_is_not_resistant_condorcet_winner | E65: 0.99639999999999995 | F65: 0.99639999999999995 | G65: 10000 | H65: 33 | I65: 5 | J65: Spheroid | K65: Stretching | L65: 1 | S65: =F65-E65 -> 0
A66: Approval | B66: w_missed_resistant_condorcet_winner | E66: 1E-4 | F66: 1E-4 | G66: 10000 | H66: 33 | I66: 5 | J66: Spheroid | K66: Stretching | L66: 1 | S66: =F66-E66 -> 0
A67: Approval | B67: TM | C67: CM_option = exact | D67: 2.8631959999999999 | E67: 0.99560000000000004 | F67: 0.99560000000000004 | G67: 10000 | H67: 33 | I67: 5 | J67: Spheroid | K67: Stretching | L67: 1 | S67: =F67-E67 -> 0
A68: Approval | B68: UM | C68: CM_option = exact | D68: 0.24501400000000001 | E68: 0.99560000000000004 | F68: 0.99560000000000004 | G68: 10000 | H68: 33 | I68: 5 | J68: Spheroid | K68: Stretching | L68: 1 | S68: =F68-E68 -> 0
A69: Approval | B69: ICM | C69: ICM_option = exact | D69: 0.93006 | E69: 0.53549999999999998 | F69: 0.53549999999999998 | G69: 10000 | H69: 33 | I69: 5 | J69: Spheroid | K69: Stretching | L69: 1 | S69: =F69-E69 -> 0
A70: Approval | B70: CM | C70: CM_option = exact | D70: 0.227016 | E70: 0.99560000000000004 | F70: 0.99560000000000004 | G70: 10000 | H70: 33 | I70: 5 | J70: Spheroid | K70: Stretching | L70: 1 | S70: =F70-E70 -> 0
A71: Baldwin | B71: w_is_condorcet_admissible | E71: 0.75439999999999996 | F71: 0.75439999999999996 | G71: 10000 | H71: 33 | I71: 5 | J71: Spheroid | K71: Stretching | L71: 1 | S71: =F71-E71 -> 0
A72: Baldwin | B72: w_is_not_condorcet_admissible | E72: 0.24560000000000001 | F72: 0.24560000000000001 | G72: 10000 | H72: 33 | I72: 5 | J72: Spheroid | K72: Stretching | L72: 1 | S72: =F72-E72 -> 0
A73: Baldwin | B73: w_missed_condorcet_admissible | E73: 0 | F73: 0 | G73: 10000 | H73: 33 | I73: 5 | J73: Spheroid | K73: Stretching | L73: 1 | S73: =F73-E73 -> 0
A74: Baldwin | B74: w_is_weak_condorcet_winner | E74: 0.75439999999999996 | F74: 0.75439999999999996 | G74: 10000 | H74: 33 | I74: 5 | J74: Spheroid | K74: Stretching | L74: 1 | S74: =F74-E74 -> 0
A75: Baldwin | B75: w_is_not_weak_condorcet_winner | E75: 0.24560000000000001 | F75: 0.24560000000000001 | G75: 10000 | H75: 33 | I75: 5 | J75: Spheroid | K75: Stretching | L75: 1 | S75: =F75-E75 -> 0
A76: Baldwin | B76: w_missed_weak_condorcet_winner | E76: 0 | F76: 0 | G76: 10000 | H76: 33 | I76: 5 | J76: Spheroid | K76: Stretching | L76: 1 | S76: =F76-E76 -> 0
A77: Baldwin | B77: w_is_condorcet_winner_rk_ctb | E77: 0.75439999999999996 | F77: 0.75439999999999996 | G77: 10000 | H77: 33 | I77: 5 | J77: Spheroid | K77: Stretching | L77: 1 | S77: =F77-E77 -> 0
A78: Baldwin | B78: w_is_not_condorcet_winner_rk_ctb | E78: 0.24560000000000001 | F78: 0.24560000000000001 | G78: 10000 | H78: 33 | I78: 5 | J78: Spheroid | K78: Stretching | L78: 1 | S78: =F78-E78 -> 0
A79: Baldwin | B79: w_missed_condorcet_winner_rk_ctb | E79: 0 | F79: 0 | G79: 10000 | H79: 33 | I79: 5 | J79: Spheroid | K79: Stretching | L79: 1 | S79: =F79-E79 -> 0
A80: Baldwin | B80: w_is_condorcet_winner_rk | E80: 0.75439999999999996 | F80: 0.75439999999999996 | G80: 10000 | H80: 33 | I80: 5 | J80: Spheroid | K80: Stretching | L80: 1 | S80: =F80-E80 -> 0
A81: Baldwin | B81: w_is_not_condorcet_winner_rk | E81: 0.24560000000000001 | F81: 0.24560000000000001 | G81: 10000 | H81: 33 | I81: 5 | J81: Spheroid | K81: Stretching | L81: 1 | S81: =F81-E81 -> 0
A82: Baldwin | B82: w_missed_condorcet_winner_rk | E82: 0 | F82: 0 | G82: 10000 | H82: 33 | I82: 5 | J82: Spheroid | K82: Stretching | L82: 1 | S82: =F82-E82 -> 0
A83: Baldwin | B83: w_is_condorcet_winner_ut_rel_ctb | E83: 0.75439999999999996 | F83: 0.75439999999999996 | G83: 10000 | H83: 33 | I83: 5 | J83: Spheroid | K83: Stretching | L83: 1 | S83: =F83-E83 -> 0
A84: Baldwin | B84: w_is_not_condorcet_winner_ut_rel_ctb | E84: 0.24560000000000001 | F84: 0.24560000000000001 | G84: 10000 | H84: 33 | I84: 5 | J84: Spheroid | K84: Stretching | L84: 1 | S84: =F84-E84 -> 0
A85: Baldwin | B85: w_missed_condorcet_winner_ut_rel_ctb | E85: 0 | F85: 0 | G85: 10000 | H85: 33 | I85: 5 | J85: Spheroid | K85: Stretching | L85: 1 | S85: =F85-E85 -> 0
A86: Baldwin | B86: w_is_condorcet_winner_ut_rel | E86: 0.75439999999999996 | F86: 0.75439999999999996 | G86: 10000 | H86: 33 | I86: 5 | J86: Spheroid | K86: Stretching | L86: 1 | S86: =F86-E86 -> 0
A87: Baldwin | B87: w_is_not_condorcet_winner_ut_rel | E87: 0.24560000000000001 | F87: 0.24560000000000001 | G87: 10000 | H87: 33 | I87: 5 | J87: Spheroid | K87: Stretching | L87: 1 | S87: =F87-E87 -> 0
A88: Baldwin | B88: w_missed_condorcet_winner_ut_rel | E88: 0 | F88: 0 | G88: 10000 | H88: 33 | I88: 5 | J88: Spheroid | K88: Stretching | L88: 1 | S88: =F88-E88 -> 0
A89: Baldwin | B89: w_is_condorcet_winner_ut_abs_ctb | E89: 0.75439999999999996 | F89: 0.75439999999999996 | G89: 10000 | H89: 33 | I89: 5 | J89: Spheroid | K89: Stretching | L89: 1 | S89: =F89-E89 -> 0
A90: Baldwin | B90: w_is_not_condorcet_winner_ut_abs_ctb | E90: 0.24560000000000001 | F90: 0.24560000000000001 | G90: 10000 | H90: 33 | I90: 5 | J90: Spheroid | K90: Stretching | L90: 1 | S90: =F90-E90 -> 0
A91: Baldwin | B91: w_missed_condorcet_winner_ut_abs_ctb | E91: 0 | F91: 0 | G91: 10000 | H91: 33 | I91: 5 | J91: Spheroid | K91: Stretching | L91: 1 | S91: =F91-E91 -> 0
A92: Baldwin | B92: w_is_condorcet_winner_ut_abs | E92: 0.75439999999999996 | F92: 0.75439999999999996 | G92: 10000 | H92: 33 | I92: 5 | J92: Spheroid | K92: Stretching | L92: 1 | S92: =F92-E92 -> 0
A93: Baldwin | B93: w_is_not_condorcet_winner_ut_abs | E93: 0.24560000000000001 | F93: 0.24560000000000001 | G93: 10000 | H93: 33 | I93: 5 | J93: Spheroid | K93: Stretching | L93: 1 | S93: =F93-E93 -> 0
A94: Baldwin | B94: w_missed_condorcet_winner_ut_abs | E94: 0 | F94: 0 | G94: 10000 | H94: 33 | I94: 5 | J94: Spheroid | K94: Stretching | L94: 1 | S94: =F94-E94 -> 0
A95: Baldwin | B95: w_is_resistant_condorcet_winner | E95: 3.7000000000000002E-3 | F95: 3.7000000000000002E-3 | G95: 10000 | H95: 33 | I95: 5 | J95: Spheroid | K95: Stretching | L95: 1 | S95: =F95-E95 -> 0
A96: Baldwin | B96: w_is_not_resistant_condorcet_winner | E96: 0.99629999999999996 | F96: 0.99629999999999996 | G96: 10000 | H96: 33 | I96: 5 | J96: Spheroid | K96: Stretching | L96: 1 | S96: =F96-E96 -> 0
A97: Baldwin | B97: w_missed_resistant_condorcet_winner | E97: 0 | F97: 0 | G97: 10000 | H97: 33 | I97: 5 | J97: Spheroid | K97: Stretching | L97: 1 | S97: =F97-E97 -> 0
A98: Baldwin | B98: TM | C98: TM_option = exact | D98: 19.753719 | E98: 0.87050000000000005 | F98: 0.87050000000000005 | G98: 10000 | H98: 33 | I98: 5 | J98: Spheroid | K98: Stretching | L98: 1 | S98: =F98-E98 -> 0
A99: Baldwin | B99: UM | C99: UM_option = exact | D99: 823.62704399999996 | E99: 0.86580000000000001 | F99: 0.86580000000000001 | G99: 10000 | H99: 33 | I99: 5 | J99: Spheroid | K99: Stretching | L99: 1 | S99: =F99-E99 -> 0
A100: Baldwin | B100: ICM | C100: ICM_option = exact | D100: 0.91205599999999998 | E100: 0.24560000000000001 | F100: 0.24560000000000001 | G100: 10000 | H100: 33 | I100: 5 | J100: Spheroid | K100: Stretching | L100: 1 | S100: =F100-E100 -> 0
A101: Baldwin | B101: CM | C101: CM_option = lazy, UM_option = exact, TM_option = exact | D101: 2.8666700000000001 | E101: 0.88280000000000003 | F101: 0.99629999999999996 | G101: 10000 | H101: 33 | I101: 5 | J101: Spheroid | K101: Stretching | L101: 1 | S101: =F101-E101 -> 0.11349999999999993
A102: Borda | B102: w_is_condorcet_admissible | E102: 0.64439999999999997 | F102: 0.64439999999999997 | G102: 10000 | H102: 33 | I102: 5 | J102: Spheroid | K102: Stretching | L102: 1 | S102: =F102-E102 -> 0
A103: Borda | B103: w_is_not_condorcet_admissible | E103: 0.35560000000000003 | F103: 0.35560000000000003 | G103: 10000 | H103: 33 | I103: 5 | J103: Spheroid | K103: Stretching | L103: 1 | S103: =F103-E103 -> 0
A104: Borda | B104: w_missed_condorcet_admissible | E104: 0.11 | F104: 0.11 | G104: 10000 | H104: 33 | I104: 5 | J104: Spheroid | K104: Stretching | L104: 1 | S104: =F104-E104 -> 0
A105: Borda | B105: w_is_weak_condorcet_winner | E105: 0.64439999999999997 | F105: 0.64439999999999997 | G105: 10000 | H105: 33 | I105: 5 | J105: Spheroid | K105: Stretching | L105: 1 | S105: =F105-E105 -> 0
A106: Borda | B106: w_is_not_weak_condorcet_winner | E106: 0.35560000000000003 | F106: 0.35560000000000003 | G106: 10000 | H106: 33 | I106: 5 | J106: Spheroid | K106: Stretching | L106: 1 | S106: =F106-E106 -> 0
A107: Borda | B107: w_missed_weak_condorcet_winner | E107: 0.11 | F107: 0.11 | G107: 10000 | H107: 33 | I107: 5 | J107: Spheroid | K107: Stretching | L107: 1 | S107: =F107-E107 -> 0
A108: Borda | B108: w_is_condorcet_winner_rk_ctb | E108: 0.64439999999999997 | F108: 0.64439999999999997 | G108: 10000 | H108: 33 | I108: 5 | J108: Spheroid | K108: Stretching | L108: 1 | S108: =F108-E108 -> 0
A109: Borda | B109: w_is_not_condorcet_winner_rk_ctb | E109: 0.35560000000000003 | F109: 0.35560000000000003 | G109: 10000 | H109: 33 | I109: 5 | J109: Spheroid | K109: Stretching | L109: 1 | S109: =F109-E109 -> 0
A110: Borda | B110: w_missed_condorcet_winner_rk_ctb | E110: 0.11 | F110: 0.11 | G110: 10000 | H110: 33 | I110: 5 | J110: Spheroid | K110: Stretching | L110: 1 | S110: =F110-E110 -> 0
A111: Borda | B111: w_is_condorcet_winner_rk | E111: 0.64439999999999997 | F111: 0.64439999999999997 | G111: 10000 | H111: 33 | I111: 5 | J111: Spheroid | K111: Stretching | L111: 1 | S111: =F111-E111 -> 0
A112: Borda | B112: w_is_not_condorcet_winner_rk | E112: 0.35560000000000003 | F112: 0.35560000000000003 | G112: 10000 | H112: 33 | I112: 5 | J112: Spheroid | K112: Stretching | L112: 1 | S112: =F112-E112 -> 0
A113: Borda | B113: w_missed_condorcet_winner_rk | E113: 0.11 | F113: 0.11 | G113: 10000 | H113: 33 | I113: 5 | J113: Spheroid | K113: Stretching | L113: 1 | S113: =F113-E113 -> 0
A114: Borda | B114: w_is_condorcet_winner_ut_rel_ctb | E114: 0.64439999999999997 | F114: 0.64439999999999997 | G114: 10000 | H114: 33 | I114: 5 | J114: Spheroid | K114: Stretching | L114: 1 | S114: =F114-E114 -> 0
A115: Borda | B115: w_is_not_condorcet_winner_ut_rel_ctb | E115: 0.35560000000000003 | F115: 0.35560000000000003 | G115: 10000 | H115: 33 | I115: 5 | J115: Spheroid | K115: Stretching | L115: 1 | S115: =F115-E115 -> 0
A116: Borda | B116: w_missed_condorcet_winner_ut_rel_ctb | E116: 0.11 | F116: 0.11 | G116: 10000 | H116: 33 | I116: 5 | J116: Spheroid | K116: Stretching | L116: 1 | S116: =F116-E116 -> 0
A117: Borda | B117: w_is_condorcet_winner_ut_rel | E117: 0.64439999999999997 | F117: 0.64439999999999997 | G117: 10000 | H117: 33 | I117: 5 | J117: Spheroid | K117: Stretching | L117: 1 | S117: =F117-E117 -> 0
A118: Borda | B118: w_is_not_condorcet_winner_ut_rel | E118: 0.35560000000000003 | F118: 0.35560000000000003 | G118: 10000 | H118: 33 | I118: 5 | J118: Spheroid | K118: Stretching | L118: 1 | S118: =F118-E118 -> 0
A119: Borda | B119: w_missed_condorcet_winner_ut_rel | E119: 0.11 | F119: 0.11 | G119: 10000 | H119: 33 | I119: 5 | J119: Spheroid | K119: Stretching | L119: 1 | S119: =F119-E119 -> 0
A120: Borda | B120: w_is_condorcet_winner_ut_abs_ctb | E120: 0.64439999999999997 | F120: 0.64439999999999997 | G120: 10000 | H120: 33 | I120: 5 | J120: Spheroid | K120: Stretching | L120: 1 | S120: =F120-E120 -> 0
A121: Borda | B121: w_is_not_condorcet_winner_ut_abs_ctb | E121: 0.35560000000000003 | F121: 0.35560000000000003 | G121: 10000 | H121: 33 | I121: 5 | J121: Spheroid | K121: Stretching | L121: 1 | S121: =F121-E121 -> 0
A122: Borda | B122: w_missed_condorcet_winner_ut_abs_ctb | E122: 0.11 | F122: 0.11 | G122: 10000 | H122: 33 | I122: 5 | J122: Spheroid | K122: Stretching | L122: 1 | S122: =F122-E122 -> 0
A123: Borda | B123: w_is_condorcet_winner_ut_abs | E123: 0.64439999999999997 | F123: 0.64439999999999997 | G123: 10000 | H123: 33 | I123: 5 | J123: Spheroid | K123: Stretching | L123: 1 | S123: =F123-E123 -> 0
A124: Borda | B124: w_is_not_condorcet_winner_ut_abs | E124: 0.35560000000000003 | F124: 0.35560000000000003 | G124: 10000 | H124: 33 | I124: 5 | J124: Spheroid | K124: Stretching | L124: 1 | S124: =F124-E124 -> 0
A125: Borda | B125: w_missed_condorcet_winner_ut_abs | E125: 0.11 | F125: 0.11 | G125: 10000 | H125: 33 | I125: 5 | J125: Spheroid | K125: Stretching | L125: 1 | S125: =F125-E125 -> 0
A126: Borda | B126: w_is_resistant_condorcet_winner | E126: 3.7000000000000002E-3 | F126: 3.7000000000000002E-3 | G126: 10000 | H126: 33 | I126: 5 | J126: Spheroid | K126: Stretching | L126: 1 | S126: =F126-E126 -> 0
A127: Borda | B127: w_is_not_resistant_condorcet_winner | E127: 0.99629999999999996 | F127: 0.99629999999999996 | G127: 10000 | H127: 33 | I127: 5 | J127: Spheroid | K127: Stretching | L127: 1 | S127: =F127-E127 -> 0
A128: Borda | B128: w_missed_resistant_condorcet_winner | E128: 0 | F128: 0 | G128: 10000 | H128: 33 | I128: 5 | J128: Spheroid | K128: Stretching | L128: 1 | S128: =F128-E128 -> 0
A129: Borda | B129: TM | C129: TM_option = exact | D129: 15.964473 | E129: 0.997 | F129: 0.997 | G129: 10000 | H129: 33 | I129: 5 | J129: Spheroid | K129: Stretching | L129: 1 | S129: =F129-E129 -> 0
A130: Borda | B130: UM | C130: UM_option = exact | D130: 2.7371639999999999 | E130: 0.99080000000000001 | F130: 0.99080000000000001 | G130: 10000 | H130: 33 | I130: 5 | J130: Spheroid | K130: Stretching | L130: 1 | S130: =F130-E130 -> 0
A131: Borda | B131: ICM | C131: ICM_option = fast | D131: 2.6867049999999999 | E131: 2.9999999999999997E-4 | F131: 2.9999999999999997E-4 | G131: 10000 | H131: 33 | I131: 5 | J131: Spheroid | K131: Stretching | L131: 1 | S131: =F131-E131 -> 0
A132: Borda | B132: CM | C132: CM_option = fast, UM_option = exact, TM_option = exact | D132: 1.241571 | E132: 0.997 | F132: 0.997 | G132: 10000 | H132: 33 | I132: 5 | J132: Spheroid | K132: Stretching | L132: 1 | S132: =F132-E132 -> 0
A133: Bucklin | B133: w_is_condorcet_admissible | E133: 0.54949999999999999 | F133: 0.54949999999999999 | G133: 10000 | H133: 33 | I133: 5 | J133: Spheroid | K133: Stretching | L133: 1 | S133: =F133-E133 -> 0
A134: Bucklin | B134: w_is_not_condorcet_admissible | E134: 0.45050000000000001 | F134: 0.45050000000000001 | G134: 10000 | H134: 33 | I134: 5 | J134: Spheroid | K134: Stretching | L134: 1 | S134: =F134-E134 -> 0
A135: Bucklin | B135: w_missed_condorcet_admissible | E135: 0.2049 | F135: 0.2049 | G135: 10000 | H135: 33 | I135: 5 | J135: Spheroid | K135: Stretching | L135: 1 | S135: =F135-E135 -> 0
A136: Bucklin | B136: w_is_weak_condorcet_winner | E136: 0.54949999999999999 | F136: 0.54949999999999999 | G136: 10000 | H136: 33 | I136: 5 | J136: Spheroid | K136: Stretching | L136: 1 | S136: =F136-E136 -> 0
A137: Bucklin | B137: w_is_not_weak_condorcet_winner | E137: 0.45050000000000001 | F137: 0.45050000000000001 | G137: 10000 | H137: 33 | I137: 5 | J137: Spheroid | K137: Stretching | L137: 1 | S137: =F137-E137 -> 0
A138: Bucklin | B138: w_missed_weak_condorcet_winner | E138: 0.2049 | F138: 0.2049 | G138: 10000 | H138: 33 | I138: 5 | J138: Spheroid | K138: Stretching | L138: 1 | S138: =F138-E138 -> 0
A139: Bucklin | B139: w_is_condorcet_winner_rk_ctb | E139: 0.54949999999999999 | F139: 0.54949999999999999 | G139: 10000 | H139: 33 | I139: 5 | J139: Spheroid | K139: Stretching | L139: 1 | S139: =F139-E139 -> 0
A140: Bucklin | B140: w_is_not_condorcet_winner_rk_ctb | E140: 0.45050000000000001 | F140: 0.45050000000000001 | G140: 10000 | H140: 33 | I140: 5 | J140: Spheroid | K140: Stretching | L140: 1 | S140: =F140-E140 -> 0
A141: Bucklin | B141: w_missed_condorcet_winner_rk_ctb | E141: 0.2049 | F141: 0.2049 | G141: 10000 | H141: 33 | I141: 5 | J141: Spheroid | K141: Stretching | L141: 1 | S141: =F141-E141 -> 0
A142: Bucklin | B142: w_is_condorcet_winner_rk | E142: 0.54949999999999999 | F142: 0.54949999999999999 | G142: 10000 | H142: 33 | I142: 5 | J142: Spheroid | K142: Stretching | L142: 1 | S142: =F142-E142 -> 0
A143: Bucklin | B143: w_is_not_condorcet_winner_rk | E143: 0.45050000000000001 | F143: 0.45050000000000001 | G143: 10000 | H143: 33 | I143: 5 | J143: Spheroid | K143: Stretching | L143: 1 | S143: =F143-E143 -> 0
A144: Bucklin | B144: w_missed_condorcet_winner_rk | E144: 0.2049 | F144: 0.2049 | G144: 10000 | H144: 33 | I144: 5 | J144: Spheroid | K144: Stretching | L144: 1 | S144: =F144-E144 -> 0
A145: Bucklin | B145: w_is_condorcet_winner_ut_rel_ctb | E145: 0.54949999999999999 | F145: 0.54949999999999999 | G145: 10000 | H145: 33 | I145: 5 | J145: Spheroid | K145: Stretching | L145: 1 | S145: =F145-E145 -> 0
A146: Bucklin | B146: w_is_not_condorcet_winner_ut_rel_ctb | E146: 0.45050000000000001 | F146: 0.45050000000000001 | G146: 10000 | H146: 33 | I146: 5 | J146: Spheroid | K146: Stretching | L146: 1 | S146: =F146-E146 -> 0
A147: Bucklin | B147: w_missed_condorcet_winner_ut_rel_ctb | E147: 0.2049 | F147: 0.2049 | G147: 10000 | H147: 33 | I147: 5 | J147: Spheroid | K147: Stretching | L147: 1 | S147: =F147-E147 -> 0
A148: Bucklin | B148: w_is_condorcet_winner_ut_rel | E148: 0.54949999999999999 | F148: 0.54949999999999999 | G148: 10000 | H148: 33 | I148: 5 | J148: Spheroid | K148: Stretching | L148: 1 | S148: =F148-E148 -> 0
A149: Bucklin | B149: w_is_not_condorcet_winner_ut_rel | E149: 0.45050000000000001 | F149: 0.45050000000000001 | G149: 10000 | H149: 33 | I149: 5 | J149: Spheroid | K149: Stretching | L149: 1 | S149: =F149-E149 -> 0
A150: Bucklin | B150: w_missed_condorcet_winner_ut_rel | E150: 0.2049 | F150: 0.2049 | G150: 10000 | H150: 33 | I150: 5 | J150: Spheroid | K150: Stretching | L150: 1 | S150: =F150-E150 -> 0
A151: Bucklin | B151: w_is_condorcet_winner_ut_abs_ctb | E151: 0.54949999999999999 | F151: 0.54949999999999999 | G151: 10000 | H151: 33 | I151: 5 | J151: Spheroid | K151: Stretching | L151: 1 | S151: =F151-E151 -> 0
A152: Bucklin | B152: w_is_not_condorcet_winner_ut_abs_ctb | E152: 0.45050000000000001 | F152: 0.45050000000000001 | G152: 10000 | H152: 33 | I152: 5 | J152: Spheroid | K152: Stretching | L152: 1 | S152: =F152-E152 -> 0
A153: Bucklin | B153: w_missed_condorcet_winner_ut_abs_ctb | E153: 0.2049 | F153: 0.2049 | G153: 10000 | H153: 33 | I153: 5 | J153: Spheroid | K153: Stretching | L153: 1 | S153: =F153-E153 -> 0
A154: Bucklin | B154: w_is_condorcet_winner_ut_abs | E154: 0.54949999999999999 | F154: 0.54949999999999999 | G154: 10000 | H154: 33 | I154: 5 | J154: Spheroid | K154: Stretching | L154: 1 | S154: =F154-E154 -> 0
A155: Bucklin | B155: w_is_not_condorcet_winner_ut_abs | E155: 0.45050000000000001 | F155: 0.45050000000000001 | G155: 10000 | H155: 33 | I155: 5 | J155: Spheroid | K155: Stretching | L155: 1 | S155: =F155-E155 -> 0
A156: Bucklin | B156: w_missed_condorcet_winner_ut_abs | E156: 0.2049 | F156: 0.2049 | G156: 10000 | H156: 33 | I156: 5 | J156: Spheroid | K156: Stretching | L156: 1 | S156: =F156-E156 -> 0
A157: Bucklin | B157: w_is_resistant_condorcet_winner | E157: 3.7000000000000002E-3 | F157: 3.7000000000000002E-3 | G157: 10000 | H157: 33 | I157: 5 | J157: Spheroid | K157: Stretching | L157: 1 | S157: =F157-E157 -> 0
A158: Bucklin | B158: w_is_not_resistant_condorcet_winner | E158: 0.99629999999999996 | F158: 0.99629999999999996 | G158: 10000 | H158: 33 | I158: 5 | J158: Spheroid | K158: Stretching | L158: 1 | S158: =F158-E158 -> 0
A159: Bucklin | B159: w_missed_resistant_condorcet_winner | E159: 0 | F159: 0 | G159: 10000 | H159: 33 | I159: 5 | J159: Spheroid | K159: Stretching | L159: 1 | S159: =F159-E159 -> 0
A160: Bucklin | B160: TM | C160: TM_option = exact | D160: 16.140965000000001 | E160: 0.93569999999999998 | F160: 0.93569999999999998 | G160: 10000 | H160: 33 | I160: 5 | J160: Spheroid | K160: Stretching | L160: 1 | S160: =F160-E160 -> 0
A161: Bucklin | B161: UM | C161: UM_option = exact | D161: 3.7112400000000001 | E161: 0.93100000000000005 | F161: 0.93100000000000005 | G161: 10000 | H161: 33 | I161: 5 | J161: Spheroid | K161: Stretching | L161: 1 | S161: =F161-E161 -> 0
A162: Bucklin | B162: ICM | C162: ICM_option = exact | D162: 0.953569 | E162: 0.45050000000000001 | F162: 0.45050000000000001 | G162: 10000 | H162: 33 | I162: 5 | J162: Spheroid | K162: Stretching | L162: 1 | S162: =F162-E162 -> 0
A163: Bucklin | B163: CM | C163: CM_option = exact | D163: 2.0386150000000001 | E163: 0.97160000000000002 | F163: 0.97160000000000002 | G163: 10000 | H163: 33 | I163: 5 | J163: Spheroid | K163: Stretching | L163: 1 | S163: =F163-E163 -> 0
A164: Condorcet Sum Defeats | B164: w_is_condorcet_admissible | E164: 0.75439999999999996 | F164: 0.75439999999999996 | G164: 10000 | H164: 33 | I164: 5 | J164: Spheroid | K164: Stretching | L164: 1 | S164: =F164-E164 -> 0
A165: Condorcet Sum Defeats | B165: w_is_not_condorcet_admissible | E165: 0.24560000000000001 | F165: 0.24560000000000001 | G165: 10000 | H165: 33 | I165: 5 | J165: Spheroid | K165: Stretching | L165: 1 | S165: =F165-E165 -> 0
A166: Condorcet Sum Defeats | B166: w_missed_condorcet_admissible | E166: 0 | F166: 0 | G166: 10000 | H166: 33 | I166: 5 | J166: Spheroid | K166: Stretching | L166: 1 | S166: =F166-E166 -> 0
A167: Condorcet Sum Defeats | B167: w_is_weak_condorcet_winner | E167: 0.75439999999999996 | F167: 0.75439999999999996 | G167: 10000 | H167: 33 | I167: 5 | J167: Spheroid | K167: Stretching | L167: 1 | S167: =F167-E167 -> 0
A168: Condorcet Sum Defeats | B168: w_is_not_weak_condorcet_winner | E168: 0.24560000000000001 | F168: 0.24560000000000001 | G168: 10000 | H168: 33 | I168: 5 | J168: Spheroid | K168: Stretching | L168: 1 | S168: =F168-E168 -> 0
A169: Condorcet Sum Defeats | B169: w_missed_weak_condorcet_winner | E169: 0 | F169: 0 | G169: 10000 | H169: 33 | I169: 5 | J169: Spheroid | K169: Stretching | L169: 1 | S169: =F169-E169 -> 0
A170: Condorcet Sum Defeats | B170: w_is_condorcet_winner_rk_ctb | E170: 0.75439999999999996 | F170: 0.75439999999999996 | G170: 10000 | H170: 33 | I170: 5 | J170: Spheroid | K170: Stretching | L170: 1 | S170: =F170-E170 -> 0
A171: Condorcet Sum Defeats | B171: w_is_not_condorcet_winner_rk_ctb | E171: 0.24560000000000001 | F171: 0.24560000000000001 | G171: 10000 | H171: 33 | I171: 5 | J171: Spheroid | K171: Stretching | L171: 1 | S171: =F171-E171 -> 0
A172: Condorcet Sum Defeats | B172: w_missed_condorcet_winner_rk_ctb | E172: 0 | F172: 0 | G172: 10000 | H172: 33 | I172: 5 | J172: Spheroid | K172: Stretching | L172: 1 | S172: =F172-E172 -> 0
A173: Condorcet Sum Defeats | B173: w_is_condorcet_winner_rk | E173: 0.75439999999999996 | F173: 0.75439999999999996 | G173: 10000 | H173: 33 | I173: 5 | J173: Spheroid | K173: Stretching | L173: 1 | S173: =F173-E173 -> 0
A174: Condorcet Sum Defeats | B174: w_is_not_condorcet_winner_rk | E174: 0.24560000000000001 | F174: 0.24560000000000001 | G174: 10000 | H174: 33 | I174: 5 | J174: Spheroid | K174: Stretching | L174: 1 | S174: =F174-E174 -> 0
A175: Condorcet Sum Defeats | B175: w_missed_condorcet_winner_rk | E175: 0 | F175: 0 | G175: 10000 | H175: 33 | I175: 5 | J175: Spheroid | K175: Stretching | L175: 1 | S175: =F175-E175 -> 0
A176: Condorcet Sum Defeats | B176: w_is_condorcet_winner_ut_rel_ctb | E176: 0.75439999999999996 | F176: 0.75439999999999996 | G176: 10000 | H176: 33 | I176: 5 | J176: Spheroid | K176: Stretching | L176: 1 | S176: =F176-E176 -> 0
A177: Condorcet Sum Defeats | B177: w_is_not_condorcet_winner_ut_rel_ctb | E177: 0.24560000000000001 | F177: 0.24560000000000001 | G177: 10000 | H177: 33 | I177: 5 | J177: Spheroid | K177: Stretching | L177: 1 | S177: =F177-E177 -> 0
A178: Condorcet Sum Defeats | B178: w_missed_condorcet_winner_ut_rel_ctb | E178: 0 | F178: 0 | G178: 10000 | H178: 33 | I178: 5 | J178: Spheroid | K178: Stretching | L178: 1 | S178: =F178-E178 -> 0
A179: Condorcet Sum Defeats | B179: w_is_condorcet_winner_ut_rel | E179: 0.75439999999999996 | F179: 0.75439999999999996 | G179: 10000 | H179: 33 | I179: 5 | J179: Spheroid | K179: Stretching | L179: 1 | S179: =F179-E179 -> 0
A180: Condorcet Sum Defeats | B180: w_is_not_condorcet_winner_ut_rel | E180: 0.24560000000000001 | F180: 0.24560000000000001 | G180: 10000 | H180: 33 | I180: 5 | J180: Spheroid | K180: Stretching | L180: 1 | S180: =F180-E180 -> 0
A181: Condorcet Sum Defeats | B181: w_missed_condorcet_winner_ut_rel | E181: 0 | F181: 0 | G181: 10000 | H181: 33 | I181: 5 | J181: Spheroid | K181: Stretching | L181: 1 | S181: =F181-E181 -> 0
A182: Condorcet Sum Defeats | B182: w_is_condorcet_winner_ut_abs_ctb | E182: 0.75439999999999996 | F182: 0.75439999999999996 | G182: 10000 | H182: 33 | I182: 5 | J182: Spheroid | K182: Stretching | L182: 1 | S182: =F182-E182 -> 0
A183: Condorcet Sum Defeats | B183: w_is_not_condorcet_winner_ut_abs_ctb | E183: 0.24560000000000001 | F183: 0.24560000000000001 | G183: 10000 | H183: 33 | I183: 5 | J183: Spheroid | K183: Stretching | L183: 1 | S183: =F183-E183 -> 0
A184: Condorcet Sum Defeats | B184: w_missed_condorcet_winner_ut_abs_ctb | E184: 0 | F184: 0 | G184: 10000 | H184: 33 | I184: 5 | J184: Spheroid | K184: Stretching | L184: 1 | S184: =F184-E184 -> 0
A185: Condorcet Sum Defeats | B185: w_is_condorcet_winner_ut_abs | E185: 0.75439999999999996 | F185: 0.75439999999999996 | G185: 10000 | H185: 33 | I185: 5 | J185: Spheroid | K185: Stretching | L185: 1 | S185: =F185-E185 -> 0
A186: Condorcet Sum Defeats | B186: w_is_not_condorcet_winner_ut_abs | E186: 0.24560000000000001 | F186: 0.24560000000000001 | G186: 10000 | H186: 33 | I186: 5 | J186: Spheroid | K186: Stretching | L186: 1 | S186: =F186-E186 -> 0
A187: Condorcet Sum Defeats | B187: w_missed_condorcet_winner_ut_abs | E187: 0 | F187: 0 | G187: 10000 | H187: 33 | I187: 5 | J187: Spheroid | K187: Stretching | L187: 1 | S187: =F187-E187 -> 0
A188: Condorcet Sum Defeats | B188: w_is_resistant_condorcet_winner | E188: 3.7000000000000002E-3 | F188: 3.7000000000000002E-3 | G188: 10000 | H188: 33 | I188: 5 | J188: Spheroid | K188: Stretching | L188: 1 | S188: =F188-E188 -> 0
A189: Condorcet Sum Defeats | B189: w_is_not_resistant_condorcet_winner | E189: 0.99629999999999996 | F189: 0.99629999999999996 | G189: 10000 | H189: 33 | I189: 5 | J189: Spheroid | K189: Stretching | L189: 1 | S189: =F189-E189 -> 0
A190: Condorcet Sum Defeats | B190: w_missed_resistant_condorcet_winner | E190: 0 | F190: 0 | G190: 10000 | H190: 33 | I190: 5 | J190: Spheroid | K190: Stretching | L190: 1 | S190: =F190-E190 -> 0
A191: Condorcet Sum Defeats | B191: TM | C191: TM_option = exact | D191: 13.772829 | E191: 0.95820000000000005 | F191: 0.95820000000000005 | G191: 10000 | H191: 33 | I191: 5 | J191: Spheroid | K191: Stretching | L191: 1 | S191: =F191-E191 -> 0
A192: Condorcet Sum Defeats | B192: UM | C192: UM_option = exact | D192: 125.739721 | E192: 0.97099999999999997 | F192: 0.97099999999999997 | G192: 10000 | H192: 33 | I192: 5 | J192: Spheroid | K192: Stretching | L192: 1 | S192: =F192-E192 -> 0
A193: Condorcet Sum Defeats | B193: ICM | C193: ICM_option = lazy | D193: 0.91904600000000003 | E193: 0.24560000000000001 | F193: 0.24560000000000001 | G193: 10000 | H193: 33 | I193: 5 | J193: Spheroid | K193: Stretching | L193: 1 | S193: =F193-E193 -> 0
A194: Condorcet Sum Defeats | B194: CM | C194: CM_option = lazy, UM_option = exact, TM_option = exact | D194: 1.7720990000000001 | E194: 0.97099999999999997 | F194: 0.99629999999999996 | G194: 10000 | H194: 33 | I194: 5 | J194: Spheroid | K194: Stretching | L194: 1 | S194: =F194-E194 -> 2.5299999999999989E-2
A195: Coombs | B195: w_is_condorcet_admissible | E195: 0.6784 | F195: 0.6784 | G195: 10000 | H195: 33 | I195: 5 | J195: Spheroid | K195: Stretching | L195: 1 | S195: =F195-E195 -> 0
A196: Coombs | B196: w_is_not_condorcet_admissible | E196: 0.3216 | F196: 0.3216 | G196: 10000 | H196: 33 | I196: 5 | J196: Spheroid | K196: Stretching | L196: 1 | S196: =F196-E196 -> 0
A197: Coombs | B197: w_missed_condorcet_admissible | E197: 7.5999999999999998E-2 | F197: 7.5999999999999998E-2 | G197: 10000 | H197: 33 | I197: 5 | J197: Spheroid | K197: Stretching | L197: 1 | S197: =F197-E197 -> 0
A198: Coombs | B198: w_is_weak_condorcet_winner | E198: 0.6784 | F198: 0.6784 | G198: 10000 | H198: 33 | I198: 5 | J198: Spheroid | K198: Stretching | L198: 1 | S198: =F198-E198 -> 0
A199: Coombs | B199: w_is_not_weak_condorcet_winner | E199: 0.3216 | F199: 0.3216 | G199: 10000 | H199: 33 | I199: 5 | J199: Spheroid | K199: Stretching | L199: 1 | S199: =F199-E199 -> 0
A200: Coombs | B200: w_missed_weak_condorcet_winner | E200: 7.5999999999999998E-2 | F200: 7.5999999999999998E-2 | G200: 10000 | H200: 33 | I200: 5 | J200: Spheroid | K200: Stretching | L200: 1 | S200: =F200-E200 -> 0
A201: Coombs | B201: w_is_condorcet_winner_rk_ctb | E201: 0.6784 | F201: 0.6784 | G201: 10000 | H201: 33 | I201: 5 | J201: Spheroid | K201: Stretching | L201: 1 | S201: =F201-E201 -> 0
A202: Coombs | B202: w_is_not_condorcet_winner_rk_ctb | E202: 0.3216 | F202: 0.3216 | G202: 10000 | H202: 33 | I202: 5 | J202: Spheroid | K202: Stretching | L202: 1 | S202: =F202-E202 -> 0
A203: Coombs | B203: w_missed_condorcet_winner_rk_ctb | E203: 7.5999999999999998E-2 | F203: 7.5999999999999998E-2 | G203: 10000 | H203: 33 | I203: 5 | J203: Spheroid | K203: Stretching | L203: 1 | S203: =F203-E203 -> 0
A204: Coombs | B204: w_is_condorcet_winner_rk | E204: 0.6784 | F204: 0.6784 | G204: 10000 | H204: 33 | I204: 5 | J204: Spheroid | K204: Stretching | L204: 1 | S204: =F204-E204 -> 0
A205: Coombs | B205: w_is_not_condorcet_winner_rk | E205: 0.3216 | F205: 0.3216 | G205: 10000 | H205: 33 | I205: 5 | J205: Spheroid | K205: Stretching | L205: 1 | S205: =F205-E205 -> 0
A206: Coombs | B206: w_missed_condorcet_winner_rk | E206: 7.5999999999999998E-2 | F206: 7.5999999999999998E-2 | G206: 10000 | H206: 33 | I206: 5 | J206: Spheroid | K206: Stretching | L206: 1 | S206: =F206-E206 -> 0
A207: Coombs | B207: w_is_condorcet_winner_ut_rel_ctb | E207: 0.6784 | F207: 0.6784 | G207: 10000 | H207: 33 | I207: 5 | J207: Spheroid | K207: Stretching | L207: 1 | S207: =F207-E207 -> 0
A208: Coombs | B208: w_is_not_condorcet_winner_ut_rel_ctb | E208: 0.3216 | F208: 0.3216 | G208: 10000 | H208: 33 | I208: 5 | J208: Spheroid | K208: Stretching | L208: 1 | S208: =F208-E208 -> 0
A209: Coombs | B209: w_missed_condorcet_winner_ut_rel_ctb | E209: 7.5999999999999998E-2 | F209: 7.5999999999999998E-2 | G209: 10000 | H209: 33 | I209: 5 | J209: Spheroid | K209: Stretching | L209: 1 | S209: =F209-E209 -> 0
A210: Coombs | B210: w_is_condorcet_winner_ut_rel | E210: 0.6784 | F210: 0.6784 | G210: 10000 | H210: 33 | I210: 5 | J210: Spheroid | K210: Stretching | L210: 1 | S210: =F210-E210 -> 0
A211: Coombs | B211: w_is_not_condorcet_winner_ut_rel | E211: 0.3216 | F211: 0.3216 | G211: 10000 | H211: 33 | I211: 5 | J211: Spheroid | K211: Stretching | L211: 1 | S211: =F211-E211 -> 0
A212: Coombs | B212: w_missed_condorcet_winner_ut_rel | E212: 7.5999999999999998E-2 | F212: 7.5999999999999998E-2 | G212: 10000 | H212: 33 | I212: 5 | J212: Spheroid | K212: Stretching | L212: 1 | S212: =F212-E212 -> 0
A213: Coombs | B213: w_is_condorcet_winner_ut_abs_ctb | E213: 0.6784 | F213: 0.6784 | G213: 10000 | H213: 33 | I213: 5 | J213: Spheroid | K213: Stretching | L213: 1 | S213: =F213-E213 -> 0
A214: Coombs | B214: w_is_not_condorcet_winner_ut_abs_ctb | E214: 0.3216 | F214: 0.3216 | G214: 10000 | H214: 33 | I214: 5 | J214: Spheroid | K214: Stretching | L214: 1 | S214: =F214-E214 -> 0
A215: Coombs | B215: w_missed_condorcet_winner_ut_abs_ctb | E215: 7.5999999999999998E-2 | F215: 7.5999999999999998E-2 | G215: 10000 | H215: 33 | I215: 5 | J215: Spheroid | K215: Stretching | L215: 1 | S215: =F215-E215 -> 0
A216: Coombs | B216: w_is_condorcet_winner_ut_abs | E216: 0.6784 | F216: 0.6784 | G216: 10000 | H216: 33 | I216: 5 | J216: Spheroid | K216: Stretching | L216: 1 | S216: =F216-E216 -> 0
A217: Coombs | B217: w_is_not_condorcet_winner_ut_abs | E217: 0.3216 | F217: 0.3216 | G217: 10000 | H217: 33 | I217: 5 | J217: Spheroid | K217: Stretching | L217: 1 | S217: =F217-E217 -> 0
A218: Coombs | B218: w_missed_condorcet_winner_ut_abs | E218: 7.5999999999999998E-2 | F218: 7.5999999999999998E-2 | G218: 10000 | H218: 33 | I218: 5 | J218: Spheroid | K218: Stretching | L218: 1 | S218: =F218-E218 -> 0
A219: Coombs | B219: w_is_resistant_condorcet_winner | E219: 3.7000000000000002E-3 | F219: 3.7000000000000002E-3 | G219: 10000 | H219: 33 | I219: 5 | J219: Spheroid | K219: Stretching | L219: 1 | S219: =F219-E219 -> 0
A220: Coombs | B220: w_is_not_resistant_condorcet_winner | E220: 0.99629999999999996 | F220: 0.99629999999999996 | G220: 10000 | H220: 33 | I220: 5 | J220: Spheroid | K220: Stretching | L220: 1 | S220: =F220-E220 -> 0
A221: Coombs | B221: w_missed_resistant_condorcet_winner | E221: 0 | F221: 0 | G221: 10000 | H221: 33 | I221: 5 | J221: Spheroid | K221: Stretching | L221: 1 | S221: =F221-E221 -> 0
A222: Coombs | B222: TM | C222: TM_option = exact | D222: 11.410631 | E222: 0.99990000000000001 | F222: 0.99990000000000001 | G222: 10000 | H222: 33 | I222: 5 | J222: Spheroid | K222: Stretching | L222: 1 | S222: =F222-E222 -> 0
A223: Coombs | B223: UM | C223: CM_option = exact | D223: 1.2430829999999999 | E223: 1 | F223: 1 | G223: 10000 | H223: 33 | I223: 5 | J223: Spheroid | K223: Stretching | L223: 1 | S223: =F223-E223 -> 0
A224: Coombs | B224: ICM | C224: ICM_option = exact | D224: 0.90305599999999997 | E224: 0.3216 | F224: 0.3216 | G224: 10000 | H224: 33 | I224: 5 | J224: Spheroid | K224: Stretching | L224: 1 | S224: =F224-E224 -> 0
A225: Coombs | B225: CM | C225: CM_option = exact | D225: 0.25551600000000002 | E225: 1 | F225: 1 | G225: 10000 | H225: 33 | I225: 5 | J225: Spheroid | K225: Stretching | L225: 1 | S225: =F225-E225 -> 0
A226: IRV Average | B226: w_is_condorcet_admissible | E226: 0.64800000000000002 | F226: 0.64800000000000002 | G226: 10000 | H226: 33 | I226: 5 | J226: Spheroid | K226: Stretching | L226: 1 | S226: =F226-E226 -> 0
A227: IRV Average | B227: w_is_not_condorcet_admissible | E227: 0.35199999999999998 | F227: 0.35199999999999998 | G227: 10000 | H227: 33 | I227: 5 | J227: Spheroid | K227: Stretching | L227: 1 | S227: =F227-E227 -> 0
A228: IRV Average | B228: w_missed_condorcet_admissible | E228: 0.10639999999999999 | F228: 0.10639999999999999 | G228: 10000 | H228: 33 | I228: 5 | J228: Spheroid | K228: Stretching | L228: 1 | S228: =F228-E228 -> 0
A229: IRV Average | B229: w_is_weak_condorcet_winner | E229: 0.64800000000000002 | F229: 0.64800000000000002 | G229: 10000 | H229: 33 | I229: 5 | J229: Spheroid | K229: Stretching | L229: 1 | S229: =F229-E229 -> 0
A230: IRV Average | B230: w_is_not_weak_condorcet_winner | E230: 0.35199999999999998 | F230: 0.35199999999999998 | G230: 10000 | H230: 33 | I230: 5 | J230: Spheroid | K230: Stretching | L230: 1 | S230: =F230-E230 -> 0
A231: IRV Average | B231: w_missed_weak_condorcet_winner | E231: 0.10639999999999999 | F231: 0.10639999999999999 | G231: 10000 | H231: 33 | I231: 5 | J231: Spheroid | K231: Stretching | L231: 1 | S231: =F231-E231 -> 0
A232: IRV Average | B232: w_is_condorcet_winner_rk_ctb | E232: 0.64800000000000002 | F232: 0.64800000000000002 | G232: 10000 | H232: 33 | I232: 5 | J232: Spheroid | K232: Stretching | L232: 1 | S232: =F232-E232 -> 0
A233: IRV Average | B233: w_is_not_condorcet_winner_rk_ctb | E233: 0.35199999999999998 | F233: 0.35199999999999998 | G233: 10000 | H233: 33 | I233: 5 | J233: Spheroid | K233: Stretching | L233: 1 | S233: =F233-E233 -> 0
A234: IRV Average | B234: w_missed_condorcet_winner_rk_ctb | E234: 0.10639999999999999 | F234: 0.10639999999999999 | G234: 10000 | H234: 33 | I234: 5 | J234: Spheroid | K234: Stretching | L234: 1 | S234: =F234-E234 -> 0
A235: IRV Average | B235: w_is_condorcet_winner_rk | E235: 0.64800000000000002 | F235: 0.64800000000000002 | G235: 10000 | H235: 33 | I235: 5 | J235: Spheroid | K235: Stretching | L235: 1 | S235: =F235-E235 -> 0
A236: IRV Average | B236: w_is_not_condorcet_winner_rk | E236: 0.35199999999999998 | F236: 0.35199999999999998 | G236: 10000 | H236: 33 | I236: 5 | J236: Spheroid | K236: Stretching | L236: 1 | S236: =F236-E236 -> 0
A237: IRV Average | B237: w_missed_condorcet_winner_rk | E237: 0.10639999999999999 | F237: 0.10639999999999999 | G237: 10000 | H237: 33 | I237: 5 | J237: Spheroid | K237: Stretching | L237: 1 | S237: =F237-E237 -> 0
A238: IRV Average | B238: w_is_condorcet_winner_ut_rel_ctb | E238: 0.64800000000000002 | F238: 0.64800000000000002 | G238: 10000 | H238: 33 | I238: 5 | J238: Spheroid | K238: Stretching | L238: 1 | S238: =F238-E238 -> 0
A239: IRV Average | B239: w_is_not_condorcet_winner_ut_rel_ctb | E239: 0.35199999999999998 | F239: 0.35199999999999998 | G239: 10000 | H239: 33 | I239: 5 | J239: Spheroid | K239: Stretching | L239: 1 | S239: =F239-E239 -> 0
A240: IRV Average | B240: w_missed_condorcet_winner_ut_rel_ctb | E240: 0.10639999999999999 | F240: 0.10639999999999999 | G240: 10000 | H240: 33 | I240: 5 | J240: Spheroid | K240: Stretching | L240: 1 | S240: =F240-E240 -> 0
A241: IRV Average | B241: w_is_condorcet_winner_ut_rel | E241: 0.64800000000000002 | F241: 0.64800000000000002 | G241: 10000 | H241: 33 | I241: 5 | J241: Spheroid | K241: Stretching | L241: 1 | S241: =F241-E241 -> 0
A242: IRV Average | B242: w_is_not_condorcet_winner_ut_rel | E242: 0.35199999999999998 | F242: 0.35199999999999998 | G242: 10000 | H242: 33 | I242: 5 | J242: Spheroid | K242: Stretching | L242: 1 | S242: =F242-E242 -> 0
A243: IRV Average | B243: w_missed_condorcet_winner_ut_rel | E243: 0.10639999999999999 | F243: 0.10639999999999999 | G243: 10000 | H243: 33 | I243: 5 | J243: Spheroid | K243: Stretching | L243: 1 | S243: =F243-E243 -> 0
A244: IRV Average | B244: w_is_condorcet_winner_ut_abs_ctb | E244: 0.64800000000000002 | F244: 0.64800000000000002 | G244: 10000 | H244: 33 | I244: 5 | J244: Spheroid | K244: Stretching | L244: 1 | S244: =F244-E244 -> 0
A245: IRV Average | B245: w_is_not_condorcet_winner_ut_abs_ctb | E245: 0.35199999999999998 | F245: 0.35199999999999998 | G245: 10000 | H245: 33 | I245: 5 | J245: Spheroid | K245: Stretching | L245: 1 | S245: =F245-E245 -> 0
A246: IRV Average | B246: w_missed_condorcet_winner_ut_abs_ctb | E246: 0.10639999999999999 | F246: 0.10639999999999999 | G246: 10000 | H246: 33 | I246: 5 | J246: Spheroid | K246: Stretching | L246: 1 | S246: =F246-E246 -> 0
A247: IRV Average | B247: w_is_condorcet_winner_ut_abs | E247: 0.64800000000000002 | F247: 0.64800000000000002 | G247: 10000 | H247: 33 | I247: 5 | J247: Spheroid | K247: Stretching | L247: 1 | S247: =F247-E247 -> 0
A248: IRV Average | B248: w_is_not_condorcet_winner_ut_abs | E248: 0.35199999999999998 | F248: 0.35199999999999998 | G248: 10000 | H248: 33 | I248: 5 | J248: Spheroid | K248: Stretching | L248: 1 | S248: =F248-E248 -> 0
A249: IRV Average | B249: w_missed_condorcet_winner_ut_abs | E249: 0.10639999999999999 | F249: 0.10639999999999999 | G249: 10000 | H249: 33 | I249: 5 | J249: Spheroid | K249: Stretching | L249: 1 | S249: =F249-E249 -> 0
A250: IRV Average | B250: w_is_resistant_condorcet_winner | E250: 3.7000000000000002E-3 | F250: 3.7000000000000002E-3 | G250: 10000 | H250: 33 | I250: 5 | J250: Spheroid | K250: Stretching | L250: 1 | S250: =F250-E250 -> 0
A251: IRV Average | B251: w_is_not_resistant_condorcet_winner | E251: 0.99629999999999996 | F251: 0.99629999999999996 | G251: 10000 | H251: 33 | I251: 5 | J251: Spheroid | K251: Stretching | L251: 1 | S251: =F251-E251 -> 0
A252: IRV Average | B252: w_missed_resistant_condorcet_winner | E252: 0 | F252: 0 | G252: 10000 | H252: 33 | I252: 5 | J252: Spheroid | K252: Stretching | L252: 1 | S252: =F252-E252 -> 0
A253: IRV Average | B253: TM | C253: TM_option = exact | D253: 21.988875 | E253: 0.36 | F253: 0.36 | G253: 10000 | H253: 33 | I253: 5 | J253: Spheroid | K253: Stretching | L253: 1 | S253: =F253-E253 -> 0
A254: IRV Average | B254: UM | C254: UM_option = exact | D254: 1476.94001 | E254: 0.36 | F254: 0.36 | G254: 10000 | H254: 33 | I254: 5 | J254: Spheroid | K254: Stretching | L254: 1 | S254: =F254-E254 -> 0
A255: IRV Average | B255: ICM | C255: ICM_option = lazy | D255: 0.93505199999999999 | E255: 0.35199999999999998 | F255: 0.35199999999999998 | G255: 10000 | H255: 33 | I255: 5 | J255: Spheroid | K255: Stretching | L255: 1 | S255: =F255-E255 -> 0
A256: IRV Average | B256: CM | C256: CM_option = lazy, UM_option = exact, ICM_option = lazy, TM_option = exact | D256: 11.577677 | E256: 0.36 | F256: 0.99960000000000004 | G256: 10000 | H256: 33 | I256: 5 | J256: Spheroid | K256: Stretching | L256: 1 | S256: =F256-E256 -> 0.63960000000000006
A257: IRV Duels | B257: w_is_condorcet_admissible | E257: 0.75439999999999996 | F257: 0.75439999999999996 | G257: 10000 | H257: 33 | I257: 5 | J257: Spheroid | K257: Stretching | L257: 1 | S257: =F257-E257 -> 0
A258: IRV Duels | B258: w_is_not_condorcet_admissible | E258: 0.24560000000000001 | F258: 0.24560000000000001 | G258: 10000 | H258: 33 | I258: 5 | J258: Spheroid | K258: Stretching | L258: 1 | S258: =F258-E258 -> 0
A259: IRV Duels | B259: w_missed_condorcet_admissible | E259: 0 | F259: 0 | G259: 10000 | H259: 33 | I259: 5 | J259: Spheroid | K259: Stretching | L259: 1 | S259: =F259-E259 -> 0
A260: IRV Duels | B260: w_is_weak_condorcet_winner | E260: 0.75439999999999996 | F260: 0.75439999999999996 | G260: 10000 | H260: 33 | I260: 5 | J260: Spheroid | K260: Stretching | L260: 1 | S260: =F260-E260 -> 0
A261: IRV Duels | B261: w_is_not_weak_condorcet_winner | E261: 0.24560000000000001 | F261: 0.24560000000000001 | G261: 10000 | H261: 33 | I261: 5 | J261: Spheroid | K261: Stretching | L261: 1 | S261: =F261-E261 -> 0
A262: IRV Duels | B262: w_missed_weak_condorcet_winner | E262: 0 | F262: 0 | G262: 10000 | H262: 33 | I262: 5 | J262: Spheroid | K262: Stretching | L262: 1 | S262: =F262-E262 -> 0
A263: IRV Duels | B263: w_is_condorcet_winner_rk_ctb | E263: 0.75439999999999996 | F263: 0.75439999999999996 | G263: 10000 | H263: 33 | I263: 5 | J263: Spheroid | K263: Stretching | L263: 1 | S263: =F263-E263 -> 0
A264: IRV Duels | B264: w_is_not_condorcet_winner_rk_ctb | E264: 0.24560000000000001 | F264: 0.24560000000000001 | G264: 10000 | H264: 33 | I264: 5 | J264: Spheroid | K264: Stretching | L264: 1 | S264: =F264-E264 -> 0
A265: IRV Duels | B265: w_missed_condorcet_winner_rk_ctb | E265: 0 | F265: 0 | G265: 10000 | H265: 33 | I265: 5 | J265: Spheroid | K265: Stretching | L265: 1 | S265: =F265-E265 -> 0
A266: IRV Duels | B266: w_is_condorcet_winner_rk | E266: 0.75439999999999996 | F266: 0.75439999999999996 | G266: 10000 | H266: 33 | I266: 5 | J266: Spheroid | K266: Stretching | L266: 1 | S266: =F266-E266 -> 0
A267: IRV Duels | B267: w_is_not_condorcet_winner_rk | E267: 0.24560000000000001 | F267: 0.24560000000000001 | G267: 10000 | H267: 33 | I267: 5 | J267: Spheroid | K267: Stretching | L267: 1 | S267: =F267-E267 -> 0
A268: IRV Duels | B268: w_missed_condorcet_winner_rk | E268: 0 | F268: 0 | G268: 10000 | H268: 33 | I268: 5 | J268: Spheroid | K268: Stretching | L268: 1 | S268: =F268-E268 -> 0
A269: IRV Duels | B269: w_is_condorcet_winner_ut_rel_ctb | E269: 0.75439999999999996 | F269: 0.75439999999999996 | G269: 10000 | H269: 33 | I269: 5 | J269: Spheroid | K269: Stretching | L269: 1 | S269: =F269-E269 -> 0
A270: IRV Duels | B270: w_is_not_condorcet_winner_ut_rel_ctb | E270: 0.24560000000000001 | F270: 0.24560000000000001 | G270: 10000 | H270: 33 | I270: 5 | J270: Spheroid | K270: Stretching | L270: 1 | S270: =F270-E270 -> 0
A271: IRV Duels | B271: w_missed_condorcet_winner_ut_rel_ctb | E271: 0 | F271: 0 | G271: 10000 | H271: 33 | I271: 5 | J271: Spheroid | K271: Stretching | L271: 1 | S271: =F271-E271 -> 0
A272: IRV Duels | B272: w_is_condorcet_winner_ut_rel | E272: 0.75439999999999996 | F272: 0.75439999999999996 | G272: 10000 | H272: 33 | I272: 5 | J272: Spheroid | K272: Stretching | L272: 1 | S272: =F272-E272 -> 0
A273: IRV Duels | B273: w_is_not_condorcet_winner_ut_rel | E273: 0.24560000000000001 | F273: 0.24560000000000001 | G273: 10000 | H273: 33 | I273: 5 | J273: Spheroid | K273: Stretching | L273: 1 | S273: =F273-E273 -> 0
A274: IRV Duels | B274: w_missed_condorcet_winner_ut_rel | E274: 0 | F274: 0 | G274: 10000 | H274: 33 | I274: 5 | J274: Spheroid | K274: Stretching | L274: 1 | S274: =F274-E274 -> 0
A275: IRV Duels | B275: w_is_condorcet_winner_ut_abs_ctb | E275: 0.75439999999999996 | F275: 0.75439999999999996 | G275: 10000 | H275: 33 | I275: 5 | J275: Spheroid | K275: Stretching | L275: 1 | S275: =F275-E275 -> 0
A276: IRV Duels | B276: w_is_not_condorcet_winner_ut_abs_ctb | E276: 0.24560000000000001 | F276: 0.24560000000000001 | G276: 10000 | H276: 33 | I276: 5 | J276: Spheroid | K276: Stretching | L276: 1 | S276: =F276-E276 -> 0
A277: IRV Duels | B277: w_missed_condorcet_winner_ut_abs_ctb | E277: 0 | F277: 0 | G277: 10000 | H277: 33 | I277: 5 | J277: Spheroid | K277: Stretching | L277: 1 | S277: =F277-E277 -> 0
A278: IRV Duels | B278: w_is_condorcet_winner_ut_abs | E278: 0.75439999999999996 | F278: 0.75439999999999996 | G278: 10000 | H278: 33 | I278: 5 | J278: Spheroid | K278: Stretching | L278: 1 | S278: =F278-E278 -> 0
A279: IRV Duels | B279: w_is_not_condorcet_winner_ut_abs | E279: 0.24560000000000001 | F279: 0.24560000000000001 | G279: 10000 | H279: 33 | I279: 5 | J279: Spheroid | K279: Stretching | L279: 1 | S279: =F279-E279 -> 0
A280: IRV Duels | B280: w_missed_condorcet_winner_ut_abs | E280: 0 | F280: 0 | G280: 10000 | H280: 33 | I280: 5 | J280: Spheroid | K280: Stretching | L280: 1 | S280: =F280-E280 -> 0
A281: IRV Duels | B281: w_is_resistant_condorcet_winner | E281: 3.7000000000000002E-3 | F281: 3.7000000000000002E-3 | G281: 10000 | H281: 33 | I281: 5 | J281: Spheroid | K281: Stretching | L281: 1 | S281: =F281-E281 -> 0
A282: IRV Duels | B282: w_is_not_resistant_condorcet_winner | E282: 0.99629999999999996 | F282: 0.99629999999999996 | G282: 10000 | H282: 33 | I282: 5 | J282: Spheroid | K282: Stretching | L282: 1 | S282: =F282-E282 -> 0
A283: IRV Duels | B283: w_missed_resistant_condorcet_winner | E283: 0 | F283: 0 | G283: 10000 | H283: 33 | I283: 5 | J283: Spheroid | K283: Stretching | L283: 1 | S283: =F283-E283 -> 0
A284: IRV Duels | B284: TM | C284: TM_option = exact | D284: 22.987404000000002 | E284: 0.89700000000000002 | F284: 0.89700000000000002 | G284: 10000 | H284: 33 | I284: 5 | J284: Spheroid | K284: Stretching | L284: 1 | S284: =F284-E284 -> 0
A285: IRV Duels | B285: UM | C285: UM_option = exact | D285: 461.617908 | E285: 0.93159999999999998 | F285: 0.93159999999999998 | G285: 10000 | H285: 33 | I285: 5 | J285: Spheroid | K285: Stretching | L285: 1 | S285: =F285-E285 -> 0
A286: IRV Duels | B286: ICM | C286: ICM_option = exact | D286: 0.91104700000000005 | E286: 0.24560000000000001 | F286: 0.24560000000000001 | G286: 10000 | H286: 33 | I286: 5 | J286: Spheroid | K286: Stretching | L286: 1 | S286: =F286-E286 -> 0
A287: IRV Duels | B287: CM | C287: CM_option = lazy, UM_option = exact, TM_option = exact | D287: 2.2961369999999999 | E287: 0.93159999999999998 | F287: 0.99629999999999996 | G287: 10000 | H287: 33 | I287: 5 | J287: Spheroid | K287: Stretching | L287: 1 | S287: =F287-E287 -> 6.469999999999998E-2
A288: Iterated Bucklin | B288: w_is_condorcet_admissible | E288: 0.70599999999999996 | F288: 0.70599999999999996 | G288: 10000 | H288: 33 | I288: 5 | J288: Spheroid | K288: Stretching | L288: 1 | S288: =F288-E288 -> 0
A289: Iterated Bucklin | B289: w_is_not_condorcet_admissible | E289: 0.29399999999999998 | F289: 0.29399999999999998 | G289: 10000 | H289: 33 | I289: 5 | J289: Spheroid | K289: Stretching | L289: 1 | S289: =F289-E289 -> 0
A290: Iterated Bucklin | B290: w_missed_condorcet_admissible | E290: 4.8399999999999999E-2 | F290: 4.8399999999999999E-2 | G290: 10000 | H290: 33 | I290: 5 | J290: Spheroid | K290: Stretching | L290: 1 | S290: =F290-E290 -> 0
A291: Iterated Bucklin | B291: w_is_weak_condorcet_winner | E291: 0.70599999999999996 | F291: 0.70599999999999996 | G291: 10000 | H291: 33 | I291: 5 | J291: Spheroid | K291: Stretching | L291: 1 | S291: =F291-E291 -> 0
A292: Iterated Bucklin | B292: w_is_not_weak_condorcet_winner | E292: 0.29399999999999998 | F292: 0.29399999999999998 | G292: 10000 | H292: 33 | I292: 5 | J292: Spheroid | K292: Stretching | L292: 1 | S292: =F292-E292 -> 0
A293: Iterated Bucklin | B293: w_missed_weak_condorcet_winner | E293: 4.8399999999999999E-2 | F293: 4.8399999999999999E-2 | G293: 10000 | H293: 33 | I293: 5 | J293: Spheroid | K293: Stretching | L293: 1 | S293: =F293-E293 -> 0
A294: Iterated Bucklin | B294: w_is_condorcet_winner_rk_ctb | E294: 0.70599999999999996 | F294: 0.70599999999999996 | G294: 10000 | H294: 33 | I294: 5 | J294: Spheroid | K294: Stretching | L294: 1 | S294: =F294-E294 -> 0
A295: Iterated Bucklin | B295: w_is_not_condorcet_winner_rk_ctb | E295: 0.29399999999999998 | F295: 0.29399999999999998 | G295: 10000 | H295: 33 | I295: 5 | J295: Spheroid | K295: Stretching | L295: 1 | S295: =F295-E295 -> 0
A296: Iterated Bucklin | B296: w_missed_condorcet_winner_rk_ctb | E296: 4.8399999999999999E-2 | F296: 4.8399999999999999E-2 | G296: 10000 | H296: 33 | I296: 5 | J296: Spheroid | K296: Stretching | L296: 1 | S296: =F296-E296 -> 0
A297: Iterated Bucklin | B297: w_is_condorcet_winner_rk | E297: 0.70599999999999996 | F297: 0.70599999999999996 | G297: 10000 | H297: 33 | I297: 5 | J297: Spheroid | K297: Stretching | L297: 1 | S297: =F297-E297 -> 0
A298: Iterated Bucklin | B298: w_is_not_condorcet_winner_rk | E298: 0.29399999999999998 | F298: 0.29399999999999998 | G298: 10000 | H298: 33 | I298: 5 | J298: Spheroid | K298: Stretching | L298: 1 | S298: =F298-E298 -> 0
A299: Iterated Bucklin | B299: w_missed_condorcet_winner_rk | E299: 4.8399999999999999E-2 | F299: 4.8399999999999999E-2 | G299: 10000 | H299: 33 | I299: 5 | J299: Spheroid | K299: Stretching | L299: 1 | S299: =F299-E299 -> 0
A300: Iterated Bucklin | B300: w_is_condorcet_winner_ut_rel_ctb | E300: 0.70599999999999996 | F300: 0.70599999999999996 | G300: 10000 | H300: 33 | I300: 5 | J300: Spheroid | K300: Stretching | L300: 1 | S300: =F300-E300 -> 0
A301: Iterated Bucklin | B301: w_is_not_condorcet_winner_ut_rel_ctb | E301: 0.29399999999999998 | F301: 0.29399999999999998 | G301: 10000 | H301: 33 | I301: 5 | J301: Spheroid | K301: Stretching | L301: 1 | S301: =F301-E301 -> 0
A302: Iterated Bucklin | B302: w_missed_condorcet_winner_ut_rel_ctb | E302: 4.8399999999999999E-2 | F302: 4.8399999999999999E-2 | G302: 10000 | H302: 33 | I302: 5 | J302: Spheroid | K302: Stretching | L302: 1 | S302: =F302-E302 -> 0
A303: Iterated Bucklin | B303: w_is_condorcet_winner_ut_rel | E303: 0.70599999999999996 | F303: 0.70599999999999996 | G303: 10000 | H303: 33 | I303: 5 | J303: Spheroid | K303: Stretching | L303: 1 | S303: =F303-E303 -> 0
A304: Iterated Bucklin | B304: w_is_not_condorcet_winner_ut_rel | E304: 0.29399999999999998 | F304: 0.29399999999999998 | G304: 10000 | H304: 33 | I304: 5 | J304: Spheroid | K304: Stretching | L304: 1 | S304: =F304-E304 -> 0
A305: Iterated Bucklin | B305: w_missed_condorcet_winner_ut_rel | E305: 4.8399999999999999E-2 | F305: 4.8399999999999999E-2 | G305: 10000 | H305: 33 | I305: 5 | J305: Spheroid | K305: Stretching | L305: 1 | S305: =F305-E305 -> 0
A306: Iterated Bucklin | B306: w_is_condorcet_winner_ut_abs_ctb | E306: 0.70599999999999996 | F306: 0.70599999999999996 | G306: 10000 | H306: 33 | I306: 5 | J306: Spheroid | K306: Stretching | L306: 1 | S306: =F306-E306 -> 0
A307: Iterated Bucklin | B307: w_is_not_condorcet_winner_ut_abs_ctb | E307: 0.29399999999999998 | F307: 0.29399999999999998 | G307: 10000 | H307: 33 | I307: 5 | J307: Spheroid | K307: Stretching | L307: 1 | S307: =F307-E307 -> 0
A308: Iterated Bucklin | B308: w_missed_condorcet_winner_ut_abs_ctb | E308: 4.8399999999999999E-2 | F308: 4.8399999999999999E-2 | G308: 10000 | H308: 33 | I308: 5 | J308: Spheroid | K308: Stretching | L308: 1 | S308: =F308-E308 -> 0
A309: Iterated Bucklin | B309: w_is_condorcet_winner_ut_abs | E309: 0.70599999999999996 | F309: 0.70599999999999996 | G309: 10000 | H309: 33 | I309: 5 | J309: Spheroid | K309: Stretching | L309: 1 | S309: =F309-E309 -> 0
A310: Iterated Bucklin | B310: w_is_not_condorcet_winner_ut_abs | E310: 0.29399999999999998 | F310: 0.29399999999999998 | G310: 10000 | H310: 33 | I310: 5 | J310: Spheroid | K310: Stretching | L310: 1 | S310: =F310-E310 -> 0
A311: Iterated Bucklin | B311: w_missed_condorcet_winner_ut_abs | E311: 4.8399999999999999E-2 | F311: 4.8399999999999999E-2 | G311: 10000 | H311: 33 | I311: 5 | J311: Spheroid | K311: Stretching | L311: 1 | S311: =F311-E311 -> 0
A312: Iterated Bucklin | B312: w_is_resistant_condorcet_winner | E312: 3.7000000000000002E-3 | F312: 3.7000000000000002E-3 | G312: 10000 | H312: 33 | I312: 5 | J312: Spheroid | K312: Stretching | L312: 1 | S312: =F312-E312 -> 0
A313: Iterated Bucklin | B313: w_is_not_resistant_condorcet_winner | E313: 0.99629999999999996 | F313: 0.99629999999999996 | G313: 10000 | H313: 33 | I313: 5 | J313: Spheroid | K313: Stretching | L313: 1 | S313: =F313-E313 -> 0
A314: Iterated Bucklin | B314: w_missed_resistant_condorcet_winner | E314: 0 | F314: 0 | G314: 10000 | H314: 33 | I314: 5 | J314: Spheroid | K314: Stretching | L314: 1 | S314: =F314-E314 -> 0
A315: Iterated Bucklin | B315: TM | C315: TM_option = exact | D315: 21.58681 | E315: 0.9657 | F315: 0.9657 | G315: 10000 | H315: 33 | I315: 5 | J315: Spheroid | K315: Stretching | L315: 1 | S315: =F315-E315 -> 0
A316: Iterated Bucklin | B316: UM | C316: UM_option = exact | D316: 148.397109 | E316: 0.99070000000000003 | F316: 0.99070000000000003 | G316: 10000 | H316: 33 | I316: 5 | J316: Spheroid | K316: Stretching | L316: 1 | S316: =F316-E316 -> 0
A317: Iterated Bucklin | B317: ICM | C317: ICM_option = lazy | D317: 0.94255900000000004 | E317: 0.29399999999999998 | F317: 0.29399999999999998 | G317: 10000 | H317: 33 | I317: 5 | J317: Spheroid | K317: Stretching | L317: 1 | S317: =F317-E317 -> 0
A318: Iterated Bucklin | B318: CM | C318: CM_option = lazy, UM_option = exact, ICM_option = lazy, TM_option = exact | D318: 1.6760999999999999 | E318: 0.99080000000000001 | F318: 0.99960000000000004 | G318: 10000 | H318: 33 | I318: 5 | J318: Spheroid | K318: Stretching | L318: 1 | S318: =F318-E318 -> 8.80000000000003E-3
A319: Kemeny | B319: w_is_condorcet_admissible | E319: 0.75439999999999996 | F319: 0.75439999999999996 | G319: 10000 | H319: 33 | I319: 5 | J319: Spheroid | K319: Stretching | L319: 1 | S319: =F319-E319 -> 0
A320: Kemeny | B320: w_is_not_condorcet_admissible | E320: 0.24560000000000001 | F320: 0.24560000000000001 | G320: 10000 | H320: 33 | I320: 5 | J320: Spheroid | K320: Stretching | L320: 1 | S320: =F320-E320 -> 0
A321: Kemeny | B321: w_missed_condorcet_admissible | E321: 0 | F321: 0 | G321: 10000 | H321: 33 | I321: 5 | J321: Spheroid | K321: Stretching | L321: 1 | S321: =F321-E321 -> 0
A322: Kemeny | B322: w_is_weak_condorcet_winner | E322: 0.75439999999999996 | F322: 0.75439999999999996 | G322: 10000 | H322: 33 | I322: 5 | J322: Spheroid | K322: Stretching | L322: 1 | S322: =F322-E322 -> 0
A323: Kemeny | B323: w_is_not_weak_condorcet_winner | E323: 0.24560000000000001 | F323: 0.24560000000000001 | G323: 10000 | H323: 33 | I323: 5 | J323: Spheroid | K323: Stretching | L323: 1 | S323: =F323-E323 -> 0
A324: Kemeny | B324: w_missed_weak_condorcet_winner | E324: 0 | F324: 0 | G324: 10000 | H324: 33 | I324: 5 | J324: Spheroid | K324: Stretching | L324: 1 | S324: =F324-E324 -> 0
A325: Kemeny | B325: w_is_condorcet_winner_rk_ctb | E325: 0.75439999999999996 | F325: 0.75439999999999996 | G325: 10000 | H325: 33 | I325: 5 | J325: Spheroid | K325: Stretching | L325: 1 | S325: =F325-E325 -> 0
A326: Kemeny | B326: w_is_not_condorcet_winner_rk_ctb | E326: 0.24560000000000001 | F326: 0.24560000000000001 | G326: 10000 | H326: 33 | I326: 5 | J326: Spheroid | K326: Stretching | L326: 1 | S326: =F326-E326 -> 0
A327: Kemeny | B327: w_missed_condorcet_winner_rk_ctb | E327: 0 | F327: 0 | G327: 10000 | H327: 33 | I327: 5 | J327: Spheroid | K327: Stretching | L327: 1 | S327: =F327-E327 -> 0
A328: Kemeny | B328: w_is_condorcet_winner_rk | E328: 0.75439999999999996 | F328: 0.75439999999999996 | G328: 10000 | H328: 33 | I328: 5 | J328: Spheroid | K328: Stretching | L328: 1 | S328: =F328-E328 -> 0
A329: Kemeny | B329: w_is_not_condorcet_winner_rk | E329: 0.24560000000000001 | F329: 0.24560000000000001 | G329: 10000 | H329: 33 | I329: 5 | J329: Spheroid | K329: Stretching | L329: 1 | S329: =F329-E329 -> 0
A330: Kemeny | B330: w_missed_condorcet_winner_rk | E330: 0 | F330: 0 | G330: 10000 | H330: 33 | I330: 5 | J330: Spheroid | K330: Stretching | L330: 1 | S330: =F330-E330 -> 0
A331: Kemeny | B331: w_is_condorcet_winner_ut_rel_ctb | E331: 0.75439999999999996 | F331: 0.75439999999999996 | G331: 10000 | H331: 33 | I331: 5 | J331: Spheroid | K331: Stretching | L331: 1 | S331: =F331-E331 -> 0
A332: Kemeny | B332: w_is_not_condorcet_winner_ut_rel_ctb | E332: 0.24560000000000001 | F332: 0.24560000000000001 | G332: 10000 | H332: 33 | I332: 5 | J332: Spheroid | K332: Stretching | L332: 1 | S332: =F332-E332 -> 0
A333: Kemeny | B333: w_missed_condorcet_winner_ut_rel_ctb | E333: 0 | F333: 0 | G333: 10000 | H333: 33 | I333: 5 | J333: Spheroid | K333: Stretching | L333: 1 | S333: =F333-E333 -> 0
A334: Kemeny | B334: w_is_condorcet_winner_ut_rel | E334: 0.75439999999999996 | F334: 0.75439999999999996 | G334: 10000 | H334: 33 | I334: 5 | J334: Spheroid | K334: Stretching | L334: 1 | S334: =F334-E334 -> 0
A335: Kemeny | B335: w_is_not_condorcet_winner_ut_rel | E335: 0.24560000000000001 | F335: 0.24560000000000001 | G335: 10000 | H335: 33 | I335: 5 | J335: Spheroid | K335: Stretching | L335: 1 | S335: =F335-E335 -> 0
A336: Kemeny | B336: w_missed_condorcet_winner_ut_rel | E336: 0 | F336: 0 | G336: 10000 | H336: 33 | I336: 5 | J336: Spheroid | K336: Stretching | L336: 1 | S336: =F336-E336 -> 0
A337: Kemeny | B337: w_is_condorcet_winner_ut_abs_ctb | E337: 0.75439999999999996 | F337: 0.75439999999999996 | G337: 10000 | H337: 33 | I337: 5 | J337: Spheroid | K337: Stretching | L337: 1 | S337: =F337-E337 -> 0
A338: Kemeny | B338: w_is_not_condorcet_winner_ut_abs_ctb | E338: 0.24560000000000001 | F338: 0.24560000000000001 | G338: 10000 | H338: 33 | I338: 5 | J338: Spheroid | K338: Stretching | L338: 1 | S338: =F338-E338 -> 0
A339: Kemeny | B339: w_missed_condorcet_winner_ut_abs_ctb | E339: 0 | F339: 0 | G339: 10000 | H339: 33 | I339: 5 | J339: Spheroid | K339: Stretching | L339: 1 | S339: =F339-E339 -> 0
A340: Kemeny | B340: w_is_condorcet_winner_ut_abs | E340: 0.75439999999999996 | F340: 0.75439999999999996 | G340: 10000 | H340: 33 | I340: 5 | J340: Spheroid | K340: Stretching | L340: 1 | S340: =F340-E340 -> 0
A341: Kemeny | B341: w_is_not_condorcet_winner_ut_abs | E341: 0.24560000000000001 | F341: 0.24560000000000001 | G341: 10000 | H341: 33 | I341: 5 | J341: Spheroid | K341: Stretching | L341: 1 | S341: =F341-E341 -> 0
A342: Kemeny | B342: w_missed_condorcet_winner_ut_abs | E342: 0 | F342: 0 | G342: 10000 | H342: 33 | I342: 5 | J342: Spheroid | K342: Stretching | L342: 1 | S342: =F342-E342 -> 0
A343: Kemeny | B343: w_is_resistant_condorcet_winner | E343: 3.7000000000000002E-3 | F343: 3.7000000000000002E-3 | G343: 10000 | H343: 33 | I343: 5 | J343: Spheroid | K343: Stretching | L343: 1 | S343: =F343-E343 -> 0
A344: Kemeny | B344: w_is_not_resistant_condorcet_winner | E344: 0.99629999999999996 | F344: 0.99629999999999996 | G344: 10000 | H344: 33 | I344: 5 | J344: Spheroid | K344: Stretching | L344: 1 | S344: =F344-E344 -> 0
A345: Kemeny | B345: w_missed_resistant_condorcet_winner | E345: 0 | F345: 0 | G345: 10000 | H345: 33 | I345: 5 | J345: Spheroid | K345: Stretching | L345: 1 | S345: =F345-E345 -> 0
A346: Kemeny | B346: TM | C346: TM_option = exact | D346: 117.538736 | E346: 0.96230000000000004 | F346: 0.96230000000000004 | G346: 10000 | H346: 33 | I346: 5 | J346: Spheroid | K346: Stretching | L346: 1 | S346: =F346-E346 -> 0
A347: Kemeny | B347: UM | C347: UM_option = exact | D347: 411.15593100000001 | E347: 0.96609999999999996 | F347: 0.96609999999999996 | G347: 10000 | H347: 33 | I347: 5 | J347: Spheroid | K347: Stretching | L347: 1 | S347: =F347-E347 -> 0
A348: Kemeny | B348: ICM | C348: ICM_option = exact | D348: 0.97304800000000002 | E348: 0.24560000000000001 | F348: 0.24560000000000001 | G348: 10000 | H348: 33 | I348: 5 | J348: Spheroid | K348: Stretching | L348: 1 | S348: =F348-E348 -> 0
A349: Kemeny | B349: CM | C349: CM_option = lazy, UM_option = exact, TM_option = exact | D349: 1.8691009999999999 | E349: 0.96609999999999996 | F349: 0.99629999999999996 | G349: 10000 | H349: 33 | I349: 5 | J349: Spheroid | K349: Stretching | L349: 1 | S349: =F349-E349 -> 3.0200000000000005E-2
A350: Kim-Roush | B350: w_is_condorcet_admissible | E350: 0.63170000000000004 | F350: 0.63170000000000004 | G350: 10000 | H350: 33 | I350: 5 | J350: Spheroid | K350: Stretching | L350: 1 | S350: =F350-E350 -> 0
A351: Kim-Roush | B351: w_is_not_condorcet_admissible | E351: 0.36830000000000002 | F351: 0.36830000000000002 | G351: 10000 | H351: 33 | I351: 5 | J351: Spheroid | K351: Stretching | L351: 1 | S351: =F351-E351 -> 0
A352: Kim-Roush | B352: w_missed_condorcet_admissible | E352: 0.1227 | F352: 0.1227 | G352: 10000 | H352: 33 | I352: 5 | J352: Spheroid | K352: Stretching | L352: 1 | S352: =F352-E352 -> 0
A353: Kim-Roush | B353: w_is_weak_condorcet_winner | E353: 0.63170000000000004 | F353: 0.63170000000000004 | G353: 10000 | H353: 33 | I353: 5 | J353: Spheroid | K353: Stretching | L353: 1 | S353: =F353-E353 -> 0
A354: Kim-Roush | B354: w_is_not_weak_condorcet_winner | E354: 0.36830000000000002 | F354: 0.36830000000000002 | G354: 10000 | H354: 33 | I354: 5 | J354: Spheroid | K354: Stretching | L354: 1 | S354: =F354-E354 -> 0
A355: Kim-Roush | B355: w_missed_weak_condorcet_winner | E355: 0.1227 | F355: 0.1227 | G355: 10000 | H355: 33 | I355: 5 | J355: Spheroid | K355: Stretching | L355: 1 | S355: =F355-E355 -> 0
A356: Kim-Roush | B356: w_is_condorcet_winner_rk_ctb | E356: 0.63170000000000004 | F356: 0.63170000000000004 | G356: 10000 | H356: 33 | I356: 5 | J356: Spheroid | K356: Stretching | L356: 1 | S356: =F356-E356 -> 0
A357: Kim-Roush | B357: w_is_not_condorcet_winner_rk_ctb | E357: 0.36830000000000002 | F357: 0.36830000000000002 | G357: 10000 | H357: 33 | I357: 5 | J357: Spheroid | K357: Stretching | L357: 1 | S357: =F357-E357 -> 0
A358: Kim-Roush | B358: w_missed_condorcet_winner_rk_ctb | E358: 0.1227 | F358: 0.1227 | G358: 10000 | H358: 33 | I358: 5 | J358: Spheroid | K358: Stretching | L358: 1 | S358: =F358-E358 -> 0
A359: Kim-Roush | B359: w_is_condorcet_winner_rk | E359: 0.63170000000000004 | F359: 0.63170000000000004 | G359: 10000 | H359: 33 | I359: 5 | J359: Spheroid | K359: Stretching | L359: 1 | S359: =F359-E359 -> 0
A360: Kim-Roush | B360: w_is_not_condorcet_winner_rk | E360: 0.36830000000000002 | F360: 0.36830000000000002 | G360: 10000 | H360: 33 | I360: 5 | J360: Spheroid | K360: Stretching | L360: 1 | S360: =F360-E360 -> 0
A361: Kim-Roush | B361: w_missed_condorcet_winner_rk | E361: 0.1227 | F361: 0.1227 | G361: 10000 | H361: 33 | I361: 5 | J361: Spheroid | K361: Stretching | L361: 1 | S361: =F361-E361 -> 0
A362: Kim-Roush | B362: w_is_condorcet_winner_ut_rel_ctb | E362: 0.63170000000000004 | F362: 0.63170000000000004 | G362: 10000 | H362: 33 | I362: 5 | J362: Spheroid | K362: Stretching | L362: 1 | S362: =F362-E362 -> 0
A363: Kim-Roush | B363: w_is_not_condorcet_winner_ut_rel_ctb | E363: 0.36830000000000002 | F363: 0.36830000000000002 | G363: 10000 | H363: 33 | I363: 5 | J363: Spheroid | K363: Stretching | L363: 1 | S363: =F363-E363 -> 0
A364: Kim-Roush | B364: w_missed_condorcet_winner_ut_rel_ctb | E364: 0.1227 | F364: 0.1227 | G364: 10000 | H364: 33 | I364: 5 | J364: Spheroid | K364: Stretching | L364: 1 | S364: =F364-E364 -> 0
A365: Kim-Roush | B365: w_is_condorcet_winner_ut_rel | E365: 0.63170000000000004 | F365: 0.63170000000000004 | G365: 10000 | H365: 33 | I365: 5 | J365: Spheroid | K365: Stretching | L365: 1 | S365: =F365-E365 -> 0
A366: Kim-Roush | B366: w_is_not_condorcet_winner_ut_rel | E366: 0.36830000000000002 | F366: 0.36830000000000002 | G366: 10000 | H366: 33 | I366: 5 | J366: Spheroid | K366: Stretching | L366: 1 | S366: =F366-E366 -> 0
A367: Kim-Roush | B367: w_missed_condorcet_winner_ut_rel | E367: 0.1227 | F367: 0.1227 | G367: 10000 | H367: 33 | I367: 5 | J367: Spheroid | K367: Stretching | L367: 1 | S367: =F367-E367 -> 0
A368: Kim-Roush | B368: w_is_condorcet_winner_ut_abs_ctb | E368: 0.63170000000000004 | F368: 0.63170000000000004 | G368: 10000 | H368: 33 | I368: 5 | J368: Spheroid | K368: Stretching | L368: 1 | S368: =F368-E368 -> 0
A369: Kim-Roush | B369: w_is_not_condorcet_winner_ut_abs_ctb | E369: 0.36830000000000002 | F369: 0.36830000000000002 | G369: 10000 | H369: 33 | I369: 5 | J369: Spheroid | K369: Stretching | L369: 1 | S369: =F369-E369 -> 0
A370: Kim-Roush | B370: w_missed_condorcet_winner_ut_abs_ctb | E370: 0.1227 | F370: 0.1227 | G370: 10000 | H370: 33 | I370: 5 | J370: Spheroid | K370: Stretching | L370: 1 | S370: =F370-E370 -> 0
A371: Kim-Roush | B371: w_is_condorcet_winner_ut_abs | E371: 0.63170000000000004 | F371: 0.63170000000000004 | G371: 10000 | H371: 33 | I371: 5 | J371: Spheroid | K371: Stretching | L371: 1 | S371: =F371-E371 -> 0
A372: Kim-Roush | B372: w_is_not_condorcet_winner_ut_abs | E372: 0.36830000000000002 | F372: 0.36830000000000002 | G372: 10000 | H372: 33 | I372: 5 | J372: Spheroid | K372: Stretching | L372: 1 | S372: =F372-E372 -> 0
A373: Kim-Roush | B373: w_missed_condorcet_winner_ut_abs | E373: 0.1227 | F373: 0.1227 | G373: 10000 | H373: 33 | I373: 5 | J373: Spheroid | K373: Stretching | L373: 1 | S373: =F373-E373 -> 0
A374: Kim-Roush | B374: w_is_resistant_condorcet_winner | E374: 3.5999999999999999E-3 | F374: 3.5999999999999999E-3 | G374: 10000 | H374: 33 | I374: 5 | J374: Spheroid | K374: Stretching | L374: 1 | S374: =F374-E374 -> 0
A375: Kim-Roush | B375: w_is_not_resistant_condorcet_winner | E375: 0.99639999999999995 | F375: 0.99639999999999995 | G375: 10000 | H375: 33 | I375: 5 | J375: Spheroid | K375: Stretching | L375: 1 | S375: =F375-E375 -> 0
A376: Kim-Roush | B376: w_missed_resistant_condorcet_winner | E376: 1E-4 | F376: 1E-4 | G376: 10000 | H376: 33 | I376: 5 | J376: Spheroid | K376: Stretching | L376: 1 | S376: =F376-E376 -> 0
A377: Kim-Roush | B377: TM | C377: TM_option = exact | D377: 16.872002999999999 | E377: 0.94869999999999999 | F377: 0.94869999999999999 | G377: 10000 | H377: 33 | I377: 5 | J377: Spheroid | K377: Stretching | L377: 1 | S377: =F377-E377 -> 0
A378: Kim-Roush | B378: UM | C378: UM_option = exact | D378: 818.80789000000004 | E378: 0.95179999999999998 | F378: 0.95179999999999998 | G378: 10000 | H378: 33 | I378: 5 | J378: Spheroid | K378: Stretching | L378: 1 | S378: =F378-E378 -> 0
A379: Kim-Roush | B379: ICM | C379: ICM_option = lazy | D379: 5.6973760000000002 | E379: 0 | F379: 1 | G379: 10000 | H379: 33 | I379: 5 | J379: Spheroid | K379: Stretching | L379: 1 | S379: =F379-E379 -> 1
A380: Kim-Roush | B380: CM | C380: CM_option = lazy, UM_option = exact, ICM_option = lazy, TM_option = exact | D380: 1.9691240000000001 | E380: 0.95179999999999998 | F380: 1 | G380: 10000 | H380: 33 | I380: 5 | J380: Spheroid | K380: Stretching | L380: 1 | S380: =F380-E380 -> 4.8200000000000021E-2
A381: Majority Judgment | B381: w_is_condorcet_admissible | E381: 0.50029999999999997 | F381: 0.50029999999999997 | G381: 10000 | H381: 33 | I381: 5 | J381: Spheroid | K381: Stretching | L381: 1 | S381: =F381-E381 -> 0
A382: Majority Judgment | B382: w_is_not_condorcet_admissible | E382: 0.49969999999999998 | F382: 0.49969999999999998 | G382: 10000 | H382: 33 | I382: 5 | J382: Spheroid | K382: Stretching | L382: 1 | S382: =F382-E382 -> 0
A383: Majority Judgment | B383: w_missed_condorcet_admissible | E383: 0.25409999999999999 | F383: 0.25409999999999999 | G383: 10000 | H383: 33 | I383: 5 | J383: Spheroid | K383: Stretching | L383: 1 | S383: =F383-E383 -> 0
A384: Majority Judgment | B384: w_is_weak_condorcet_winner | E384: 0.50029999999999997 | F384: 0.50029999999999997 | G384: 10000 | H384: 33 | I384: 5 | J384: Spheroid | K384: Stretching | L384: 1 | S384: =F384-E384 -> 0
A385: Majority Judgment | B385: w_is_not_weak_condorcet_winner | E385: 0.49969999999999998 | F385: 0.49969999999999998 | G385: 10000 | H385: 33 | I385: 5 | J385: Spheroid | K385: Stretching | L385: 1 | S385: =F385-E385 -> 0
A386: Majority Judgment | B386: w_missed_weak_condorcet_winner | E386: 0.25409999999999999 | F386: 0.25409999999999999 | G386: 10000 | H386: 33 | I386: 5 | J386: Spheroid | K386: Stretching | L386: 1 | S386: =F386-E386 -> 0
A387: Majority Judgment | B387: w_is_condorcet_winner_rk_ctb | E387: 0.50029999999999997 | F387: 0.50029999999999997 | G387: 10000 | H387: 33 | I387: 5 | J387: Spheroid | K387: Stretching | L387: 1 | S387: =F387-E387 -> 0
A388: Majority Judgment | B388: w_is_not_condorcet_winner_rk_ctb | E388: 0.49969999999999998 | F388: 0.49969999999999998 | G388: 10000 | H388: 33 | I388: 5 | J388: Spheroid | K388: Stretching | L388: 1 | S388: =F388-E388 -> 0
A389: Majority Judgment | B389: w_missed_condorcet_winner_rk_ctb | E389: 0.25409999999999999 | F389: 0.25409999999999999 | G389: 10000 | H389: 33 | I389: 5 | J389: Spheroid | K389: Stretching | L389: 1 | S389: =F389-E389 -> 0
A390: Majority Judgment | B390: w_is_condorcet_winner_rk | E390: 0.50029999999999997 | F390: 0.50029999999999997 | G390: 10000 | H390: 33 | I390: 5 | J390: Spheroid | K390: Stretching | L390: 1 | S390: =F390-E390 -> 0
A391: Majority Judgment | B391: w_is_not_condorcet_winner_rk | E391: 0.49969999999999998 | F391: 0.49969999999999998 | G391: 10000 | H391: 33 | I391: 5 | J391: Spheroid | K391: Stretching | L391: 1 | S391: =F391-E391 -> 0
A392: Majority Judgment | B392: w_missed_condorcet_winner_rk | E392: 0.25409999999999999 | F392: 0.25409999999999999 | G392: 10000 | H392: 33 | I392: 5 | J392: Spheroid | K392: Stretching | L392: 1 | S392: =F392-E392 -> 0
A393: Majority Judgment | B393: w_is_condorcet_winner_ut_rel_ctb | E393: 0.50029999999999997 | F393: 0.50029999999999997 | G393: 10000 | H393: 33 | I393: 5 | J393: Spheroid | K393: Stretching | L393: 1 | S393: =F393-E393 -> 0
A394: Majority Judgment | B394: w_is_not_condorcet_winner_ut_rel_ctb | E394: 0.49969999999999998 | F394: 0.49969999999999998 | G394: 10000 | H394: 33 | I394: 5 | J394: Spheroid | K394: Stretching | L394: 1 | S394: =F394-E394 -> 0
A395: Majority Judgment | B395: w_missed_condorcet_winner_ut_rel_ctb | E395: 0.25409999999999999 | F395: 0.25409999999999999 | G395: 10000 | H395: 33 | I395: 5 | J395: Spheroid | K395: Stretching | L395: 1 | S395: =F395-E395 -> 0
A396: Majority Judgment | B396: w_is_condorcet_winner_ut_rel | E396: 0.50029999999999997 | F396: 0.50029999999999997 | G396: 10000 | H396: 33 | I396: 5 | J396: Spheroid | K396: Stretching | L396: 1 | S396: =F396-E396 -> 0
A397: Majority Judgment | B397: w_is_not_condorcet_winner_ut_rel | E397: 0.49969999999999998 | F397: 0.49969999999999998 | G397: 10000 | H397: 33 | I397: 5 | J397: Spheroid | K397: Stretching | L397: 1 | S397: =F397-E397 -> 0
A398: Majority Judgment | B398: w_missed_condorcet_winner_ut_rel | E398: 0.25409999999999999 | F398: 0.25409999999999999 | G398: 10000 | H398: 33 | I398: 5 | J398: Spheroid | K398: Stretching | L398: 1 | S398: =F398-E398 -> 0
A399: Majority Judgment | B399: w_is_condorcet_winner_ut_abs_ctb | E399: 0.50029999999999997 | F399: 0.50029999999999997 | G399: 10000 | H399: 33 | I399: 5 | J399: Spheroid | K399: Stretching | L399: 1 | S399: =F399-E399 -> 0
A400: Majority Judgment | B400: w_is_not_condorcet_winner_ut_abs_ctb | E400: 0.49969999999999998 | F400: 0.49969999999999998 | G400: 10000 | H400: 33 | I400: 5 | J400: Spheroid | K400: Stretching | L400: 1 | S400: =F400-E400 -> 0
A401: Majority Judgment | B401: w_missed_condorcet_winner_ut_abs_ctb | E401: 0.25409999999999999 | F401: 0.25409999999999999 | G401: 10000 | H401: 33 | I401: 5 | J401: Spheroid | K401: Stretching | L401: 1 | S401: =F401-E401 -> 0
A402: Majority Judgment | B402: w_is_condorcet_winner_ut_abs | E402: 0.50029999999999997 | F402: 0.50029999999999997 | G402: 10000 | H402: 33 | I402: 5 | J402: Spheroid | K402: Stretching | L402: 1 | S402: =F402-E402 -> 0
A403: Majority Judgment | B403: w_is_not_condorcet_winner_ut_abs | E403: 0.49969999999999998 | F403: 0.49969999999999998 | G403: 10000 | H403: 33 | I403: 5 | J403: Spheroid | K403: Stretching | L403: 1 | S403: =F403-E403 -> 0
A404: Majority Judgment | B404: w_missed_condorcet_winner_ut_abs | E404: 0.25409999999999999 | F404: 0.25409999999999999 | G404: 10000 | H404: 33 | I404: 5 | J404: Spheroid | K404: Stretching | L404: 1 | S404: =F404-E404 -> 0
A405: Majority Judgment | B405: w_is_resistant_condorcet_winner | E405: 3.7000000000000002E-3 | F405: 3.7000000000000002E-3 | G405: 10000 | H405: 33 | I405: 5 | J405: Spheroid | K405: Stretching | L405: 1 | S405: =F405-E405 -> 0
A406: Majority Judgment | B406: w_is_not_resistant_condorcet_winner | E406: 0.99629999999999996 | F406: 0.99629999999999996 | G406: 10000 | H406: 33 | I406: 5 | J406: Spheroid | K406: Stretching | L406: 1 | S406: =F406-E406 -> 0
A407: Majority Judgment | B407: w_missed_resistant_condorcet_winner | E407: 0 | F407: 0 | G407: 10000 | H407: 33 | I407: 5 | J407: Spheroid | K407: Stretching | L407: 1 | S407: =F407-E407 -> 0
A408: Majority Judgment | B408: TM | C408: TM_option = exact | D408: 6.8724410000000002 | E408: 0.98450000000000004 | F408: 0.98450000000000004 | G408: 10000 | H408: 33 | I408: 5 | J408: Spheroid | K408: Stretching | L408: 1 | S408: =F408-E408 -> 0
A409: Majority Judgment | B409: UM | C409: CM_option = exact | D409: 1.28356 | E409: 0.98450000000000004 | F409: 0.98450000000000004 | G409: 10000 | H409: 33 | I409: 5 | J409: Spheroid | K409: Stretching | L409: 1 | S409: =F409-E409 -> 0
A410: Majority Judgment | B410: ICM | C410: ICM_option = exact | D410: 0.90506600000000004 | E410: 0.49969999999999998 | F410: 0.49969999999999998 | G410: 10000 | H410: 33 | I410: 5 | J410: Spheroid | K410: Stretching | L410: 1 | S410: =F410-E410 -> 0
A411: Majority Judgment | B411: CM | C411: CM_option = exact | D411: 0.239012 | E411: 0.98450000000000004 | F411: 0.98450000000000004 | G411: 10000 | H411: 33 | I411: 5 | J411: Spheroid | K411: Stretching | L411: 1 | S411: =F411-E411 -> 0
A412: Maximin | B412: w_is_condorcet_admissible | E412: 0.75439999999999996 | F412: 0.75439999999999996 | G412: 10000 | H412: 33 | I412: 5 | J412: Spheroid | K412: Stretching | L412: 1 | S412: =F412-E412 -> 0
A413: Maximin | B413: w_is_not_condorcet_admissible | E413: 0.24560000000000001 | F413: 0.24560000000000001 | G413: 10000 | H413: 33 | I413: 5 | J413: Spheroid | K413: Stretching | L413: 1 | S413: =F413-E413 -> 0
A414: Maximin | B414: w_missed_condorcet_admissible | E414: 0 | F414: 0 | G414: 10000 | H414: 33 | I414: 5 | J414: Spheroid | K414: Stretching | L414: 1 | S414: =F414-E414 -> 0
A415: Maximin | B415: w_is_weak_condorcet_winner | E415: 0.75439999999999996 | F415: 0.75439999999999996 | G415: 10000 | H415: 33 | I415: 5 | J415: Spheroid | K415: Stretching | L415: 1 | S415: =F415-E415 -> 0
A416: Maximin | B416: w_is_not_weak_condorcet_winner | E416: 0.24560000000000001 | F416: 0.24560000000000001 | G416: 10000 | H416: 33 | I416: 5 | J416: Spheroid | K416: Stretching | L416: 1 | S416: =F416-E416 -> 0
A417: Maximin | B417: w_missed_weak_condorcet_winner | E417: 0 | F417: 0 | G417: 10000 | H417: 33 | I417: 5 | J417: Spheroid | K417: Stretching | L417: 1 | S417: =F417-E417 -> 0
A418: Maximin | B418: w_is_condorcet_winner_rk_ctb | E418: 0.75439999999999996 | F418: 0.75439999999999996 | G418: 10000 | H418: 33 | I418: 5 | J418: Spheroid | K418: Stretching | L418: 1 | S418: =F418-E418 -> 0
A419: Maximin | B419: w_is_not_condorcet_winner_rk_ctb | E419: 0.24560000000000001 | F419: 0.24560000000000001 | G419: 10000 | H419: 33 | I419: 5 | J419: Spheroid | K419: Stretching | L419: 1 | S419: =F419-E419 -> 0
A420: Maximin | B420: w_missed_condorcet_winner_rk_ctb | E420: 0 | F420: 0 | G420: 10000 | H420: 33 | I420: 5 | J420: Spheroid | K420: Stretching | L420: 1 | S420: =F420-E420 -> 0
A421: Maximin | B421: w_is_condorcet_winner_rk | E421: 0.75439999999999996 | F421: 0.75439999999999996 | G421: 10000 | H421: 33 | I421: 5 | J421: Spheroid | K421: Stretching | L421: 1 | S421: =F421-E421 -> 0
A422: Maximin | B422: w_is_not_condorcet_winner_rk | E422: 0.24560000000000001 | F422: 0.24560000000000001 | G422: 10000 | H422: 33 | I422: 5 | J422: Spheroid | K422: Stretching | L422: 1 | S422: =F422-E422 -> 0
A423: Maximin | B423: w_missed_condorcet_winner_rk | E423: 0 | F423: 0 | G423: 10000 | H423: 33 | I423: 5 | J423: Spheroid | K423: Stretching | L423: 1 | S423: =F423-E423 -> 0
A424: Maximin | B424: w_is_condorcet_winner_ut_rel_ctb | E424: 0.75439999999999996 | F424: 0.75439999999999996 | G424: 10000 | H424: 33 | I424: 5 | J424: Spheroid | K424: Stretching | L424: 1 | S424: =F424-E424 -> 0
A425: Maximin | B425: w_is_not_condorcet_winner_ut_rel_ctb | E425: 0.24560000000000001 | F425: 0.24560000000000001 | G425: 10000 | H425: 33 | I425: 5 | J425: Spheroid | K425: Stretching | L425: 1 | S425: =F425-E425 -> 0
A426: Maximin | B426: w_missed_condorcet_winner_ut_rel_ctb | E426: 0 | F426: 0 | G426: 10000 | H426: 33 | I426: 5 | J426: Spheroid | K426: Stretching | L426: 1 | S426: =F426-E426 -> 0
A427: Maximin | B427: w_is_condorcet_winner_ut_rel | E427: 0.75439999999999996 | F427: 0.75439999999999996 | G427: 10000 | H427: 33 | I427: 5 | J427: Spheroid | K427: Stretching | L427: 1 | S427: =F427-E427 -> 0
A428: Maximin | B428: w_is_not_condorcet_winner_ut_rel | E428: 0.24560000000000001 | F428: 0.24560000000000001 | G428: 10000 | H428: 33 | I428: 5 | J428: Spheroid | K428: Stretching | L428: 1 | S428: =F428-E428 -> 0
A429: Maximin | B429: w_missed_condorcet_winner_ut_rel | E429: 0 | F429: 0 | G429: 10000 | H429: 33 | I429: 5 | J429: Spheroid | K429: Stretching | L429: 1 | S429: =F429-E429 -> 0
A430: Maximin | B430: w_is_condorcet_winner_ut_abs_ctb | E430: 0.75439999999999996 | F430: 0.75439999999999996 | G430: 10000 | H430: 33 | I430: 5 | J430: Spheroid | K430: Stretching | L430: 1 | S430: =F430-E430 -> 0
A431: Maximin | B431: w_is_not_condorcet_winner_ut_abs_ctb | E431: 0.24560000000000001 | F431: 0.24560000000000001 | G431: 10000 | H431: 33 | I431: 5 | J431: Spheroid | K431: Stretching | L431: 1 | S431: =F431-E431 -> 0
A432: Maximin | B432: w_missed_condorcet_winner_ut_abs_ctb | E432: 0 | F432: 0 | G432: 10000 | H432: 33 | I432: 5 | J432: Spheroid | K432: Stretching | L432: 1 | S432: =F432-E432 -> 0
A433: Maximin | B433: w_is_condorcet_winner_ut_abs | E433: 0.75439999999999996 | F433: 0.75439999999999996 | G433: 10000 | H433: 33 | I433: 5 | J433: Spheroid | K433: Stretching | L433: 1 | S433: =F433-E433 -> 0
A434: Maximin | B434: w_is_not_condorcet_winner_ut_abs | E434: 0.24560000000000001 | F434: 0.24560000000000001 | G434: 10000 | H434: 33 | I434: 5 | J434: Spheroid | K434: Stretching | L434: 1 | S434: =F434-E434 -> 0
A435: Maximin | B435: w_missed_condorcet_winner_ut_abs | E435: 0 | F435: 0 | G435: 10000 | H435: 33 | I435: 5 | J435: Spheroid | K435: Stretching | L435: 1 | S435: =F435-E435 -> 0
A436: Maximin | B436: w_is_resistant_condorcet_winner | E436: 3.7000000000000002E-3 | F436: 3.7000000000000002E-3 | G436: 10000 | H436: 33 | I436: 5 | J436: Spheroid | K436: Stretching | L436: 1 | S436: =F436-E436 -> 0
A437: Maximin | B437: w_is_not_resistant_condorcet_winner | E437: 0.99629999999999996 | F437: 0.99629999999999996 | G437: 10000 | H437: 33 | I437: 5 | J437: Spheroid | K437: Stretching | L437: 1 | S437: =F437-E437 -> 0
A438: Maximin | B438: w_missed_resistant_condorcet_winner | E438: 0 | F438: 0 | G438: 10000 | H438: 33 | I438: 5 | J438: Spheroid | K438: Stretching | L438: 1 | S438: =F438-E438 -> 0
A439: Maximin | B439: TM | C439: TM_option = exact | D439: 19.800733999999999 | E439: 0.91269999999999996 | F439: 0.91269999999999996 | G439: 10000 | H439: 33 | I439: 5 | J439: Spheroid | K439: Stretching | L439: 1 | S439: =F439-E439 -> 0
A440: Maximin | B440: UM | C440: UM_option = exact | D440: 11.920699000000001 | E440: 0.92589999999999995 | F440: 0.92589999999999995 | G440: 10000 | H440: 33 | I440: 5 | J440: Spheroid | K440: Stretching | L440: 1 | S440: =F440-E440 -> 0
A441: Maximin | B441: ICM | C441: ICM_option = exact | D441: 0.85455300000000001 | E441: 0.24560000000000001 | F441: 0.24560000000000001 | G441: 10000 | H441: 33 | I441: 5 | J441: Spheroid | K441: Stretching | L441: 1 | S441: =F441-E441 -> 0
A442: Maximin | B442: CM | C442: CM_option = fast, UM_option = exact, TM_option = exact | D442: 3.9947569999999999 | E442: 0.93079999999999996 | F442: 0.93169999999999997 | G442: 10000 | H442: 33 | I442: 5 | J442: Spheroid | K442: Stretching | L442: 1 | S442: =F442-E442 -> 9.000000000000119E-4
A443: Nanson | B443: w_is_condorcet_admissible | E443: 0.75439999999999996 | F443: 0.75439999999999996 | G443: 10000 | H443: 33 | I443: 5 | J443: Spheroid | K443: Stretching | L443: 1 | S443: =F443-E443 -> 0
A444: Nanson | B444: w_is_not_condorcet_admissible | E444: 0.24560000000000001 | F444: 0.24560000000000001 | G444: 10000 | H444: 33 | I444: 5 | J444: Spheroid | K444: Stretching | L444: 1 | S444: =F444-E444 -> 0
A445: Nanson | B445: w_missed_condorcet_admissible | E445: 0 | F445: 0 | G445: 10000 | H445: 33 | I445: 5 | J445: Spheroid | K445: Stretching | L445: 1 | S445: =F445-E445 -> 0
A446: Nanson | B446: w_is_weak_condorcet_winner | E446: 0.75439999999999996 | F446: 0.75439999999999996 | G446: 10000 | H446: 33 | I446: 5 | J446: Spheroid | K446: Stretching | L446: 1 | S446: =F446-E446 -> 0
A447: Nanson | B447: w_is_not_weak_condorcet_winner | E447: 0.24560000000000001 | F447: 0.24560000000000001 | G447: 10000 | H447: 33 | I447: 5 | J447: Spheroid | K447: Stretching | L447: 1 | S447: =F447-E447 -> 0
A448: Nanson | B448: w_missed_weak_condorcet_winner | E448: 0 | F448: 0 | G448: 10000 | H448: 33 | I448: 5 | J448: Spheroid | K448: Stretching | L448: 1 | S448: =F448-E448 -> 0
A449: Nanson | B449: w_is_condorcet_winner_rk_ctb | E449: 0.75439999999999996 | F449: 0.75439999999999996 | G449: 10000 | H449: 33 | I449: 5 | J449: Spheroid | K449: Stretching | L449: 1 | S449: =F449-E449 -> 0
A450: Nanson | B450: w_is_not_condorcet_winner_rk_ctb | E450: 0.24560000000000001 | F450: 0.24560000000000001 | G450: 10000 | H450: 33 | I450: 5 | J450: Spheroid | K450: Stretching | L450: 1 | S450: =F450-E450 -> 0
A451: Nanson | B451: w_missed_condorcet_winner_rk_ctb | E451: 0 | F451: 0 | G451: 10000 | H451: 33 | I451: 5 | J451: Spheroid | K451: Stretching | L451: 1 | S451: =F451-E451 -> 0
A452: Nanson | B452: w_is_condorcet_winner_rk | E452: 0.75439999999999996 | F452: 0.75439999999999996 | G452: 10000 | H452: 33 | I452: 5 | J452: Spheroid | K452: Stretching | L452: 1 | S452: =F452-E452 -> 0
A453: Nanson | B453: w_is_not_condorcet_winner_rk | E453: 0.24560000000000001 | F453: 0.24560000000000001 | G453: 10000 | H453: 33 | I453: 5 | J453: Spheroid | K453: Stretching | L453: 1 | S453: =F453-E453 -> 0
A454: Nanson | B454: w_missed_condorcet_winner_rk | E454: 0 | F454: 0 | G454: 10000 | H454: 33 | I454: 5 | J454: Spheroid | K454: Stretching | L454: 1 | S454: =F454-E454 -> 0
A455: Nanson | B455: w_is_condorcet_winner_ut_rel_ctb | E455: 0.75439999999999996 | F455: 0.75439999999999996 | G455: 10000 | H455: 33 | I455: 5 | J455: Spheroid | K455: Stretching | L455: 1 | S455: =F455-E455 -> 0
A456: Nanson | B456: w_is_not_condorcet_winner_ut_rel_ctb | E456: 0.24560000000000001 | F456: 0.24560000000000001 | G456: 10000 | H456: 33 | I456: 5 | J456: Spheroid | K456: Stretching | L456: 1 | S456: =F456-E456 -> 0
A457: Nanson | B457: w_missed_condorcet_winner_ut_rel_ctb | E457: 0 | F457: 0 | G457: 10000 | H457: 33 | I457: 5 | J457: Spheroid | K457: Stretching | L457: 1 | S457: =F457-E457 -> 0
A458: Nanson | B458: w_is_condorcet_winner_ut_rel | E458: 0.75439999999999996 | F458: 0.75439999999999996 | G458: 10000 | H458: 33 | I458: 5 | J458: Spheroid | K458: Stretching | L458: 1 | S458: =F458-E458 -> 0
A459: Nanson | B459: w_is_not_condorcet_winner_ut_rel | E459: 0.24560000000000001 | F459: 0.24560000000000001 | G459: 10000 | H459: 33 | I459: 5 | J459: Spheroid | K459: Stretching | L459: 1 | S459: =F459-E459 -> 0
A460: Nanson | B460: w_missed_condorcet_winner_ut_rel | E460: 0 | F460: 0 | G460: 10000 | H460: 33 | I460: 5 | J460: Spheroid | K460: Stretching | L460: 1 | S460: =F460-E460 -> 0
A461: Nanson | B461: w_is_condorcet_winner_ut_abs_ctb | E461: 0.75439999999999996 | F461: 0.75439999999999996 | G461: 10000 | H461: 33 | I461: 5 | J461: Spheroid | K461: Stretching | L461: 1 | S461: =F461-E461 -> 0
A462: Nanson | B462: w_is_not_condorcet_winner_ut_abs_ctb | E462: 0.24560000000000001 | F462: 0.24560000000000001 | G462: 10000 | H462: 33 | I462: 5 | J462: Spheroid | K462: Stretching | L462: 1 | S462: =F462-E462 -> 0
A463: Nanson | B463: w_missed_condorcet_winner_ut_abs_ctb | E463: 0 | F463: 0 | G463: 10000 | H463: 33 | I463: 5 | J463: Spheroid | K463: Stretching | L463: 1 | S463: =F463-E463 -> 0
A464: Nanson | B464: w_is_condorcet_winner_ut_abs | E464: 0.75439999999999996 | F464: 0.75439999999999996 | G464: 10000 | H464: 33 | I464: 5 | J464: Spheroid | K464: Stretching | L464: 1 | S464: =F464-E464 -> 0
A465: Nanson | B465: w_is_not_condorcet_winner_ut_abs | E465: 0.24560000000000001 | F465: 0.24560000000000001 | G465: 10000 | H465: 33 | I465: 5 | J465: Spheroid | K465: Stretching | L465: 1 | S465: =F465-E465 -> 0
A466: Nanson | B466: w_missed_condorcet_winner_ut_abs | E466: 0 | F466: 0 | G466: 10000 | H466: 33 | I466: 5 | J466: Spheroid | K466: Stretching | L466: 1 | S466: =F466-E466 -> 0
A467: Nanson | B467: w_is_resistant_condorcet_winner | E467: 3.7000000000000002E-3 | F467: 3.7000000000000002E-3 | G467: 10000 | H467: 33 | I467: 5 | J467: Spheroid | K467: Stretching | L467: 1 | S467: =F467-E467 -> 0
A468: Nanson | B468: w_is_not_resistant_condorcet_winner | E468: 0.99629999999999996 | F468: 0.99629999999999996 | G468: 10000 | H468: 33 | I468: 5 | J468: Spheroid | K468: Stretching | L468: 1 | S468: =F468-E468 -> 0
A469: Nanson | B469: w_missed_resistant_condorcet_winner | E469: 0 | F469: 0 | G469: 10000 | H469: 33 | I469: 5 | J469: Spheroid | K469: Stretching | L469: 1 | S469: =F469-E469 -> 0
A470: Nanson | B470: TM | C470: TM_option = exact | D470: 15.314396 | E470: 0.95550000000000002 | F470: 0.95550000000000002 | G470: 10000 | H470: 33 | I470: 5 | J470: Spheroid | K470: Stretching | L470: 1 | S470: =F470-E470 -> 0
A471: Nanson | B471: UM | C471: UM_option = exact | D471: 202.45024000000001 | E471: 0.96060000000000001 | F471: 0.96060000000000001 | G471: 10000 | H471: 33 | I471: 5 | J471: Spheroid | K471: Stretching | L471: 1 | S471: =F471-E471 -> 0
A472: Nanson | B472: ICM | C472: ICM_option = exact | D472: 0.89305199999999996 | E472: 0.24560000000000001 | F472: 0.24560000000000001 | G472: 10000 | H472: 33 | I472: 5 | J472: Spheroid | K472: Stretching | L472: 1 | S472: =F472-E472 -> 0
A473: Nanson | B473: CM | C473: CM_option = lazy, UM_option = exact, TM_option = exact | D473: 1.92011 | E473: 0.96060000000000001 | F473: 0.99629999999999996 | G473: 10000 | H473: 33 | I473: 5 | J473: Spheroid | K473: Stretching | L473: 1 | S473: =F473-E473 -> 3.5699999999999954E-2
A474: Plurality | B474: w_is_condorcet_admissible | E474: 0.45429999999999998 | F474: 0.45429999999999998 | G474: 10000 | H474: 33 | I474: 5 | J474: Spheroid | K474: Stretching | L474: 1 | S474: =F474-E474 -> 0
A475: Plurality | B475: w_is_not_condorcet_admissible | E475: 0.54569999999999996 | F475: 0.54569999999999996 | G475: 10000 | H475: 33 | I475: 5 | J475: Spheroid | K475: Stretching | L475: 1 | S475: =F475-E475 -> 0
A476: Plurality | B476: w_missed_condorcet_admissible | E476: 0.30009999999999998 | F476: 0.30009999999999998 | G476: 10000 | H476: 33 | I476: 5 | J476: Spheroid | K476: Stretching | L476: 1 | S476: =F476-E476 -> 0
A477: Plurality | B477: w_is_weak_condorcet_winner | E477: 0.45429999999999998 | F477: 0.45429999999999998 | G477: 10000 | H477: 33 | I477: 5 | J477: Spheroid | K477: Stretching | L477: 1 | S477: =F477-E477 -> 0
A478: Plurality | B478: w_is_not_weak_condorcet_winner | E478: 0.54569999999999996 | F478: 0.54569999999999996 | G478: 10000 | H478: 33 | I478: 5 | J478: Spheroid | K478: Stretching | L478: 1 | S478: =F478-E478 -> 0
A479: Plurality | B479: w_missed_weak_condorcet_winner | E479: 0.30009999999999998 | F479: 0.30009999999999998 | G479: 10000 | H479: 33 | I479: 5 | J479: Spheroid | K479: Stretching | L479: 1 | S479: =F479-E479 -> 0
A480: Plurality | B480: w_is_condorcet_winner_rk_ctb | E480: 0.45429999999999998 | F480: 0.45429999999999998 | G480: 10000 | H480: 33 | I480: 5 | J480: Spheroid | K480: Stretching | L480: 1 | S480: =F480-E480 -> 0
A481: Plurality | B481: w_is_not_condorcet_winner_rk_ctb | E481: 0.54569999999999996 | F481: 0.54569999999999996 | G481: 10000 | H481: 33 | I481: 5 | J481: Spheroid | K481: Stretching | L481: 1 | S481: =F481-E481 -> 0
A482: Plurality | B482: w_missed_condorcet_winner_rk_ctb | E482: 0.30009999999999998 | F482: 0.30009999999999998 | G482: 10000 | H482: 33 | I482: 5 | J482: Spheroid | K482: Stretching | L482: 1 | S482: =F482-E482 -> 0
A483: Plurality | B483: w_is_condorcet_winner_rk | E483: 0.45429999999999998 | F483: 0.45429999999999998 | G483: 10000 | H483: 33 | I483: 5 | J483: Spheroid | K483: Stretching | L483: 1 | S483: =F483-E483 -> 0
A484: Plurality | B484: w_is_not_condorcet_winner_rk | E484: 0.54569999999999996 | F484: 0.54569999999999996 | G484: 10000 | H484: 33 | I484: 5 | J484: Spheroid | K484: Stretching | L484: 1 | S484: =F484-E484 -> 0
A485: Plurality | B485: w_missed_condorcet_winner_rk | E485: 0.30009999999999998 | F485: 0.30009999999999998 | G485: 10000 | H485: 33 | I485: 5 | J485: Spheroid | K485: Stretching | L485: 1 | S485: =F485-E485 -> 0
A486: Plurality | B486: w_is_condorcet_winner_ut_rel_ctb | E486: 0.45429999999999998 | F486: 0.45429999999999998 | G486: 10000 | H486: 33 | I486: 5 | J486: Spheroid | K486: Stretching | L486: 1 | S486: =F486-E486 -> 0
A487: Plurality | B487: w_is_not_condorcet_winner_ut_rel_ctb | E487: 0.54569999999999996 | F487: 0.54569999999999996 | G487: 10000 | H487: 33 | I487: 5 | J487: Spheroid | K487: Stretching | L487: 1 | S487: =F487-E487 -> 0
A488: Plurality | B488: w_missed_condorcet_winner_ut_rel_ctb | E488: 0.30009999999999998 | F488: 0.30009999999999998 | G488: 10000 | H488: 33 | I488: 5 | J488: Spheroid | K488: Stretching | L488: 1 | S488: =F488-E488 -> 0
A489: Plurality | B489: w_is_condorcet_winner_ut_rel | E489: 0.45429999999999998 | F489: 0.45429999999999998 | G489: 10000 | H489: 33 | I489: 5 | J489: Spheroid | K489: Stretching | L489: 1 | S489: =F489-E489 -> 0
A490: Plurality | B490: w_is_not_condorcet_winner_ut_rel | E490: 0.54569999999999996 | F490: 0.54569999999999996 | G490: 10000 | H490: 33 | I490: 5 | J490: Spheroid | K490: Stretching | L490: 1 | S490: =F490-E490 -> 0
A491: Plurality | B491: w_missed_condorcet_winner_ut_rel | E491: 0.30009999999999998 | F491: 0.30009999999999998 | G491: 10000 | H491: 33 | I491: 5 | J491: Spheroid | K491: Stretching | L491: 1 | S491: =F491-E491 -> 0
A492: Plurality | B492: w_is_condorcet_winner_ut_abs_ctb | E492: 0.45429999999999998 | F492: 0.45429999999999998 | G492: 10000 | H492: 33 | I492: 5 | J492: Spheroid | K492: Stretching | L492: 1 | S492: =F492-E492 -> 0
A493: Plurality | B493: w_is_not_condorcet_winner_ut_abs_ctb | E493: 0.54569999999999996 | F493: 0.54569999999999996 | G493: 10000 | H493: 33 | I493: 5 | J493: Spheroid | K493: Stretching | L493: 1 | S493: =F493-E493 -> 0
A494: Plurality | B494: w_missed_condorcet_winner_ut_abs_ctb | E494: 0.30009999999999998 | F494: 0.30009999999999998 | G494: 10000 | H494: 33 | I494: 5 | J494: Spheroid | K494: Stretching | L494: 1 | S494: =F494-E494 -> 0
A495: Plurality | B495: w_is_condorcet_winner_ut_abs | E495: 0.45429999999999998 | F495: 0.45429999999999998 | G495: 10000 | H495: 33 | I495: 5 | J495: Spheroid | K495: Stretching | L495: 1 | S495: =F495-E495 -> 0
A496: Plurality | B496: w_is_not_condorcet_winner_ut_abs | E496: 0.54569999999999996 | F496: 0.54569999999999996 | G496: 10000 | H496: 33 | I496: 5 | J496: Spheroid | K496: Stretching | L496: 1 | S496: =F496-E496 -> 0
A497: Plurality | B497: w_missed_condorcet_winner_ut_abs | E497: 0.30009999999999998 | F497: 0.30009999999999998 | G497: 10000 | H497: 33 | I497: 5 | J497: Spheroid | K497: Stretching | L497: 1 | S497: =F497-E497 -> 0
A498: Plurality | B498: w_is_resistant_condorcet_winner | E498: 3.7000000000000002E-3 | F498: 3.7000000000000002E-3 | G498: 10000 | H498: 33 | I498: 5 | J498: Spheroid | K498: Stretching | L498: 1 | S498: =F498-E498 -> 0
A499: Plurality | B499: w_is_not_resistant_condorcet_winner | E499: 0.99629999999999996 | F499: 0.99629999999999996 | G499: 10000 | H499: 33 | I499: 5 | J499: Spheroid | K499: Stretching | L499: 1 | S499: =F499-E499 -> 0
A500: Plurality | B500: w_missed_resistant_condorcet_winner | E500: 0 | F500: 0 | G500: 10000 | H500: 33 | I500: 5 | J500: Spheroid | K500: Stretching | L500: 1 | S500: =F500-E500 -> 0
A501: Plurality | B501: TM | C501: CM_option = exact | D501: 3.1686960000000002 | E501: 0.98560000000000003 | F501: 0.98560000000000003 | G501: 10000 | H501: 33 | I501: 5 | J501: Spheroid | K501: Stretching | L501: 1 | S501: =F501-E501 -> 0
A502: Plurality | B502: UM | C502: CM_option = exact | D502: 0.263015 | E502: 0.98560000000000003 | F502: 0.98560000000000003 | G502: 10000 | H502: 33 | I502: 5 | J502: Spheroid | K502: Stretching | L502: 1 | S502: =F502-E502 -> 0
A503: Plurality | B503: ICM | C503: ICM_option = exact | D503: 0.925064 | E503: 0.54569999999999996 | F503: 0.54569999999999996 | G503: 10000 | H503: 33 | I503: 5 | J503: Spheroid | K503: Stretching | L503: 1 | S503: =F503-E503 -> 0
A504: Plurality | B504: CM | C504: CM_option = exact | D504: 0.22300800000000001 | E504: 0.98560000000000003 | F504: 0.98560000000000003 | G504: 10000 | H504: 33 | I504: 5 | J504: Spheroid | K504: Stretching | L504: 1 | S504: =F504-E504 -> 0
A505: Range voting with average | B505: w_is_condorcet_admissible | E505: 0.58609999999999995 | F505: 0.58609999999999995 | G505: 10000 | H505: 33 | I505: 5 | J505: Spheroid | K505: Stretching | L505: 1 | S505: =F505-E505 -> 0
A506: Range voting with average | B506: w_is_not_condorcet_admissible | E506: 0.41389999999999999 | F506: 0.41389999999999999 | G506: 10000 | H506: 33 | I506: 5 | J506: Spheroid | K506: Stretching | L506: 1 | S506: =F506-E506 -> 0
A507: Range voting with average | B507: w_missed_condorcet_admissible | E507: 0.16830000000000001 | F507: 0.16830000000000001 | G507: 10000 | H507: 33 | I507: 5 | J507: Spheroid | K507: Stretching | L507: 1 | S507: =F507-E507 -> 0
A508: Range voting with average | B508: w_is_weak_condorcet_winner | E508: 0.58609999999999995 | F508: 0.58609999999999995 | G508: 10000 | H508: 33 | I508: 5 | J508: Spheroid | K508: Stretching | L508: 1 | S508: =F508-E508 -> 0
A509: Range voting with average | B509: w_is_not_weak_condorcet_winner | E509: 0.41389999999999999 | F509: 0.41389999999999999 | G509: 10000 | H509: 33 | I509: 5 | J509: Spheroid | K509: Stretching | L509: 1 | S509: =F509-E509 -> 0
A510: Range voting with average | B510: w_missed_weak_condorcet_winner | E510: 0.16830000000000001 | F510: 0.16830000000000001 | G510: 10000 | H510: 33 | I510: 5 | J510: Spheroid | K510: Stretching | L510: 1 | S510: =F510-E510 -> 0
A511: Range voting with average | B511: w_is_condorcet_winner_rk_ctb | E511: 0.58609999999999995 | F511: 0.58609999999999995 | G511: 10000 | H511: 33 | I511: 5 | J511: Spheroid | K511: Stretching | L511: 1 | S511: =F511-E511 -> 0
A512: Range voting with average | B512: w_is_not_condorcet_winner_rk_ctb | E512: 0.41389999999999999 | F512: 0.41389999999999999 | G512: 10000 | H512: 33 | I512: 5 | J512: Spheroid | K512: Stretching | L512: 1 | S512: =F512-E512 -> 0
A513: Range voting with average | B513: w_missed_condorcet_winner_rk_ctb | E513: 0.16830000000000001 | F513: 0.16830000000000001 | G513: 10000 | H513: 33 | I513: 5 | J513: Spheroid | K513: Stretching | L513: 1 | S513: =F513-E513 -> 0
A514: Range voting with average | B514: w_is_condorcet_winner_rk | E514: 0.58609999999999995 | F514: 0.58609999999999995 | G514: 10000 | H514: 33 | I514: 5 | J514: Spheroid | K514: Stretching | L514: 1 | S514: =F514-E514 -> 0
A515: Range voting with average | B515: w_is_not_condorcet_winner_rk | E515: 0.41389999999999999 | F515: 0.41389999999999999 | G515: 10000 | H515: 33 | I515: 5 | J515: Spheroid | K515: Stretching | L515: 1 | S515: =F515-E515 -> 0
A516: Range voting with average | B516: w_missed_condorcet_winner_rk | E516: 0.16830000000000001 | F516: 0.16830000000000001 | G516: 10000 | H516: 33 | I516: 5 | J516: Spheroid | K516: Stretching | L516: 1 | S516: =F516-E516 -> 0
A517: Range voting with average | B517: w_is_condorcet_winner_ut_rel_ctb | E517: 0.58609999999999995 | F517: 0.58609999999999995 | G517: 10000 | H517: 33 | I517: 5 | J517: Spheroid | K517: Stretching | L517: 1 | S517: =F517-E517 -> 0
A518: Range voting with average | B518: w_is_not_condorcet_winner_ut_rel_ctb | E518: 0.41389999999999999 | F518: 0.41389999999999999 | G518: 10000 | H518: 33 | I518: 5 | J518: Spheroid | K518: Stretching | L518: 1 | S518: =F518-E518 -> 0
A519: Range voting with average | B519: w_missed_condorcet_winner_ut_rel_ctb | E519: 0.16830000000000001 | F519: 0.16830000000000001 | G519: 10000 | H519: 33 | I519: 5 | J519: Spheroid | K519: Stretching | L519: 1 | S519: =F519-E519 -> 0
A520: Range voting with average | B520: w_is_condorcet_winner_ut_rel | E520: 0.58609999999999995 | F520: 0.58609999999999995 | G520: 10000 | H520: 33 | I520: 5 | J520: Spheroid | K520: Stretching | L520: 1 | S520: =F520-E520 -> 0
A521: Range voting with average | B521: w_is_not_condorcet_winner_ut_rel | E521: 0.41389999999999999 | F521: 0.41389999999999999 | G521: 10000 | H521: 33 | I521: 5 | J521: Spheroid | K521: Stretching | L521: 1 | S521: =F521-E521 -> 0
A522: Range voting with average | B522: w_missed_condorcet_winner_ut_rel | E522: 0.16830000000000001 | F522: 0.16830000000000001 | G522: 10000 | H522: 33 | I522: 5 | J522: Spheroid | K522: Stretching | L522: 1 | S522: =F522-E522 -> 0
A523: Range voting with average | B523: w_is_condorcet_winner_ut_abs_ctb | E523: 0.58609999999999995 | F523: 0.58609999999999995 | G523: 10000 | H523: 33 | I523: 5 | J523: Spheroid | K523: Stretching | L523: 1 | S523: =F523-E523 -> 0
A524: Range voting with average | B524: w_is_not_condorcet_winner_ut_abs_ctb | E524: 0.41389999999999999 | F524: 0.41389999999999999 | G524: 10000 | H524: 33 | I524: 5 | J524: Spheroid | K524: Stretching | L524: 1 | S524: =F524-E524 -> 0
A525: Range voting with average | B525: w_missed_condorcet_winner_ut_abs_ctb | E525: 0.16830000000000001 | F525: 0.16830000000000001 | G525: 10000 | H525: 33 | I525: 5 | J525: Spheroid | K525: Stretching | L525: 1 | S525: =F525-E525 -> 0
A526: Range voting with average | B526: w_is_condorcet_winner_ut_abs | E526: 0.58609999999999995 | F526: 0.58609999999999995 | G526: 10000 | H526: 33 | I526: 5 | J526: Spheroid | K526: Stretching | L526: 1 | S526: =F526-E526 -> 0
A527: Range voting with average | B527: w_is_not_condorcet_winner_ut_abs | E527: 0.41389999999999999 | F527: 0.41389999999999999 | G527: 10000 | H527: 33 | I527: 5 | J527: Spheroid | K527: Stretching | L527: 1 | S527: =F527-E527 -> 0
A528: Range voting with average | B528: w_missed_condorcet_winner_ut_abs | E528: 0.16830000000000001 | F528: 0.16830000000000001 | G528: 10000 | H528: 33 | I528: 5 | J528: Spheroid | K528: Stretching | L528: 1 | S528: =F528-E528 -> 0
A529: Range voting with average | B529: w_is_resistant_condorcet_winner | E529: 3.7000000000000002E-3 | F529: 3.7000000000000002E-3 | G529: 10000 | H529: 33 | I529: 5 | J529: Spheroid | K529: Stretching | L529: 1 | S529: =F529-E529 -> 0
A530: Range voting with average | B530: w_is_not_resistant_condorcet_winner | E530: 0.99629999999999996 | F530: 0.99629999999999996 | G530: 10000 | H530: 33 | I530: 5 | J530: Spheroid | K530: Stretching | L530: 1 | S530: =F530-E530 -> 0
A531: Range voting with average | B531: w_missed_resistant_condorcet_winner | E531: 0 | F531: 0 | G531: 10000 | H531: 33 | I531: 5 | J531: Spheroid | K531: Stretching | L531: 1 | S531: =F531-E531 -> 0
A532: Range voting with average | B532: TM | C532: CM_option = exact | D532: 3.1826859999999999 | E532: 0.99680000000000002 | F532: 0.99680000000000002 | G532: 10000 | H532: 33 | I532: 5 | J532: Spheroid | K532: Stretching | L532: 1 | S532: =F532-E532 -> 0
A533: Range voting with average | B533: UM | C533: CM_option = exact | D533: 0.24951000000000001 | E533: 0.99680000000000002 | F533: 0.99680000000000002 | G533: 10000 | H533: 33 | I533: 5 | J533: Spheroid | K533: Stretching | L533: 1 | S533: =F533-E533 -> 0
A534: Range voting with average | B534: ICM | C534: ICM_option = exact | D534: 0.87505500000000003 | E534: 0.41389999999999999 | F534: 0.41389999999999999 | G534: 10000 | H534: 33 | I534: 5 | J534: Spheroid | K534: Stretching | L534: 1 | S534: =F534-E534 -> 0
A535: Range voting with average | B535: CM | C535: CM_option = exact | D535: 0.24551200000000001 | E535: 0.99680000000000002 | F535: 0.99680000000000002 | G535: 10000 | H535: 33 | I535: 5 | J535: Spheroid | K535: Stretching | L535: 1 | S535: =F535-E535 -> 0
A536: Ranked Pairs | B536: w_is_condorcet_admissible | E536: 0.75439999999999996 | F536: 0.75439999999999996 | G536: 10000 | H536: 33 | I536: 5 | J536: Spheroid | K536: Stretching | L536: 1 | S536: =F536-E536 -> 0
A537: Ranked Pairs | B537: w_is_not_condorcet_admissible | E537: 0.24560000000000001 | F537: 0.24560000000000001 | G537: 10000 | H537: 33 | I537: 5 | J537: Spheroid | K537: Stretching | L537: 1 | S537: =F537-E537 -> 0
A538: Ranked Pairs | B538: w_missed_condorcet_admissible | E538: 0 | F538: 0 | G538: 10000 | H538: 33 | I538: 5 | J538: Spheroid | K538: Stretching | L538: 1 | S538: =F538-E538 -> 0
A539: Ranked Pairs | B539: w_is_weak_condorcet_winner | E539: 0.75439999999999996 | F539: 0.75439999999999996 | G539: 10000 | H539: 33 | I539: 5 | J539: Spheroid | K539: Stretching | L539: 1 | S539: =F539-E539 -> 0
A540: Ranked Pairs | B540: w_is_not_weak_condorcet_winner | E540: 0.24560000000000001 | F540: 0.24560000000000001 | G540: 10000 | H540: 33 | I540: 5 | J540: Spheroid | K540: Stretching | L540: 1 | S540: =F540-E540 -> 0
A541: Ranked Pairs | B541: w_missed_weak_condorcet_winner | E541: 0 | F541: 0 | G541: 10000 | H541: 33 | I541: 5 | J541: Spheroid | K541: Stretching | L541: 1 | S541: =F541-E541 -> 0
A542: Ranked Pairs | B542: w_is_condorcet_winner_rk_ctb | E542: 0.75439999999999996 | F542: 0.75439999999999996 | G542: 10000 | H542: 33 | I542: 5 | J542: Spheroid | K542: Stretching | L542: 1 | S542: =F542-E542 -> 0
A543: Ranked Pairs | B543: w_is_not_condorcet_winner_rk_ctb | E543: 0.24560000000000001 | F543: 0.24560000000000001 | G543: 10000 | H543: 33 | I543: 5 | J543: Spheroid | K543: Stretching | L543: 1 | S543: =F543-E543 -> 0
A544: Ranked Pairs | B544: w_missed_condorcet_winner_rk_ctb | E544: 0 | F544: 0 | G544: 10000 | H544: 33 | I544: 5 | J544: Spheroid | K544: Stretching | L544: 1 | S544: =F544-E544 -> 0
A545: Ranked Pairs | B545: w_is_condorcet_winner_rk | E545: 0.75439999999999996 | F545: 0.75439999999999996 | G545: 10000 | H545: 33 | I545: 5 | J545: Spheroid | K545: Stretching | L545: 1 | S545: =F545-E545 -> 0
A546: Ranked Pairs | B546: w_is_not_condorcet_winner_rk | E546: 0.24560000000000001 | F546: 0.24560000000000001 | G546: 10000 | H546: 33 | I546: 5 | J546: Spheroid | K546: Stretching | L546: 1 | S546: =F546-E546 -> 0
A547: Ranked Pairs | B547: w_missed_condorcet_winner_rk | E547: 0 | F547: 0 | G547: 10000 | H547: 33 | I547: 5 | J547: Spheroid | K547: Stretching | L547: 1 | S547: =F547-E547 -> 0
A548: Ranked Pairs | B548: w_is_condorcet_winner_ut_rel_ctb | E548: 0.75439999999999996 | F548: 0.75439999999999996 | G548: 10000 | H548: 33 | I548: 5 | J548: Spheroid | K548: Stretching | L548: 1 | S548: =F548-E548 -> 0
A549: Ranked Pairs | B549: w_is_not_condorcet_winner_ut_rel_ctb | E549: 0.24560000000000001 | F549: 0.24560000000000001 | G549: 10000 | H549: 33 | I549: 5 | J549: Spheroid | K549: Stretching | L549: 1 | S549: =F549-E549 -> 0
A550: Ranked Pairs | B550: w_missed_condorcet_winner_ut_rel_ctb | E550: 0 | F550: 0 | G550: 10000 | H550: 33 | I550: 5 | J550: Spheroid | K550: Stretching | L550: 1 | S550: =F550-E550 -> 0
A551: Ranked Pairs | B551: w_is_condorcet_winner_ut_rel | E551: 0.75439999999999996 | F551: 0.75439999999999996 | G551: 10000 | H551: 33 | I551: 5 | J551: Spheroid | K551: Stretching | L551: 1 | S551: =F551-E551 -> 0
A552: Ranked Pairs | B552: w_is_not_condorcet_winner_ut_rel | E552: 0.24560000000000001 | F552: 0.24560000000000001 | G552: 10000 | H552: 33 | I552: 5 | J552: Spheroid | K552: Stretching | L552: 1 | S552: =F552-E552 -> 0
A553: Ranked Pairs | B553: w_missed_condorcet_winner_ut_rel | E553: 0 | F553: 0 | G553: 10000 | H553: 33 | I553: 5 | J553: Spheroid | K553: Stretching | L553: 1 | S553: =F553-E553 -> 0
A554: Ranked Pairs | B554: w_is_condorcet_winner_ut_abs_ctb | E554: 0.75439999999999996 | F554: 0.75439999999999996 | G554: 10000 | H554: 33 | I554: 5 | J554: Spheroid | K554: Stretching | L554: 1 | S554: =F554-E554 -> 0
A555: Ranked Pairs | B555: w_is_not_condorcet_winner_ut_abs_ctb | E555: 0.24560000000000001 | F555: 0.24560000000000001 | G555: 10000 | H555: 33 | I555: 5 | J555: Spheroid | K555: Stretching | L555: 1 | S555: =F555-E555 -> 0
A556: Ranked Pairs | B556: w_missed_condorcet_winner_ut_abs_ctb | E556: 0 | F556: 0 | G556: 10000 | H556: 33 | I556: 5 | J556: Spheroid | K556: Stretching | L556: 1 | S556: =F556-E556 -> 0
A557: Ranked Pairs | B557: w_is_condorcet_winner_ut_abs | E557: 0.75439999999999996 | F557: 0.75439999999999996 | G557: 10000 | H557: 33 | I557: 5 | J557: Spheroid | K557: Stretching | L557: 1 | S557: =F557-E557 -> 0
A558: Ranked Pairs | B558: w_is_not_condorcet_winner_ut_abs | E558: 0.24560000000000001 | F558: 0.24560000000000001 | G558: 10000 | H558: 33 | I558: 5 | J558: Spheroid | K558: Stretching | L558: 1 | S558: =F558-E558 -> 0
A559: Ranked Pairs | B559: w_missed_condorcet_winner_ut_abs | E559: 0 | F559: 0 | G559: 10000 | H559: 33 | I559: 5 | J559: Spheroid | K559: Stretching | L559: 1 | S559: =F559-E559 -> 0
A560: Ranked Pairs | B560: w_is_resistant_condorcet_winner | E560: 3.7000000000000002E-3 | F560: 3.7000000000000002E-3 | G560: 10000 | H560: 33 | I560: 5 | J560: Spheroid | K560: Stretching | L560: 1 | S560: =F560-E560 -> 0
A561: Ranked Pairs | B561: w_is_not_resistant_condorcet_winner | E561: 0.99629999999999996 | F561: 0.99629999999999996 | G561: 10000 | H561: 33 | I561: 5 | J561: Spheroid | K561: Stretching | L561: 1 | S561: =F561-E561 -> 0
A562: Ranked Pairs | B562: w_missed_resistant_condorcet_winner | E562: 0 | F562: 0 | G562: 10000 | H562: 33 | I562: 5 | J562: Spheroid | K562: Stretching | L562: 1 | S562: =F562-E562 -> 0
A563: Ranked Pairs | B563: TM | C563: TM_option = exact | D563: 22.639845000000001 | E563: 0.9274 | F563: 0.9274 | G563: 10000 | H563: 33 | I563: 5 | J563: Spheroid | K563: Stretching | L563: 1 | S563: =F563-E563 -> 0
A564: Ranked Pairs | B564: UM | C564: UM_option = exact | D564: 485.623152 | E564: 0.93379999999999996 | F564: 0.93379999999999996 | G564: 10000 | H564: 33 | I564: 5 | J564: Spheroid | K564: Stretching | L564: 1 | S564: =F564-E564 -> 0
A565: Ranked Pairs | B565: ICM | C565: ICM_option = exact | D565: 0.87305100000000002 | E565: 0.24560000000000001 | F565: 0.24560000000000001 | G565: 10000 | H565: 33 | I565: 5 | J565: Spheroid | K565: Stretching | L565: 1 | S565: =F565-E565 -> 0
A566: Ranked Pairs | B566: CM | C566: CM_option = lazy, UM_option = exact, TM_option = exact | D566: 2.0861299999999998 | E566: 0.93379999999999996 | F566: 0.99629999999999996 | G566: 10000 | H566: 33 | I566: 5 | J566: Spheroid | K566: Stretching | L566: 1 | S566: =F566-E566 -> 6.25E-2
A567: Schulze | B567: w_is_condorcet_admissible | E567: 0.75439999999999996 | F567: 0.75439999999999996 | G567: 10000 | H567: 33 | I567: 5 | J567: Spheroid | K567: Stretching | L567: 1 | S567: =F567-E567 -> 0
A568: Schulze | B568: w_is_not_condorcet_admissible | E568: 0.24560000000000001 | F568: 0.24560000000000001 | G568: 10000 | H568: 33 | I568: 5 | J568: Spheroid | K568: Stretching | L568: 1 | S568: =F568-E568 -> 0
A569: Schulze | B569: w_missed_condorcet_admissible | E569: 0 | F569: 0 | G569: 10000 | H569: 33 | I569: 5 | J569: Spheroid | K569: Stretching | L569: 1 | S569: =F569-E569 -> 0
A570: Schulze | B570: w_is_weak_condorcet_winner | E570: 0.75439999999999996 | F570: 0.75439999999999996 | G570: 10000 | H570: 33 | I570: 5 | J570: Spheroid | K570: Stretching | L570: 1 | S570: =F570-E570 -> 0
A571: Schulze | B571: w_is_not_weak_condorcet_winner | E571: 0.24560000000000001 | F571: 0.24560000000000001 | G571: 10000 | H571: 33 | I571: 5 | J571: Spheroid | K571: Stretching | L571: 1 | S571: =F571-E571 -> 0
A572: Schulze | B572: w_missed_weak_condorcet_winner | E572: 0 | F572: 0 | G572: 10000 | H572: 33 | I572: 5 | J572: Spheroid | K572: Stretching | L572: 1 | S572: =F572-E572 -> 0
A573: Schulze | B573: w_is_condorcet_winner_rk_ctb | E573: 0.75439999999999996 | F573: 0.75439999999999996 | G573: 10000 | H573: 33 | I573: 5 | J573: Spheroid | K573: Stretching | L573: 1 | S573: =F573-E573 -> 0
A574: Schulze | B574: w_is_not_condorcet_winner_rk_ctb | E574: 0.24560000000000001 | F574: 0.24560000000000001 | G574: 10000 | H574: 33 | I574: 5 | J574: Spheroid | K574: Stretching | L574: 1 | S574: =F574-E574 -> 0
A575: Schulze | B575: w_missed_condorcet_winner_rk_ctb | E575: 0 | F575: 0 | G575: 10000 | H575: 33 | I575: 5 | J575: Spheroid | K575: Stretching | L575: 1 | S575: =F575-E575 -> 0
A576: Schulze | B576: w_is_condorcet_winner_rk | E576: 0.75439999999999996 | F576: 0.75439999999999996 | G576: 10000 | H576: 33 | I576: 5 | J576: Spheroid | K576: Stretching | L576: 1 | S576: =F576-E576 -> 0
A577: Schulze | B577: w_is_not_condorcet_winner_rk | E577: 0.24560000000000001 | F577: 0.24560000000000001 | G577: 10000 | H577: 33 | I577: 5 | J577: Spheroid | K577: Stretching | L577: 1 | S577: =F577-E577 -> 0
A578: Schulze | B578: w_missed_condorcet_winner_rk | E578: 0 | F578: 0 | G578: 10000 | H578: 33 | I578: 5 | J578: Spheroid | K578: Stretching | L578: 1 | S578: =F578-E578 -> 0
A579: Schulze | B579: w_is_condorcet_winner_ut_rel_ctb | E579: 0.75439999999999996 | F579: 0.75439999999999996 | G579: 10000 | H579: 33 | I579: 5 | J579: Spheroid | K579: Stretching | L579: 1 | S579: =F579-E579 -> 0
A580: Schulze | B580: w_is_not_condorcet_winner_ut_rel_ctb | E580: 0.24560000000000001 | F580: 0.24560000000000001 | G580: 10000 | H580: 33 | I580: 5 | J580: Spheroid | K580: Stretching | L580: 1 | S580: =F580-E580 -> 0
A581: Schulze | B581: w_missed_condorcet_winner_ut_rel_ctb | E581: 0 | F581: 0 | G581: 10000 | H581: 33 | I581: 5 | J581: Spheroid | K581: Stretching | L581: 1 | S581: =F581-E581 -> 0
A582: Schulze | B582: w_is_condorcet_winner_ut_rel | E582: 0.75439999999999996 | F582: 0.75439999999999996 | G582: 10000 | H582: 33 | I582: 5 | J582: Spheroid | K582: Stretching | L582: 1 | S582: =F582-E582 -> 0
A583: Schulze | B583: w_is_not_condorcet_winner_ut_rel | E583: 0.24560000000000001 | F583: 0.24560000000000001 | G583: 10000 | H583: 33 | I583: 5 | J583: Spheroid | K583: Stretching | L583: 1 | S583: =F583-E583 -> 0
A584: Schulze | B584: w_missed_condorcet_winner_ut_rel | E584: 0 | F584: 0 | G584: 10000 | H584: 33 | I584: 5 | J584: Spheroid | K584: Stretching | L584: 1 | S584: =F584-E584 -> 0
A585: Schulze | B585: w_is_condorcet_winner_ut_abs_ctb | E585: 0.75439999999999996 | F585: 0.75439999999999996 | G585: 10000 | H585: 33 | I585: 5 | J585: Spheroid | K585: Stretching | L585: 1 | S585: =F585-E585 -> 0
A586: Schulze | B586: w_is_not_condorcet_winner_ut_abs_ctb | E586: 0.24560000000000001 | F586: 0.24560000000000001 | G586: 10000 | H586: 33 | I586: 5 | J586: Spheroid | K586: Stretching | L586: 1 | S586: =F586-E586 -> 0
A587: Schulze | B587: w_missed_condorcet_winner_ut_abs_ctb | E587: 0 | F587: 0 | G587: 10000 | H587: 33 | I587: 5 | J587: Spheroid | K587: Stretching | L587: 1 | S587: =F587-E587 -> 0
A588: Schulze | B588: w_is_condorcet_winner_ut_abs | E588: 0.75439999999999996 | F588: 0.75439999999999996 | G588: 10000 | H588: 33 | I588: 5 | J588: Spheroid | K588: Stretching | L588: 1 | S588: =F588-E588 -> 0
A589: Schulze | B589: w_is_not_condorcet_winner_ut_abs | E589: 0.24560000000000001 | F589: 0.24560000000000001 | G589: 10000 | H589: 33 | I589: 5 | J589: Spheroid | K589: Stretching | L589: 1 | S589: =F589-E589 -> 0
A590: Schulze | B590: w_missed_condorcet_winner_ut_abs | E590: 0 | F590: 0 | G590: 10000 | H590: 33 | I590: 5 | J590: Spheroid | K590: Stretching | L590: 1 | S590: =F590-E590 -> 0
A591: Schulze | B591: w_is_resistant_condorcet_winner | E591: 3.7000000000000002E-3 | F591: 3.7000000000000002E-3 | G591: 10000 | H591: 33 | I591: 5 | J591: Spheroid | K591: Stretching | L591: 1 | S591: =F591-E591 -> 0
A592: Schulze | B592: w_is_not_resistant_condorcet_winner | E592: 0.99629999999999996 | F592: 0.99629999999999996 | G592: 10000 | H592: 33 | I592: 5 | J592: Spheroid | K592: Stretching | L592: 1 | S592: =F592-E592 -> 0
A593: Schulze | B593: w_missed_resistant_condorcet_winner | E593: 0 | F593: 0 | G593: 10000 | H593: 33 | I593: 5 | J593: Spheroid | K593: Stretching | L593: 1 | S593: =F593-E593 -> 0
A594: Schulze | B594: TM | C594: TM_option = exact | D594: 14.076373 | E594: 0.91469999999999996 | F594: 0.91469999999999996 | G594: 10000 | H594: 33 | I594: 5 | J594: Spheroid | K594: Stretching | L594: 1 | S594: =F594-E594 -> 0
A595: Schulze | B595: UM | C595: UM_option = fast | D595: 43.828724999999999 | E595: 0.93059999999999998 | F595: 0.94869999999999999 | G595: 10000 | H595: 33 | I595: 5 | J595: Spheroid | K595: Stretching | L595: 1 | S595: =F595-E595 -> 1.8100000000000005E-2
A596: Schulze | B596: ICM | C596: ICM_option = exact | D596: 0.88754900000000003 | E596: 0.24560000000000001 | F596: 0.24560000000000001 | G596: 10000 | H596: 33 | I596: 5 | J596: Spheroid | K596: Stretching | L596: 1 | S596: =F596-E596 -> 0
A597: Schulze | B597: CM | C597: CM_option = fast, TM_option = exact | D597: 0.30851600000000001 | E597: 0.93059999999999998 | F597: 0.94869999999999999 | G597: 10000 | H597: 33 | I597: 5 | J597: Spheroid | K597: Stretching | L597: 1 | S597: =F597-E597 -> 1.8100000000000005E-2
A598: Two Round | B598: w_is_condorcet_admissible | E598: 0.62849999999999995 | F598: 0.62849999999999995 | G598: 10000 | H598: 33 | I598: 5 | J598: Spheroid | K598: Stretching | L598: 1 | S598: =F598-E598 -> 0
A599: Two Round | B599: w_is_not_condorcet_admissible | E599: 0.3715 | F599: 0.3715 | G599: 10000 | H599: 33 | I599: 5 | J599: Spheroid | K599: Stretching | L599: 1 | S599: =F599-E599 -> 0
A600: Two Round | B600: w_missed_condorcet_admissible | E600: 0.12590000000000001 | F600: 0.12590000000000001 | G600: 10000 | H600: 33 | I600: 5 | J600: Spheroid | K600: Stretching | L600: 1 | S600: =F600-E600 -> 0
A601: Two Round | B601: w_is_weak_condorcet_winner | E601: 0.62849999999999995 | F601: 0.62849999999999995 | G601: 10000 | H601: 33 | I601: 5 | J601: Spheroid | K601: Stretching | L601: 1 | S601: =F601-E601 -> 0
A602: Two Round | B602: w_is_not_weak_condorcet_winner | E602: 0.3715 | F602: 0.3715 | G602: 10000 | H602: 33 | I602: 5 | J602: Spheroid | K602: Stretching | L602: 1 | S602: =F602-E602 -> 0
A603: Two Round | B603: w_missed_weak_condorcet_winner | E603: 0.12590000000000001 | F603: 0.12590000000000001 | G603: 10000 | H603: 33 | I603: 5 | J603: Spheroid | K603: Stretching | L603: 1 | S603: =F603-E603 -> 0
A604: Two Round | B604: w_is_condorcet_winner_rk_ctb | E604: 0.62849999999999995 | F604: 0.62849999999999995 | G604: 10000 | H604: 33 | I604: 5 | J604: Spheroid | K604: Stretching | L604: 1 | S604: =F604-E604 -> 0
A605: Two Round | B605: w_is_not_condorcet_winner_rk_ctb | E605: 0.3715 | F605: 0.3715 | G605: 10000 | H605: 33 | I605: 5 | J605: Spheroid | K605: Stretching | L605: 1 | S605: =F605-E605 -> 0
A606: Two Round | B606: w_missed_condorcet_winner_rk_ctb | E606: 0.12590000000000001 | F606: 0.12590000000000001 | G606: 10000 | H606: 33 | I606: 5 | J606: Spheroid | K606: Stretching | L606: 1 | S606: =F606-E606 -> 0
A607: Two Round | B607: w_is_condorcet_winner_rk | E607: 0.62849999999999995 | F607: 0.62849999999999995 | G607: 10000 | H607: 33 | I607: 5 | J607: Spheroid | K607: Stretching | L607: 1 | S607: =F607-E607 -> 0
A608: Two Round | B608: w_is_not_condorcet_winner_rk | E608: 0.3715 | F608: 0.3715 | G608: 10000 | H608: 33 | I608: 5 | J608: Spheroid | K608: Stretching | L608: 1 | S608: =F608-E608 -> 0
A609: Two Round | B609: w_missed_condorcet_winner_rk | E609: 0.12590000000000001 | F609: 0.12590000000000001 | G609: 10000 | H609: 33 | I609: 5 | J609: Spheroid | K609: Stretching | L609: 1 | S609: =F609-E609 -> 0
A610: Two Round | B610: w_is_condorcet_winner_ut_rel_ctb | E610: 0.62849999999999995 | F610: 0.62849999999999995 | G610: 10000 | H610: 33 | I610: 5 | J610: Spheroid | K610: Stretching | L610: 1 | S610: =F610-E610 -> 0
A611: Two Round | B611: w_is_not_condorcet_winner_ut_rel_ctb | E611: 0.3715 | F611: 0.3715 | G611: 10000 | H611: 33 | I611: 5 | J611: Spheroid | K611: Stretching | L611: 1 | S611: =F611-E611 -> 0
A612: Two Round | B612: w_missed_condorcet_winner_ut_rel_ctb | E612: 0.12590000000000001 | F612: 0.12590000000000001 | G612: 10000 | H612: 33 | I612: 5 | J612: Spheroid | K612: Stretching | L612: 1 | S612: =F612-E612 -> 0
A613: Two Round | B613: w_is_condorcet_winner_ut_rel | E613: 0.62849999999999995 | F613: 0.62849999999999995 | G613: 10000 | H613: 33 | I613: 5 | J613: Spheroid | K613: Stretching | L613: 1 | S613: =F613-E613 -> 0
A614: Two Round | B614: w_is_not_condorcet_winner_ut_rel | E614: 0.3715 | F614: 0.3715 | G614: 10000 | H614: 33 | I614: 5 | J614: Spheroid | K614: Stretching | L614: 1 | S614: =F614-E614 -> 0
A615: Two Round | B615: w_missed_condorcet_winner_ut_rel | E615: 0.12590000000000001 | F615: 0.12590000000000001 | G615: 10000 | H615: 33 | I615: 5 | J615: Spheroid | K615: Stretching | L615: 1 | S615: =F615-E615 -> 0
A616: Two Round | B616: w_is_condorcet_winner_ut_abs_ctb | E616: 0.62849999999999995 | F616: 0.62849999999999995 | G616: 10000 | H616: 33 | I616: 5 | J616: Spheroid | K616: Stretching | L616: 1 | S616: =F616-E616 -> 0
A617: Two Round | B617: w_is_not_condorcet_winner_ut_abs_ctb | E617: 0.3715 | F617: 0.3715 | G617: 10000 | H617: 33 | I617: 5 | J617: Spheroid | K617: Stretching | L617: 1 | S617: =F617-E617 -> 0
A618: Two Round | B618: w_missed_condorcet_winner_ut_abs_ctb | E618: 0.12590000000000001 | F618: 0.12590000000000001 | G618: 10000 | H618: 33 | I618: 5 | J618: Spheroid | K618: Stretching | L618: 1 | S618: =F618-E618 -> 0
A619: Two Round | B619: w_is_condorcet_winner_ut_abs | E619: 0.62849999999999995 | F619: 0.62849999999999995 | G619: 10000 | H619: 33 | I619: 5 | J619: Spheroid | K619: Stretching | L619: 1 | S619: =F619-E619 -> 0
A620: Two Round | B620: w_is_not_condorcet_winner_ut_abs | E620: 0.3715 | F620: 0.3715 | G620: 10000 | H620: 33 | I620: 5 | J620: Spheroid | K620: Stretching | L620: 1 | S620: =F620-E620 -> 0
A621: Two Round | B621: w_missed_condorcet_winner_ut_abs | E621: 0.12590000000000001 | F621: 0.12590000000000001 | G621: 10000 | H621: 33 | I621: 5 | J621: Spheroid | K621: Stretching | L621: 1 | S621: =F621-E621 -> 0
A622: Two Round | B622: w_is_resistant_condorcet_winner | E622: 3.7000000000000002E-3 | F622: 3.7000000000000002E-3 | G622: 10000 | H622: 33 | I622: 5 | J622: Spheroid | K622: Stretching | L622: 1 | S622: =F622-E622 -> 0
A623: Two Round | B623: w_is_not_resistant_condorcet_winner | E623: 0.99629999999999996 | F623: 0.99629999999999996 | G623: 10000 | H623: 33 | I623: 5 | J623: Spheroid | K623: Stretching | L623: 1 | S623: =F623-E623 -> 0
A624: Two Round | B624: w_missed_resistant_condorcet_winner | E624: 0 | F624: 0 | G624: 10000 | H624: 33 | I624: 5 | J624: Spheroid | K624: Stretching | L624: 1 | S624: =F624-E624 -> 0
A625: Two Round | B625: TM | C625: TM_option = exact | D625: 27.988703999999998 | E625: 0.3871 | F625: 0.3871 | G625: 10000 | H625: 33 | I625: 5 | J625: Spheroid | K625: Stretching | L625: 1 | S625: =F625-E625 -> 0
A626: Two Round | B626: UM | C626: UM_option = exact | D626: 8.0225109999999997 | E626: 0.3871 | F626: 0.3871 | G626: 10000 | H626: 33 | I626: 5 | J626: Spheroid | K626: Stretching | L626: 1 | S626: =F626-E626 -> 0
A627: Two Round | B627: ICM | C627: ICM_option = exact | D627: 0.87756000000000001 | E627: 0.3715 | F627: 0.3715 | G627: 10000 | H627: 33 | I627: 5 | J627: Spheroid | K627: Stretching | L627: 1 | S627: =F627-E627 -> 0
A628: Two Round | B628: CM | C628: CM_option = exact | D628: 11.768734 | E628: 0.69189999999999996 | F628: 0.69189999999999996 | G628: 10000 | H628: 33 | I628: 5 | J628: Spheroid | K628: Stretching | L628: 1 | S628: =F628-E628 -> 0
A629: Veto | B629: w_is_condorcet_admissible | E629: 0.37669999999999998 | F629: 0.37669999999999998 | G629: 10000 | H629: 33 | I629: 5 | J629: Spheroid | K629: Stretching | L629: 1 | S629: =F629-E629 -> 0
A630: Veto | B630: w_is_not_condorcet_admissible | E630: 0.62329999999999997 | F630: 0.62329999999999997 | G630: 10000 | H630: 33 | I630: 5 | J630: Spheroid | K630: Stretching | L630: 1 | S630: =F630-E630 -> 0
A631: Veto | B631: w_missed_condorcet_admissible | E631: 0.37769999999999998 | F631: 0.37769999999999998 | G631: 10000 | H631: 33 | I631: 5 | J631: Spheroid | K631: Stretching | L631: 1 | S631: =F631-E631 -> 0
A632: Veto | B632: w_is_weak_condorcet_winner | E632: 0.37669999999999998 | F632: 0.37669999999999998 | G632: 10000 | H632: 33 | I632: 5 | J632: Spheroid | K632: Stretching | L632: 1 | S632: =F632-E632 -> 0
A633: Veto | B633: w_is_not_weak_condorcet_winner | E633: 0.62329999999999997 | F633: 0.62329999999999997 | G633: 10000 | H633: 33 | I633: 5 | J633: Spheroid | K633: Stretching | L633: 1 | S633: =F633-E633 -> 0
A634: Veto | B634: w_missed_weak_condorcet_winner | E634: 0.37769999999999998 | F634: 0.37769999999999998 | G634: 10000 | H634: 33 | I634: 5 | J634: Spheroid | K634: Stretching | L634: 1 | S634: =F634-E634 -> 0
A635: Veto | B635: w_is_condorcet_winner_rk_ctb | E635: 0.37669999999999998 | F635: 0.37669999999999998 | G635: 10000 | H635: 33 | I635: 5 | J635: Spheroid | K635: Stretching | L635: 1 | S635: =F635-E635 -> 0
A636: Veto | B636: w_is_not_condorcet_winner_rk_ctb | E636: 0.62329999999999997 | F636: 0.62329999999999997 | G636: 10000 | H636: 33 | I636: 5 | J636: Spheroid | K636: Stretching | L636: 1 | S636: =F636-E636 -> 0
A637: Veto | B637: w_missed_condorcet_winner_rk_ctb | E637: 0.37769999999999998 | F637: 0.37769999999999998 | G637: 10000 | H637: 33 | I637: 5 | J637: Spheroid | K637: Stretching | L637: 1 | S637: =F637-E637 -> 0
A638: Veto | B638: w_is_condorcet_winner_rk | E638: 0.37669999999999998 | F638: 0.37669999999999998 | G638: 10000 | H638: 33 | I638: 5 | J638: Spheroid | K638: Stretching | L638: 1 | S638: =F638-E638 -> 0
A639: Veto | B639: w_is_not_condorcet_winner_rk | E639: 0.62329999999999997 | F639: 0.62329999999999997 | G639: 10000 | H639: 33 | I639: 5 | J639: Spheroid | K639: Stretching | L639: 1 | S639: =F639-E639 -> 0
A640: Veto | B640: w_missed_condorcet_winner_rk | E640: 0.37769999999999998 | F640: 0.37769999999999998 | G640: 10000 | H640: 33 | I640: 5 | J640: Spheroid | K640: Stretching | L640: 1 | S640: =F640-E640 -> 0
A641: Veto | B641: w_is_condorcet_winner_ut_rel_ctb | E641: 0.37669999999999998 | F641: 0.37669999999999998 | G641: 10000 | H641: 33 | I641: 5 | J641: Spheroid | K641: Stretching | L641: 1 | S641: =F641-E641 -> 0
A642: Veto | B642: w_is_not_condorcet_winner_ut_rel_ctb | E642: 0.62329999999999997 | F642: 0.62329999999999997 | G642: 10000 | H642: 33 | I642: 5 | J642: Spheroid | K642: Stretching | L642: 1 | S642: =F642-E642 -> 0
A643: Veto | B643: w_missed_condorcet_winner_ut_rel_ctb | E643: 0.37769999999999998 | F643: 0.37769999999999998 | G643: 10000 | H643: 33 | I643: 5 | J643: Spheroid | K643: Stretching | L643: 1 | S643: =F643-E643 -> 0
A644: Veto | B644: w_is_condorcet_winner_ut_rel | E644: 0.37669999999999998 | F644: 0.37669999999999998 | G644: 10000 | H644: 33 | I644: 5 | J644: Spheroid | K644: Stretching | L644: 1 | S644: =F644-E644 -> 0
A645: Veto | B645: w_is_not_condorcet_winner_ut_rel | E645: 0.62329999999999997 | F645: 0.62329999999999997 | G645: 10000 | H645: 33 | I645: 5 | J645: Spheroid | K645: Stretching | L645: 1 | S645: =F645-E645 -> 0
A646: Veto | B646: w_missed_condorcet_winner_ut_rel | E646: 0.37769999999999998 | F646: 0.37769999999999998 | G646: 10000 | H646: 33 | I646: 5 | J646: Spheroid | K646: Stretching | L646: 1 | S646: =F646-E646 -> 0
A647: Veto | B647: w_is_condorcet_winner_ut_abs_ctb | E647: 0.37669999999999998 | F647: 0.37669999999999998 | G647: 10000 | H647: 33 | I647: 5 | J647: Spheroid | K647: Stretching | L647: 1 | S647: =F647-E647 -> 0
A648: Veto | B648: w_is_not_condorcet_winner_ut_abs_ctb | E648: 0.62329999999999997 | F648: 0.62329999999999997 | G648: 10000 | H648: 33 | I648: 5 | J648: Spheroid | K648: Stretching | L648: 1 | S648: =F648-E648 -> 0
A649: Veto | B649: w_missed_condorcet_winner_ut_abs_ctb | E649: 0.37769999999999998 | F649: 0.37769999999999998 | G649: 10000 | H649: 33 | I649: 5 | J649: Spheroid | K649: Stretching | L649: 1 | S649: =F649-E649 -> 0
A650: Veto | B650: w_is_condorcet_winner_ut_abs | E650: 0.37669999999999998 | F650: 0.37669999999999998 | G650: 10000 | H650: 33 | I650: 5 | J650: Spheroid | K650: Stretching | L650: 1 | S650: =F650-E650 -> 0
A651: Veto | B651: w_is_not_condorcet_winner_ut_abs | E651: 0.62329999999999997 | F651: 0.62329999999999997 | G651: 10000 | H651: 33 | I651: 5 | J651: Spheroid | K651: Stretching | L651: 1 | S651: =F651-E651 -> 0
A652: Veto | B652: w_missed_condorcet_winner_ut_abs | E652: 0.37769999999999998 | F652: 0.37769999999999998 | G652: 10000 | H652: 33 | I652: 5 | J652: Spheroid | K652: Stretching | L652: 1 | S652: =F652-E652 -> 0
A653: Veto | B653: w_is_resistant_condorcet_winner | E653: 2.3E-3 | F653: 2.3E-3 | G653: 10000 | H653: 33 | I653: 5 | J653: Spheroid | K653: Stretching | L653: 1 | S653: =F653-E653 -> 0
A654: Veto | B654: w_is_not_resistant_condorcet_winner | E654: 0.99770000000000003 | F654: 0.99770000000000003 | G654: 10000 | H654: 33 | I654: 5 | J654: Spheroid | K654: Stretching | L654: 1 | S654: =F654-E654 -> 0
A655: Veto | B655: w_missed_resistant_condorcet_winner | E655: 1.4E-3 | F655: 1.4E-3 | G655: 10000 | H655: 33 | I655: 5 | J655: Spheroid | K655: Stretching | L655: 1 | S655: =F655-E655 -> 0
A656: Veto | B656: TM | C656: TM_option = exact | D656: 6.5989199999999997 | E656: 3.44E-2 | F656: 3.44E-2 | G656: 10000 | H656: 33 | I656: 5 | J656: Spheroid | K656: Stretching | L656: 1 | S656: =F656-E656 -> 0
A657: Veto | B657: UM | C657: TM_option = exact | D657: 0.23150899999999999 | E657: 3.44E-2 | F657: 3.44E-2 | G657: 10000 | H657: 33 | I657: 5 | J657: Spheroid | K657: Stretching | L657: 1 | S657: =F657-E657 -> 0
A658: Veto | B658: ICM | C658: ICM_option = exact | D658: 5.8683019999999999 | E658: 0 | F658: 0 | G658: 10000 | H658: 33 | I658: 5 | J658: Spheroid | K658: Stretching | L658: 1 | S658: =F658-E658 -> 0
A659: Veto | B659: CM | C659: CM_option = exact | D659: 4.3072629999999998 | E659: 0.90790000000000004 | F659: 0.90790000000000004 | G659: 10000 | H659: 33 | I659: 5 | J659: Spheroid | K659: Stretching | L659: 1 | S659: =F659-E659 -> 0
A660: ICRV | B660: w_is_condorcet_admissible | E660: 0.75439999999999996 | F660: 0.75439999999999996 | G660: 10000 | H660: 33 | I660: 5 | J660: Spheroid | K660: Stretching | L660: 1 | S660: =F660-E660 -> 0
A661: ICRV | B661: w_is_not_condorcet_admissible | E661: 0.24560000000000001 | F661: 0.24560000000000001 | G661: 10000 | H661: 33 | I661: 5 | J661: Spheroid | K661: Stretching | L661: 1 | S661: =F661-E661 -> 0
A662: ICRV | B662: w_missed_condorcet_admissible | E662: 0 | F662: 0 | G662: 10000 | H662: 33 | I662: 5 | J662: Spheroid | K662: Stretching | L662: 1 | S662: =F662-E662 -> 0
A663: ICRV | B663: w_is_weak_condorcet_winner | E663: 0.75439999999999996 | F663: 0.75439999999999996 | G663: 10000 | H663: 33 | I663: 5 | J663: Spheroid | K663: Stretching | L663: 1 | S663: =F663-E663 -> 0
A664: ICRV | B664: w_is_not_weak_condorcet_winner | E664: 0.24560000000000001 | F664: 0.24560000000000001 | G664: 10000 | H664: 33 | I664: 5 | J664: Spheroid | K664: Stretching | L664: 1 | S664: =F664-E664 -> 0
A665: ICRV | B665: w_missed_weak_condorcet_winner | E665: 0 | F665: 0 | G665: 10000 | H665: 33 | I665: 5 | J665: Spheroid | K665: Stretching | L665: 1 | S665: =F665-E665 -> 0
A666: ICRV | B666: w_is_condorcet_winner_rk_ctb | E666: 0.75439999999999996 | F666: 0.75439999999999996 | G666: 10000 | H666: 33 | I666: 5 | J666: Spheroid | K666: Stretching | L666: 1 | S666: =F666-E666 -> 0
A667: ICRV | B667: w_is_not_condorcet_winner_rk_ctb | E667: 0.24560000000000001 | F667: 0.24560000000000001 | G667: 10000 | H667: 33 | I667: 5 | J667: Spheroid | K667: Stretching | L667: 1 | S667: =F667-E667 -> 0
A668: ICRV | B668: w_missed_condorcet_winner_rk_ctb | E668: 0 | F668: 0 | G668: 10000 | H668: 33 | I668: 5 | J668: Spheroid | K668: Stretching | L668: 1 | S668: =F668-E668 -> 0
A669: ICRV | B669: w_is_condorcet_winner_rk | E669: 0.75439999999999996 | F669: 0.75439999999999996 | G669: 10000 | H669: 33 | I669: 5 | J669: Spheroid | K669: Stretching | L669: 1 | S669: =F669-E669 -> 0
A670: ICRV | B670: w_is_not_condorcet_winner_rk | E670: 0.24560000000000001 | F670: 0.24560000000000001 | G670: 10000 | H670: 33 | I670: 5 | J670: Spheroid | K670: Stretching | L670: 1 | S670: =F670-E670 -> 0
A671: ICRV | B671: w_missed_condorcet_winner_rk | E671: 0 | F671: 0 | G671: 10000 | H671: 33 | I671: 5 | J671: Spheroid | K671: Stretching | L671: 1 | S671: =F671-E671 -> 0
A672: ICRV | B672: w_is_condorcet_winner_ut_rel_ctb | E672: 0.75439999999999996 | F672: 0.75439999999999996 | G672: 10000 | H672: 33 | I672: 5 | J672: Spheroid | K672: Stretching | L672: 1 | S672: =F672-E672 -> 0
A673: ICRV | B673: w_is_not_condorcet_winner_ut_rel_ctb | E673: 0.24560000000000001 | F673: 0.24560000000000001 | G673: 10000 | H673: 33 | I673: 5 | J673: Spheroid | K673: Stretching | L673: 1 | S673: =F673-E673 -> 0
A674: ICRV | B674: w_missed_condorcet_winner_ut_rel_ctb | E674: 0 | F674: 0 | G674: 10000 | H674: 33 | I674: 5 | J674: Spheroid | K674: Stretching | L674: 1 | S674: =F674-E674 -> 0
A675: ICRV | B675: w_is_condorcet_winner_ut_rel | E675: 0.75439999999999996 | F675: 0.75439999999999996 | G675: 10000 | H675: 33 | I675: 5 | J675: Spheroid | K675: Stretching | L675: 1 | S675: =F675-E675 -> 0
A676: ICRV | B676: w_is_not_condorcet_winner_ut_rel | E676: 0.24560000000000001 | F676: 0.24560000000000001 | G676: 10000 | H676: 33 | I676: 5 | J676: Spheroid | K676: Stretching | L676: 1 | S676: =F676-E676 -> 0
A677: ICRV | B677: w_missed_condorcet_winner_ut_rel | E677: 0 | F677: 0 | G677: 10000 | H677: 33 | I677: 5 | J677: Spheroid | K677: Stretching | L677: 1 | S677: =F677-E677 -> 0
A678: ICRV | B678: w_is_condorcet_winner_ut_abs_ctb | E678: 0.75439999999999996 | F678: 0.75439999999999996 | G678: 10000 | H678: 33 | I678: 5 | J678: Spheroid | K678: Stretching | L678: 1 | S678: =F678-E678 -> 0
A679: ICRV | B679: w_is_not_condorcet_winner_ut_abs_ctb | E679: 0.24560000000000001 | F679: 0.24560000000000001 | G679: 10000 | H679: 33 | I679: 5 | J679: Spheroid | K679: Stretching | L679: 1 | S679: =F679-E679 -> 0
A680: ICRV | B680: w_missed_condorcet_winner_ut_abs_ctb | E680: 0 | F680: 0 | G680: 10000 | H680: 33 | I680: 5 | J680: Spheroid | K680: Stretching | L680: 1 | S680: =F680-E680 -> 0
A681: ICRV | B681: w_is_condorcet_winner_ut_abs | E681: 0.75439999999999996 | F681: 0.75439999999999996 | G681: 10000 | H681: 33 | I681: 5 | J681: Spheroid | K681: Stretching | L681: 1 | S681: =F681-E681 -> 0
A682: ICRV | B682: w_is_not_condorcet_winner_ut_abs | E682: 0.24560000000000001 | F682: 0.24560000000000001 | G682: 10000 | H682: 33 | I682: 5 | J682: Spheroid | K682: Stretching | L682: 1 | S682: =F682-E682 -> 0
A683: ICRV | B683: w_missed_condorcet_winner_ut_abs | E683: 0 | F683: 0 | G683: 10000 | H683: 33 | I683: 5 | J683: Spheroid | K683: Stretching | L683: 1 | S683: =F683-E683 -> 0
A684: ICRV | B684: w_is_resistant_condorcet_winner | E684: 3.7000000000000002E-3 | F684: 3.7000000000000002E-3 | G684: 10000 | H684: 33 | I684: 5 | J684: Spheroid | K684: Stretching | L684: 1 | S684: =F684-E684 -> 0
A685: ICRV | B685: w_is_not_resistant_condorcet_winner | E685: 0.99629999999999996 | F685: 0.99629999999999996 | G685: 10000 | H685: 33 | I685: 5 | J685: Spheroid | K685: Stretching | L685: 1 | S685: =F685-E685 -> 0
A686: ICRV | B686: w_missed_resistant_condorcet_winner | E686: 0 | F686: 0 | G686: 10000 | H686: 33 | I686: 5 | J686: Spheroid | K686: Stretching | L686: 1 | S686: =F686-E686 -> 0
A687: ICRV | B687: TM | C687: TM_option = exact | D687: 49.941473000000002 | E687: 0.27239999999999998 | F687: 0.27239999999999998 | G687: 10000 | H687: 33 | I687: 5 | J687: Spheroid | K687: Stretching | L687: 1 | S687: =F687-E687 -> 0
A688: ICRV | B688: UM | C688: UM_option = exact | D688: 2982.7663819999998 | E688: 0.27289999999999998 | F688: 0.27289999999999998 | G688: 10000 | H688: 33 | I688: 5 | J688: Spheroid | K688: Stretching | L688: 1 | S688: =F688-E688 -> 0
A689: ICRV | B689: ICM | C689: ICM_option = exact | D689: 0.96757800000000005 | E689: 0.24560000000000001 | F689: 0.24560000000000001 | G689: 10000 | H689: 33 | I689: 5 | J689: Spheroid | K689: Stretching | L689: 1 | S689: =F689-E689 -> 0
A690: ICRV | B690: CM | C690: CM_option = lazy, UM_option = exact, TM_option = exact | D690: 9.4910890000000006 | E690: 0.27289999999999998 | F690: 0.99629999999999996 | G690: 10000 | H690: 33 | I690: 5 | J690: Spheroid | K690: Stretching | L690: 1 | S690: =F690-E690 -> 0.72340000000000004
A691: Exhaustive Ballot | B691: w_is_condorcet_admissible | E691: 0.67620000000000002 | F691: 0.67620000000000002 | G691: 10000 | H691: 33 | I691: 5 | J691: Spheroid | K691: Stretching | L691: 1 | S691: =F691-E691 -> 0
A692: Exhaustive Ballot | B692: w_is_not_condorcet_admissible | E692: 0.32379999999999998 | F692: 0.32379999999999998 | G692: 10000 | H692: 33 | I692: 5 | J692: Spheroid | K692: Stretching | L692: 1 | S692: =F692-E692 -> 0
A693: Exhaustive Ballot | B693: w_missed_condorcet_admissible | E693: 7.8200000000000006E-2 | F693: 7.8200000000000006E-2 | G693: 10000 | H693: 33 | I693: 5 | J693: Spheroid | K693: Stretching | L693: 1 | S693: =F693-E693 -> 0
A694: Exhaustive Ballot | B694: w_is_weak_condorcet_winner | E694: 0.67620000000000002 | F694: 0.67620000000000002 | G694: 10000 | H694: 33 | I694: 5 | J694: Spheroid | K694: Stretching | L694: 1 | S694: =F694-E694 -> 0
A695: Exhaustive Ballot | B695: w_is_not_weak_condorcet_winner | E695: 0.32379999999999998 | F695: 0.32379999999999998 | G695: 10000 | H695: 33 | I695: 5 | J695: Spheroid | K695: Stretching | L695: 1 | S695: =F695-E695 -> 0
A696: Exhaustive Ballot | B696: w_missed_weak_condorcet_winner | E696: 7.8200000000000006E-2 | F696: 7.8200000000000006E-2 | G696: 10000 | H696: 33 | I696: 5 | J696: Spheroid | K696: Stretching | L696: 1 | S696: =F696-E696 -> 0
A697: Exhaustive Ballot | B697: w_is_condorcet_winner_rk_ctb | E697: 0.67620000000000002 | F697: 0.67620000000000002 | G697: 10000 | H697: 33 | I697: 5 | J697: Spheroid | K697: Stretching | L697: 1 | S697: =F697-E697 -> 0
A698: Exhaustive Ballot | B698: w_is_not_condorcet_winner_rk_ctb | E698: 0.32379999999999998 | F698: 0.32379999999999998 | G698: 10000 | H698: 33 | I698: 5 | J698: Spheroid | K698: Stretching | L698: 1 | S698: =F698-E698 -> 0
A699: Exhaustive Ballot | B699: w_missed_condorcet_winner_rk_ctb | E699: 7.8200000000000006E-2 | F699: 7.8200000000000006E-2 | G699: 10000 | H699: 33 | I699: 5 | J699: Spheroid | K699: Stretching | L699: 1 | S699: =F699-E699 -> 0
A700: Exhaustive Ballot | B700: w_is_condorcet_winner_rk | E700: 0.67620000000000002 | F700: 0.67620000000000002 | G700: 10000 | H700: 33 | I700: 5 | J700: Spheroid | K700: Stretching | L700: 1 | S700: =F700-E700 -> 0
A701: Exhaustive Ballot | B701: w_is_not_condorcet_winner_rk | E701: 0.32379999999999998 | F701: 0.32379999999999998 | G701: 10000 | H701: 33 | I701: 5 | J701: Spheroid | K701: Stretching | L701: 1 | S701: =F701-E701 -> 0
A702: Exhaustive Ballot | B702: w_missed_condorcet_winner_rk | E702: 7.8200000000000006E-2 | F702: 7.8200000000000006E-2 | G702: 10000 | H702: 33 | I702: 5 | J702: Spheroid | K702: Stretching | L702: 1 | S702: =F702-E702 -> 0
A703: Exhaustive Ballot | B703: w_is_condorcet_winner_ut_rel_ctb | E703: 0.67620000000000002 | F703: 0.67620000000000002 | G703: 10000 | H703: 33 | I703: 5 | J703: Spheroid | K703: Stretching | L703: 1 | S703: =F703-E703 -> 0
A704: Exhaustive Ballot | B704: w_is_not_condorcet_winner_ut_rel_ctb | E704: 0.32379999999999998 | F704: 0.32379999999999998 | G704: 10000 | H704: 33 | I704: 5 | J704: Spheroid | K704: Stretching | L704: 1 | S704: =F704-E704 -> 0
A705: Exhaustive Ballot | B705: w_missed_condorcet_winner_ut_rel_ctb | E705: 7.8200000000000006E-2 | F705: 7.8200000000000006E-2 | G705: 10000 | H705: 33 | I705: 5 | J705: Spheroid | K705: Stretching | L705: 1 | S705: =F705-E705 -> 0
A706: Exhaustive Ballot | B706: w_is_condorcet_winner_ut_rel | E706: 0.67620000000000002 | F706: 0.67620000000000002 | G706: 10000 | H706: 33 | I706: 5 | J706: Spheroid | K706: Stretching | L706: 1 | S706: =F706-E706 -> 0
A707: Exhaustive Ballot | B707: w_is_not_condorcet_winner_ut_rel | E707: 0.32379999999999998 | F707: 0.32379999999999998 | G707: 10000 | H707: 33 | I707: 5 | J707: Spheroid | K707: Stretching | L707: 1 | S707: =F707-E707 -> 0
A708: Exhaustive Ballot | B708: w_missed_condorcet_winner_ut_rel | E708: 7.8200000000000006E-2 | F708: 7.8200000000000006E-2 | G708: 10000 | H708: 33 | I708: 5 | J708: Spheroid | K708: Stretching | L708: 1 | S708: =F708-E708 -> 0
A709: Exhaustive Ballot | B709: w_is_condorcet_winner_ut_abs_ctb | E709: 0.67620000000000002 | F709: 0.67620000000000002 | G709: 10000 | H709: 33 | I709: 5 | J709: Spheroid | K709: Stretching | L709: 1 | S709: =F709-E709 -> 0
A710: Exhaustive Ballot | B710: w_is_not_condorcet_winner_ut_abs_ctb | E710: 0.32379999999999998 | F710: 0.32379999999999998 | G710: 10000 | H710: 33 | I710: 5 | J710: Spheroid | K710: Stretching | L710: 1 | S710: =F710-E710 -> 0
A711: Exhaustive Ballot | B711: w_missed_condorcet_winner_ut_abs_ctb | E711: 7.8200000000000006E-2 | F711: 7.8200000000000006E-2 | G711: 10000 | H711: 33 | I711: 5 | J711: Spheroid | K711: Stretching | L711: 1 | S711: =F711-E711 -> 0
A712: Exhaustive Ballot | B712: w_is_condorcet_winner_ut_abs | E712: 0.67620000000000002 | F712: 0.67620000000000002 | G712: 10000 | H712: 33 | I712: 5 | J712: Spheroid | K712: Stretching | L712: 1 | S712: =F712-E712 -> 0
A713: Exhaustive Ballot | B713: w_is_not_condorcet_winner_ut_abs | E713: 0.32379999999999998 | F713: 0.32379999999999998 | G713: 10000 | H713: 33 | I713: 5 | J713: Spheroid | K713: Stretching | L713: 1 | S713: =F713-E713 -> 0
A714: Exhaustive Ballot | B714: w_missed_condorcet_winner_ut_abs | E714: 7.8200000000000006E-2 | F714: 7.8200000000000006E-2 | G714: 10000 | H714: 33 | I714: 5 | J714: Spheroid | K714: Stretching | L714: 1 | S714: =F714-E714 -> 0
A715: Exhaustive Ballot | B715: w_is_resistant_condorcet_winner | E715: 3.7000000000000002E-3 | F715: 3.7000000000000002E-3 | G715: 10000 | H715: 33 | I715: 5 | J715: Spheroid | K715: Stretching | L715: 1 | S715: =F715-E715 -> 0
A716: Exhaustive Ballot | B716: w_is_not_resistant_condorcet_winner | E716: 0.99629999999999996 | F716: 0.99629999999999996 | G716: 10000 | H716: 33 | I716: 5 | J716: Spheroid | K716: Stretching | L716: 1 | S716: =F716-E716 -> 0
A717: Exhaustive Ballot | B717: w_missed_resistant_condorcet_winner | E717: 0 | F717: 0 | G717: 10000 | H717: 33 | I717: 5 | J717: Spheroid | K717: Stretching | L717: 1 | S717: =F717-E717 -> 0
A718: Exhaustive Ballot | B718: TM | C718: TM_option = exact | D718: 24.363489999999999 | E718: 0.33050000000000002 | F718: 0.33050000000000002 | G718: 10000 | H718: 33 | I718: 5 | J718: Spheroid | K718: Stretching | L718: 1 | S718: =F718-E718 -> 0
A719: Exhaustive Ballot | B719: UM | C719: UM_option = exact | D719: 55.090912000000003 | E719: 0.33050000000000002 | F719: 0.33050000000000002 | G719: 10000 | H719: 33 | I719: 5 | J719: Spheroid | K719: Stretching | L719: 1 | S719: =F719-E719 -> 0
A720: Exhaustive Ballot | B720: ICM | C720: ICM_option = exact | D720: 1.061059 | E720: 0.32379999999999998 | F720: 0.32379999999999998 | G720: 10000 | H720: 33 | I720: 5 | J720: Spheroid | K720: Stretching | L720: 1 | S720: =F720-E720 -> 0
A721: Exhaustive Ballot | B721: CM | C721: CM_option = exact | D721: 85.013594999999995 | E721: 0.44030000000000002 | F721: 0.44030000000000002 | G721: 10000 | H721: 33 | I721: 5 | J721: Spheroid | K721: Stretching | L721: 1 | S721: =F721-E721 -> 0
A722: IRV | B722: w_is_condorcet_admissible | E722: 0.67620000000000002 | F722: 0.67620000000000002 | G722: 10000 | H722: 33 | I722: 5 | J722: Spheroid | K722: Stretching | L722: 1 | S722: =F722-E722 -> 0
A723: IRV | B723: w_is_not_condorcet_admissible | E723: 0.32379999999999998 | F723: 0.32379999999999998 | G723: 10000 | H723: 33 | I723: 5 | J723: Spheroid | K723: Stretching | L723: 1 | S723: =F723-E723 -> 0
A724: IRV | B724: w_missed_condorcet_admissible | E724: 7.8200000000000006E-2 | F724: 7.8200000000000006E-2 | G724: 10000 | H724: 33 | I724: 5 | J724: Spheroid | K724: Stretching | L724: 1 | S724: =F724-E724 -> 0
A725: IRV | B725: w_is_weak_condorcet_winner | E725: 0.67620000000000002 | F725: 0.67620000000000002 | G725: 10000 | H725: 33 | I725: 5 | J725: Spheroid | K725: Stretching | L725: 1 | S725: =F725-E725 -> 0
A726: IRV | B726: w_is_not_weak_condorcet_winner | E726: 0.32379999999999998 | F726: 0.32379999999999998 | G726: 10000 | H726: 33 | I726: 5 | J726: Spheroid | K726: Stretching | L726: 1 | S726: =F726-E726 -> 0
A727: IRV | B727: w_missed_weak_condorcet_winner | E727: 7.8200000000000006E-2 | F727: 7.8200000000000006E-2 | G727: 10000 | H727: 33 | I727: 5 | J727: Spheroid | K727: Stretching | L727: 1 | S727: =F727-E727 -> 0
A728: IRV | B728: w_is_condorcet_winner_rk_ctb | E728: 0.67620000000000002 | F728: 0.67620000000000002 | G728: 10000 | H728: 33 | I728: 5 | J728: Spheroid | K728: Stretching | L728: 1 | S728: =F728-E728 -> 0
A729: IRV | B729: w_is_not_condorcet_winner_rk_ctb | E729: 0.32379999999999998 | F729: 0.32379999999999998 | G729: 10000 | H729: 33 | I729: 5 | J729: Spheroid | K729: Stretching | L729: 1 | S729: =F729-E729 -> 0
A730: IRV | B730: w_missed_condorcet_winner_rk_ctb | E730: 7.8200000000000006E-2 | F730: 7.8200000000000006E-2 | G730: 10000 | H730: 33 | I730: 5 | J730: Spheroid | K730: Stretching | L730: 1 | S730: =F730-E730 -> 0
A731: IRV | B731: w_is_condorcet_winner_rk | E731: 0.67620000000000002 | F731: 0.67620000000000002 | G731: 10000 | H731: 33 | I731: 5 | J731: Spheroid | K731: Stretching | L731: 1 | S731: =F731-E731 -> 0
A732: IRV | B732: w_is_not_condorcet_winner_rk | E732: 0.32379999999999998 | F732: 0.32379999999999998 | G732: 10000 | H732: 33 | I732: 5 | J732: Spheroid | K732: Stretching | L732: 1 | S732: =F732-E732 -> 0
A733: IRV | B733: w_missed_condorcet_winner_rk | E733: 7.8200000000000006E-2 | F733: 7.8200000000000006E-2 | G733: 10000 | H733: 33 | I733: 5 | J733: Spheroid | K733: Stretching | L733: 1 | S733: =F733-E733 -> 0
A734: IRV | B734: w_is_condorcet_winner_ut_rel_ctb | E734: 0.67620000000000002 | F734: 0.67620000000000002 | G734: 10000 | H734: 33 | I734: 5 | J734: Spheroid | K734: Stretching | L734: 1 | S734: =F734-E734 -> 0
A735: IRV | B735: w_is_not_condorcet_winner_ut_rel_ctb | E735: 0.32379999999999998 | F735: 0.32379999999999998 | G735: 10000 | H735: 33 | I735: 5 | J735: Spheroid | K735: Stretching | L735: 1 | S735: =F735-E735 -> 0
A736: IRV | B736: w_missed_condorcet_winner_ut_rel_ctb | E736: 7.8200000000000006E-2 | F736: 7.8200000000000006E-2 | G736: 10000 | H736: 33 | I736: 5 | J736: Spheroid | K736: Stretching | L736: 1 | S736: =F736-E736 -> 0
A737: IRV | B737: w_is_condorcet_winner_ut_rel | E737: 0.67620000000000002 | F737: 0.67620000000000002 | G737: 10000 | H737: 33 | I737: 5 | J737: Spheroid | K737: Stretching | L737: 1 | S737: =F737-E737 -> 0
A738: IRV | B738: w_is_not_condorcet_winner_ut_rel | E738: 0.32379999999999998 | F738: 0.32379999999999998 | G738: 10000 | H738: 33 | I738: 5 | J738: Spheroid | K738: Stretching | L738: 1 | S738: =F738-E738 -> 0
A739: IRV | B739: w_missed_condorcet_winner_ut_rel | E739: 7.8200000000000006E-2 | F739: 7.8200000000000006E-2 | G739: 10000 | H739: 33 | I739: 5 | J739: Spheroid | K739: Stretching | L739: 1 | S739: =F739-E739 -> 0
A740: IRV | B740: w_is_condorcet_winner_ut_abs_ctb | E740: 0.67620000000000002 | F740: 0.67620000000000002 | G740: 10000 | H740: 33 | I740: 5 | J740: Spheroid | K740: Stretching | L740: 1 | S740: =F740-E740 -> 0
A741: IRV | B741: w_is_not_condorcet_winner_ut_abs_ctb | E741: 0.32379999999999998 | F741: 0.32379999999999998 | G741: 10000 | H741: 33 | I741: 5 | J741: Spheroid | K741: Stretching | L741: 1 | S741: =F741-E741 -> 0
A742: IRV | B742: w_missed_condorcet_winner_ut_abs_ctb | E742: 7.8200000000000006E-2 | F742: 7.8200000000000006E-2 | G742: 10000 | H742: 33 | I742: 5 | J742: Spheroid | K742: Stretching | L742: 1 | S742: =F742-E742 -> 0
A743: IRV | B743: w_is_condorcet_winner_ut_abs | E743: 0.67620000000000002 | F743: 0.67620000000000002 | G743: 10000 | H743: 33 | I743: 5 | J743: Spheroid | K743: Stretching | L743: 1 | S743: =F743-E743 -> 0
A744: IRV | B744: w_is_not_condorcet_winner_ut_abs | E744: 0.32379999999999998 | F744: 0.32379999999999998 | G744: 10000 | H744: 33 | I744: 5 | J744: Spheroid | K744: Stretching | L744: 1 | S744: =F744-E744 -> 0
A745: IRV | B745: w_missed_condorcet_winner_ut_abs | E745: 7.8200000000000006E-2 | F745: 7.8200000000000006E-2 | G745: 10000 | H745: 33 | I745: 5 | J745: Spheroid | K745: Stretching | L745: 1 | S745: =F745-E745 -> 0
A746: IRV | B746: w_is_resistant_condorcet_winner | E746: 3.7000000000000002E-3 | F746: 3.7000000000000002E-3 | G746: 10000 | H746: 33 | I746: 5 | J746: Spheroid | K746: Stretching | L746: 1 | S746: =F746-E746 -> 0
A747: IRV | B747: w_is_not_resistant_condorcet_winner | E747: 0.99629999999999996 | F747: 0.99629999999999996 | G747: 10000 | H747: 33 | I747: 5 | J747: Spheroid | K747: Stretching | L747: 1 | S747: =F747-E747 -> 0
A748: IRV | B748: w_missed_resistant_condorcet_winner | E748: 0 | F748: 0 | G748: 10000 | H748: 33 | I748: 5 | J748: Spheroid | K748: Stretching | L748: 1 | S748: =F748-E748 -> 0
A749: IRV | B749: TM | C749: TM_option = exact | D749: 0.30752200000000002 | E749: 0.33050000000000002 | F749: 0.33050000000000002 | G749: 10000 | H749: 33 | I749: 5 | J749: Spheroid | K749: Stretching | L749: 1 | S749: =F749-E749 -> 0
A750: IRV | B750: UM | C750: UM_option = exact | D750: 2.250162 | E750: 0.33050000000000002 | F750: 0.33050000000000002 | G750: 10000 | H750: 33 | I750: 5 | J750: Spheroid | K750: Stretching | L750: 1 | S750: =F750-E750 -> 0
A751: IRV | B751: ICM | C751: ICM_option = exact | D751: 0.29802200000000001 | E751: 0.32379999999999998 | F751: 0.32379999999999998 | G751: 10000 | H751: 33 | I751: 5 | J751: Spheroid | K751: Stretching | L751: 1 | S751: =F751-E751 -> 0
A752: IRV | B752: CM | C752: CM_option = exact | D752: 8.4895320000000005 | E752: 0.43940000000000001 | F752: 0.43940000000000001 | G752: 10000 | H752: 33 | I752: 5 | J752: Spheroid | K752: Stretching | L752: 1 | S752: =F752-E752 -> 0
A753: Absolute-Condorcet IRV | B753: w_is_condorcet_admissible | E753: 0.75439999999999996 | F753: 0.75439999999999996 | G753: 10000 | H753: 33 | I753: 5 | J753: Spheroid | K753: Stretching | L753: 1 | S753: =F753-E753 -> 0
A754: Absolute-Condorcet IRV | B754: w_is_not_condorcet_admissible | E754: 0.24560000000000001 | F754: 0.24560000000000001 | G754: 10000 | H754: 33 | I754: 5 | J754: Spheroid | K754: Stretching | L754: 1 | S754: =F754-E754 -> 0
A755: Absolute-Condorcet IRV | B755: w_missed_condorcet_admissible | E755: 0 | F755: 0 | G755: 10000 | H755: 33 | I755: 5 | J755: Spheroid | K755: Stretching | L755: 1 | S755: =F755-E755 -> 0
A756: Absolute-Condorcet IRV | B756: w_is_weak_condorcet_winner | E756: 0.75439999999999996 | F756: 0.75439999999999996 | G756: 10000 | H756: 33 | I756: 5 | J756: Spheroid | K756: Stretching | L756: 1 | S756: =F756-E756 -> 0
A757: Absolute-Condorcet IRV | B757: w_is_not_weak_condorcet_winner | E757: 0.24560000000000001 | F757: 0.24560000000000001 | G757: 10000 | H757: 33 | I757: 5 | J757: Spheroid | K757: Stretching | L757: 1 | S757: =F757-E757 -> 0
A758: Absolute-Condorcet IRV | B758: w_missed_weak_condorcet_winner | E758: 0 | F758: 0 | G758: 10000 | H758: 33 | I758: 5 | J758: Spheroid | K758: Stretching | L758: 1 | S758: =F758-E758 -> 0
A759: Absolute-Condorcet IRV | B759: w_is_condorcet_winner_rk_ctb | E759: 0.75439999999999996 | F759: 0.75439999999999996 | G759: 10000 | H759: 33 | I759: 5 | J759: Spheroid | K759: Stretching | L759: 1 | S759: =F759-E759 -> 0
A760: Absolute-Condorcet IRV | B760: w_is_not_condorcet_winner_rk_ctb | E760: 0.24560000000000001 | F760: 0.24560000000000001 | G760: 10000 | H760: 33 | I760: 5 | J760: Spheroid | K760: Stretching | L760: 1 | S760: =F760-E760 -> 0
A761: Absolute-Condorcet IRV | B761: w_missed_condorcet_winner_rk_ctb | E761: 0 | F761: 0 | G761: 10000 | H761: 33 | I761: 5 | J761: Spheroid | K761: Stretching | L761: 1 | S761: =F761-E761 -> 0
A762: Absolute-Condorcet IRV | B762: w_is_condorcet_winner_rk | E762: 0.75439999999999996 | F762: 0.75439999999999996 | G762: 10000 | H762: 33 | I762: 5 | J762: Spheroid | K762: Stretching | L762: 1 | S762: =F762-E762 -> 0
A763: Absolute-Condorcet IRV | B763: w_is_not_condorcet_winner_rk | E763: 0.24560000000000001 | F763: 0.24560000000000001 | G763: 10000 | H763: 33 | I763: 5 | J763: Spheroid | K763: Stretching | L763: 1 | S763: =F763-E763 -> 0
A764: Absolute-Condorcet IRV | B764: w_missed_condorcet_winner_rk | E764: 0 | F764: 0 | G764: 10000 | H764: 33 | I764: 5 | J764: Spheroid | K764: Stretching | L764: 1 | S764: =F764-E764 -> 0
A765: Absolute-Condorcet IRV | B765: w_is_condorcet_winner_ut_rel_ctb | E765: 0.75439999999999996 | F765: 0.75439999999999996 | G765: 10000 | H765: 33 | I765: 5 | J765: Spheroid | K765: Stretching | L765: 1 | S765: =F765-E765 -> 0
A766: Absolute-Condorcet IRV | B766: w_is_not_condorcet_winner_ut_rel_ctb | E766: 0.24560000000000001 | F766: 0.24560000000000001 | G766: 10000 | H766: 33 | I766: 5 | J766: Spheroid | K766: Stretching | L766: 1 | S766: =F766-E766 -> 0
A767: Absolute-Condorcet IRV | B767: w_missed_condorcet_winner_ut_rel_ctb | E767: 0 | F767: 0 | G767: 10000 | H767: 33 | I767: 5 | J767: Spheroid | K767: Stretching | L767: 1 | S767: =F767-E767 -> 0
A768: Absolute-Condorcet IRV | B768: w_is_condorcet_winner_ut_rel | E768: 0.75439999999999996 | F768: 0.75439999999999996 | G768: 10000 | H768: 33 | I768: 5 | J768: Spheroid | K768: Stretching | L768: 1 | S768: =F768-E768 -> 0
A769: Absolute-Condorcet IRV | B769: w_is_not_condorcet_winner_ut_rel | E769: 0.24560000000000001 | F769: 0.24560000000000001 | G769: 10000 | H769: 33 | I769: 5 | J769: Spheroid | K769: Stretching | L769: 1 | S769: =F769-E769 -> 0
A770: Absolute-Condorcet IRV | B770: w_missed_condorcet_winner_ut_rel | E770: 0 | F770: 0 | G770: 10000 | H770: 33 | I770: 5 | J770: Spheroid | K770: Stretching | L770: 1 | S770: =F770-E770 -> 0
A771: Absolute-Condorcet IRV | B771: w_is_condorcet_winner_ut_abs_ctb | E771: 0.75439999999999996 | F771: 0.75439999999999996 | G771: 10000 | H771: 33 | I771: 5 | J771: Spheroid | K771: Stretching | L771: 1 | S771: =F771-E771 -> 0
A772: Absolute-Condorcet IRV | B772: w_is_not_condorcet_winner_ut_abs_ctb | E772: 0.24560000000000001 | F772: 0.24560000000000001 | G772: 10000 | H772: 33 | I772: 5 | J772: Spheroid | K772: Stretching | L772: 1 | S772: =F772-E772 -> 0
A773: Absolute-Condorcet IRV | B773: w_missed_condorcet_winner_ut_abs_ctb | E773: 0 | F773: 0 | G773: 10000 | H773: 33 | I773: 5 | J773: Spheroid | K773: Stretching | L773: 1 | S773: =F773-E773 -> 0
A774: Absolute-Condorcet IRV | B774: w_is_condorcet_winner_ut_abs | E774: 0.75439999999999996 | F774: 0.75439999999999996 | G774: 10000 | H774: 33 | I774: 5 | J774: Spheroid | K774: Stretching | L774: 1 | S774: =F774-E774 -> 0
A775: Absolute-Condorcet IRV | B775: w_is_not_condorcet_winner_ut_abs | E775: 0.24560000000000001 | F775: 0.24560000000000001 | G775: 10000 | H775: 33 | I775: 5 | J775: Spheroid | K775: Stretching | L775: 1 | S775: =F775-E775 -> 0
A776: Absolute-Condorcet IRV | B776: w_missed_condorcet_winner_ut_abs | E776: 0 | F776: 0 | G776: 10000 | H776: 33 | I776: 5 | J776: Spheroid | K776: Stretching | L776: 1 | S776: =F776-E776 -> 0
A777: Absolute-Condorcet IRV | B777: w_is_resistant_condorcet_winner | E777: 3.7000000000000002E-3 | F777: 3.7000000000000002E-3 | G777: 10000 | H777: 33 | I777: 5 | J777: Spheroid | K777: Stretching | L777: 1 | S777: =F777-E777 -> 0
A778: Absolute-Condorcet IRV | B778: w_is_not_resistant_condorcet_winner | E778: 0.99629999999999996 | F778: 0.99629999999999996 | G778: 10000 | H778: 33 | I778: 5 | J778: Spheroid | K778: Stretching | L778: 1 | S778: =F778-E778 -> 0
A779: Absolute-Condorcet IRV | B779: w_missed_resistant_condorcet_winner | E779: 0 | F779: 0 | G779: 10000 | H779: 33 | I779: 5 | J779: Spheroid | K779: Stretching | L779: 1 | S779: =F779-E779 -> 0
A780: Absolute-Condorcet IRV | B780: TM | C780: TM_option = exact | D780: 83.114549999999994 | E780: 0.27239999999999998 | F780: 0.27239999999999998 | G780: 10000 | H780: 33 | I780: 5 | J780: Spheroid | K780: Stretching | L780: 1 | S780: =F780-E780 -> 0
A781: Absolute-Condorcet IRV | B781: UM | C781: UM_option = exact | D781: 4761.0893649999998 | E781: 0.27289999999999998 | F781: 0.27289999999999998 | G781: 10000 | H781: 33 | I781: 5 | J781: Spheroid | K781: Stretching | L781: 1 | S781: =F781-E781 -> 0
A782: Absolute-Condorcet IRV | B782: ICM | C782: ICM_option = exact | D782: 0.84604999999999997 | E782: 0.24560000000000001 | F782: 0.24560000000000001 | G782: 10000 | H782: 33 | I782: 5 | J782: Spheroid | K782: Stretching | L782: 1 | S782: =F782-E782 -> 0
A783: Absolute-Condorcet IRV | B783: CM | C783: CM_option = almost_exact, TM_option = exact | D783: 4.346762 | E783: 0.43940000000000001 | F783: 0.43940000000000001 | G783: 10000 | H783: 33 | I783: 5 | J783: Spheroid | K783: Stretching | L783: 1 | S783: =F783-E783 -> 0
A784: VTB-Condorcet IRV | B784: w_is_condorcet_admissible | E784: 0.75439999999999996 | F784: 0.75439999999999996 | G784: 10000 | H784: 33 | I784: 5 | J784: Spheroid | K784: Stretching | L784: 1 | S784: =F784-E784 -> 0
A785: VTB-Condorcet IRV | B785: w_is_not_condorcet_admissible | E785: 0.24560000000000001 | F785: 0.24560000000000001 | G785: 10000 | H785: 33 | I785: 5 | J785: Spheroid | K785: Stretching | L785: 1 | S785: =F785-E785 -> 0
A786: VTB-Condorcet IRV | B786: w_missed_condorcet_admissible | E786: 0 | F786: 0 | G786: 10000 | H786: 33 | I786: 5 | J786: Spheroid | K786: Stretching | L786: 1 | S786: =F786-E786 -> 0
A787: VTB-Condorcet IRV | B787: w_is_weak_condorcet_winner | E787: 0.75439999999999996 | F787: 0.75439999999999996 | G787: 10000 | H787: 33 | I787: 5 | J787: Spheroid | K787: Stretching | L787: 1 | S787: =F787-E787 -> 0
A788: VTB-Condorcet IRV | B788: w_is_not_weak_condorcet_winner | E788: 0.24560000000000001 | F788: 0.24560000000000001 | G788: 10000 | H788: 33 | I788: 5 | J788: Spheroid | K788: Stretching | L788: 1 | S788: =F788-E788 -> 0
A789: VTB-Condorcet IRV | B789: w_missed_weak_condorcet_winner | E789: 0 | F789: 0 | G789: 10000 | H789: 33 | I789: 5 | J789: Spheroid | K789: Stretching | L789: 1 | S789: =F789-E789 -> 0
A790: VTB-Condorcet IRV | B790: w_is_condorcet_winner_rk_ctb | E790: 0.75439999999999996 | F790: 0.75439999999999996 | G790: 10000 | H790: 33 | I790: 5 | J790: Spheroid | K790: Stretching | L790: 1 | S790: =F790-E790 -> 0
A791: VTB-Condorcet IRV | B791: w_is_not_condorcet_winner_rk_ctb | E791: 0.24560000000000001 | F791: 0.24560000000000001 | G791: 10000 | H791: 33 | I791: 5 | J791: Spheroid | K791: Stretching | L791: 1 | S791: =F791-E791 -> 0
A792: VTB-Condorcet IRV | B792: w_missed_condorcet_winner_rk_ctb | E792: 0 | F792: 0 | G792: 10000 | H792: 33 | I792: 5 | J792: Spheroid | K792: Stretching | L792: 1 | S792: =F792-E792 -> 0
A793: VTB-Condorcet IRV | B793: w_is_condorcet_winner_rk | E793: 0.75439999999999996 | F793: 0.75439999999999996 | G793: 10000 | H793: 33 | I793: 5 | J793: Spheroid | K793: Stretching | L793: 1 | S793: =F793-E793 -> 0
A794: VTB-Condorcet IRV | B794: w_is_not_condorcet_winner_rk | E794: 0.24560000000000001 | F794: 0.24560000000000001 | G794: 10000 | H794: 33 | I794: 5 | J794: Spheroid | K794: Stretching | L794: 1 | S794: =F794-E794 -> 0
A795: VTB-Condorcet IRV | B795: w_missed_condorcet_winner_rk | E795: 0 | F795: 0 | G795: 10000 | H795: 33 | I795: 5 | J795: Spheroid | K795: Stretching | L795: 1 | S795: =F795-E795 -> 0
A796: VTB-Condorcet IRV | B796: w_is_condorcet_winner_ut_rel_ctb | E796: 0.75439999999999996 | F796: 0.75439999999999996 | G796: 10000 | H796: 33 | I796: 5 | J796: Spheroid | K796: Stretching | L796: 1 | S796: =F796-E796 -> 0
A797: VTB-Condorcet IRV | B797: w_is_not_condorcet_winner_ut_rel_ctb | E797: 0.24560000000000001 | F797: 0.24560000000000001 | G797: 10000 | H797: 33 | I797: 5 | J797: Spheroid | K797: Stretching | L797: 1 | S797: =F797-E797 -> 0
A798: VTB-Condorcet IRV | B798: w_missed_condorcet_winner_ut_rel_ctb | E798: 0 | F798: 0 | G798: 10000 | H798: 33 | I798: 5 | J798: Spheroid | K798: Stretching | L798: 1 | S798: =F798-E798 -> 0
A799: VTB-Condorcet IRV | B799: w_is_condorcet_winner_ut_rel | E799: 0.75439999999999996 | F799: 0.75439999999999996 | G799: 10000 | H799: 33 | I799: 5 | J799: Spheroid | K799: Stretching | L799: 1 | S799: =F799-E799 -> 0
A800: VTB-Condorcet IRV | B800: w_is_not_condorcet_winner_ut_rel | E800: 0.24560000000000001 | F800: 0.24560000000000001 | G800: 10000 | H800: 33 | I800: 5 | J800: Spheroid | K800: Stretching | L800: 1 | S800: =F800-E800 -> 0
A801: VTB-Condorcet IRV | B801: w_missed_condorcet_winner_ut_rel | E801: 0 | F801: 0 | G801: 10000 | H801: 33 | I801: 5 | J801: Spheroid | K801: Stretching | L801: 1 | S801: =F801-E801 -> 0
A802: VTB-Condorcet IRV | B802: w_is_condorcet_winner_ut_abs_ctb | E802: 0.75439999999999996 | F802: 0.75439999999999996 | G802: 10000 | H802: 33 | I802: 5 | J802: Spheroid | K802: Stretching | L802: 1 | S802: =F802-E802 -> 0
A803: VTB-Condorcet IRV | B803: w_is_not_condorcet_winner_ut_abs_ctb | E803: 0.24560000000000001 | F803: 0.24560000000000001 | G803: 10000 | H803: 33 | I803: 5 | J803: Spheroid | K803: Stretching | L803: 1 | S803: =F803-E803 -> 0
A804: VTB-Condorcet IRV | B804: w_missed_condorcet_winner_ut_abs_ctb | E804: 0 | F804: 0 | G804: 10000 | H804: 33 | I804: 5 | J804: Spheroid | K804: Stretching | L804: 1 | S804: =F804-E804 -> 0
A805: VTB-Condorcet IRV | B805: w_is_condorcet_winner_ut_abs | E805: 0.75439999999999996 | F805: 0.75439999999999996 | G805: 10000 | H805: 33 | I805: 5 | J805: Spheroid | K805: Stretching | L805: 1 | S805: =F805-E805 -> 0
A806: VTB-Condorcet IRV | B806: w_is_not_condorcet_winner_ut_abs | E806: 0.24560000000000001 | F806: 0.24560000000000001 | G806: 10000 | H806: 33 | I806: 5 | J806: Spheroid | K806: Stretching | L806: 1 | S806: =F806-E806 -> 0
A807: VTB-Condorcet IRV | B807: w_missed_condorcet_winner_ut_abs | E807: 0 | F807: 0 | G807: 10000 | H807: 33 | I807: 5 | J807: Spheroid | K807: Stretching | L807: 1 | S807: =F807-E807 -> 0
A808: VTB-Condorcet IRV | B808: w_is_resistant_condorcet_winner | E808: 3.7000000000000002E-3 | F808: 3.7000000000000002E-3 | G808: 10000 | H808: 33 | I808: 5 | J808: Spheroid | K808: Stretching | L808: 1 | S808: =F808-E808 -> 0
A809: VTB-Condorcet IRV | B809: w_is_not_resistant_condorcet_winner | E809: 0.99629999999999996 | F809: 0.99629999999999996 | G809: 10000 | H809: 33 | I809: 5 | J809: Spheroid | K809: Stretching | L809: 1 | S809: =F809-E809 -> 0
A810: VTB-Condorcet IRV | B810: w_missed_resistant_condorcet_winner | E810: 0 | F810: 0 | G810: 10000 | H810: 33 | I810: 5 | J810: Spheroid | K810: Stretching | L810: 1 | S810: =F810-E810 -> 0
A811: VTB-Condorcet IRV | B811: TM | C811: TM_option = exact | D811: 65.179501999999999 | E811: 0.27239999999999998 | F811: 0.27239999999999998 | G811: 10000 | H811: 33 | I811: 5 | J811: Spheroid | K811: Stretching | L811: 1 | S811: =F811-E811 -> 0
A812: VTB-Condorcet IRV | B812: UM | C812: UM_option = exact | D812: 3325.3509180000001 | E812: 0.27289999999999998 | F812: 0.27289999999999998 | G812: 10000 | H812: 33 | I812: 5 | J812: Spheroid | K812: Stretching | L812: 1 | S812: =F812-E812 -> 0
A813: VTB-Condorcet IRV | B813: ICM | C813: ICM_option = exact | D813: 0.88854900000000003 | E813: 0.24560000000000001 | F813: 0.24560000000000001 | G813: 10000 | H813: 33 | I813: 5 | J813: Spheroid | K813: Stretching | L813: 1 | S813: =F813-E813 -> 0
A814: VTB-Condorcet IRV | B814: CM | C814: CM_option = almost_exact, TM_option = exact | D814: 31.269362000000001 | E814: 0.43940000000000001 | F814: 0.43940000000000001 | G814: 10000 | H814: 33 | I814: 5 | J814: Spheroid | K814: Stretching | L814: 1 | S814: =F814-E814 -> 0